reviewID,hotelid,userName,overall,roomComfort,staffMetNeeds,cleanRoom,facilitiesMetExpectations,ageRangeID,tripPurposeID,travelAgent,meetingPlanner,BPGStatusID,guestFrom,arrivalMonth,datePosted,recommend,everyoneShouldKnow,frequencyID,title,comment
346024,344,BrianGoldBPG,5,4,5,5,5,4,4,FALSE,FALSE,3,Bay Area,10/[YEAR-0],11/8/[YEAR-0],TRUE,Great Club Lounge,2,I've fallen in love with Belvoir all over again...,"I've stayed at several Belvoir hotels recently and I must admit that they been sub-par or average at best. I noticed online that the Gateway had been recently remodeled and had mostly good reviews so I decided to give Belvoir one more try. I'm so glad I did! This was one of the best hotel stays I've ever had. EVERYONE I encountered was friendly and accommodating, the bed was super comfortable and I loved the gym, pool and hot tub. Hats off to the entire management team and staff members for a well deserved 5-star review. I spent 4 nights there and didn't want to leave."
346112,15,Bob648,1,1,3,1,1,4,4,FALSE,FALSE,3,"Massachusetts, USA",7/[YEAR-0],11/8/[YEAR-0],FALSE,Needs upgrade - way below other properties,4,Dirtiest hotel I've ever stayed at,Was there over the 4 th of July weekend -was upgraded to Club Class - hotel short staffed for holiday weekend- room was absolutely the dirtiest room I've stayed in . No Air conditioning despite 98 degree weather-have pictures of dirty phone and room-understand they are refurbishing the hotel- why not start at the club level- happy with every other BPG stay but this one- work in adjacent area and will not recommend !
346586,1725,Bostonian22,3,4,3,5,4,4,5,FALSE,FALSE,1,"Boston, MA, USA",11/[YEAR-0],11/9/[YEAR-0],TRUE,Don't be in a hurry to eat when you use the dining room.,2,One Drawback,The only issues I had were with the restaurant facilities which seemed to be always understaffed. The waitstaff were all pleasant and very accommodating but they took a long time to get things moving.
346765,989,NotImpressed[YEAR-0],2,1,4,2,1,4,5,FALSE,FALSE,2,"Springfield, MA, USA",11/[YEAR-0],11/9/[YEAR-0],FALSE,"room are very dated, staff was very friendly.",4,Our stay,"Room is dated, some other guests laundry in closet."
346889,664,JimFla,4,,,,,5,8,TRUE,FALSE,2,"West Palm Beach, FL, USA",11/[YEAR-0],11/9/[YEAR-0],TRUE,Verify special requests at check in.,4,Room requests not met,Nov. [YEAR-0]
346939,198,Louise61,5,5,4,5,5,5,7,FALSE,FALSE,3,"Rockford, IL, USA",10/[YEAR-0],11/9/[YEAR-0],TRUE,This hotel exceeded all of our needs & expectations.,2,This hotel exceeded our expectations!,We began an 8 day road trip to Georgia and onto Florida by reserving two rooms at the Music City Belvoir in Nashville for our first night away. We were so impressed we decided to return to stay again on our very last night.
347087,995,TH66,2,2,5,2,2,4,3,FALSE,FALSE,3,"Napa, CA, USA",11/[YEAR-0],11/9/[YEAR-0],FALSE,"Fine for families, not good for the business traveler",4,Not for a business traveler,"The staff was fantastic, but this hotel is not for the business traveler. Belvoir notoriously has the worst desk - with no outlets to plug in a computer, but many facilities will have a lamp with a plug in or a strip outlet. This property had nothing. It's also in desperate need of a renovation."
347358,1703,VincentF,3,5,3,5,2,3,3,FALSE,FALSE,3,midwest,11/[YEAR-0],11/9/[YEAR-0],FALSE,"Expect to pay the high ransom for internet service, breakfast, and toiletries because they know you have little choices. Free internet is in the lobby lounge, but there there are few plugs and no privacy to work.",4,Pricey plus,"Gorgeous hotel!! Great rooms, quiet and comfy. Much too costly, AND they charge $13 extra for internet service in rooms. The breakfast is limited in choices, poorly prepared and NOT worth the $18, but nothing else is within walking distance. The gift shop prices are outrageous for very limited toiletries and sundries, and no other shops in walking distance. This is a hotel for the 1%ers. The Phoenix ""downtown"" is desolate."
347713,3675,Marlene64,5,5,5,5,5,5,7,FALSE,TRUE,2,"Tucson, AZ, USA",10/[YEAR-0],11/9/[YEAR-0],TRUE,They will help you with anything!,2,Loved the staff,The staff at this hotel is very accommodating and very friendly. I loved the bed and slept the best I have in a long time.
347817,865,DrTom,2,4,2,4,2,5,3,FALSE,FALSE,1,"Sidney, OH",11/[YEAR-0],11/9/[YEAR-0],FALSE,Poor quality food priced as if it is high quality food.,2,Service and food,"The building is beautiful and elegant both outside and inside. After you are overwhelmed by the interior you stand at the front desk waiting to be served..... Finally you get your room and it is a nice room. The cleaning staff forgot the coffee so two calls and two hours later we had coffee. The website said that the restauant served breakfast, lunch, and dinner with a breakfast or salad bar but only had one out of three. This was good since the food was outrageously overpriced and of very poor quality. If you stay there, just plan on eating out and enjoy the building"
347957,1776,MrTee,5,5,5,5,5,6,2,FALSE,FALSE,3,Potomac MD,11/[YEAR-0],11/9/[YEAR-0],TRUE,Great location with spectacular views of Philadelphia,4,Wonderful Experience,"Great facilty, great location, wonderful friendly staff make me look forward to each time I visit this hotel. It is convenient to all downtown businesses, events, and tourist attractions. The staff, from top to bottom, is friendly and go out of their way to assist guests in anyway possible. I would not consider staying anywhere else in Philadelphia."
348091,942,FlyingGypsy67,4,4,5,5,5,3,3,FALSE,FALSE,1,"Raleigh, NC, USA",11/[YEAR-0],11/9/[YEAR-0],TRUE,The staff is outstanding!,1,Fantastic Staff!,"I stayed two nights (November 4-5) as part of an Amnesty International conference. Staff at the hotel were -- without fail -- hospitable, efficient and skilled. Every individual I interacted with, from the courtesy van driver, to the bar staff, to the clerks at the front desk was excellent."
348506,177,Ralph,2,2,3,3,1,5,5,FALSE,FALSE,3,"Cleveland, Ohio",2/[YEAR-0],11/9/[YEAR-0],FALSE,Old and dirty.,3,Don't do it.,"I've stayed here for at least a week at a time in February for a number of years. The facility has steadily gone down, and is now at a point where I will not consider it again. The hallways and rooms are run down and in need of a major renovation and pets are allowed in any room. The place is loaded with dogs that should be limited to the first floor only. Never again."
348518,158,Lulucas,3,3,1,2,2,4,4,FALSE,TRUE,2,"Indiana,",11/[YEAR-0],11/9/[YEAR-0],FALSE,,2,Convenience,"Being a female business traveler, the convenience of registering at the front desk and unloading luggage is an attraction to certain hotels. Tonight I checked in and the valet said it would cost me $10 to leave my car parked in the front only to take my bags to my room. He proceeded to tell me free parking was provided in the garage. Check in desk offered no assistance. Off I go to the parking garage and pull my suitcase and computer bag across the skybridge to the 6th floor. Then back out of my room for a meeting. Now why does it cost $10 to simply unload your vehicle and then move the car. It looks to me your valet is trying to make $10 where he can. A hotel of this size has no where to unload. Or use the bellman and give him $10 to carry your bags. Very sad at the lack of customer service."
348656,3052,Mooner,4,4,5,4,4,5,8,FALSE,FALSE,2,"Albany, NY, USA",7/[YEAR-0],11/10/[YEAR-0],TRUE,"Great location for walking Tribeca, SoHo, and Chinatown",3,Great Tribecca Addition,"Belvoir Tribeca 's location, straddling SoHo (directly above), Tribeca (directly below), China Town, and Little Italy, (short walks East), make it an ideal setting for exploring these very diverse and fascinating ' real New York City' neighborhoods, with such a wide range of architectures, shopping (international designers to street-corner hat sellers), dining opportunities, (from best-of-NY (e.g. NOBU) - to great pizza-slice joints). And close-by A-C-E and #6 Subway lines offer quick access to the rest of Manhattan."
348986,421,DebinSTL,3,3,1,4,3,4,6,FALSE,FALSE,4,"St Louis, MO, USA",11/[YEAR-0],11/10/[YEAR-0],TRUE,Great location - service is substandard,2,Front Desk staff is horrible,"This was our first stay since achieving platinum status with Grandbourne and I was expecting a little recognition for our loyalty. What I received was the worst front desk staff I have ever seen. I had to ask for all the priviledges that a platinum member was entitled too instead of them being automatically offered. And each time I stopped at the front desk to ask about the club lounge access or something else, the staff seemed annoyed with me. This hotel has nice but very small rooms and the location just can't be beat."
349032,166,nettiefritz1,4,4,5,5,4,5,5,FALSE,FALSE,2,"Weston, fl",11/[YEAR-0],11/10/[YEAR-0],TRUE,,3,Great service,The only two downsides to the hotel were lack of drawer space (no dressers) and a vault. Otherwise the bed was extremely comfortable and we were very happy with the service.
349093,861,Danielt,4,4,5,5,2,6,3,FALSE,FALSE,2,"Palo Alto, CA, USA",11/[YEAR-0],11/10/[YEAR-0],TRUE,,2,Problems,Charging me $2.23 each time I made a toll free 800 number phone call is outrageous. The in room wifi was spotty at best and unavailable frequently. The room is poorly lit making it hard to read in the room.
349258,1765,Globalgirlster,1,2,1,1,1,3,3,FALSE,FALSE,2,San Francisco Bay Area,10/[YEAR-0],11/10/[YEAR-0],FALSE,Stay at the Inner Harbor instead.,4,Hotel Needs A Reno -- STAT!,I stayed at the Belvoir Baltimore City Center recently for a conference and I was disappointed at every turn.
349404,380,Ericb,3,3,2,2,2,5,6,FALSE,FALSE,2,"Maui, HI",11/[YEAR-0],11/10/[YEAR-0],FALSE,Great location. Facility is getting old.,3,princess kaiulani,"This was my third stay here and I was very disappointed in several ways. They had a room ready when I arrived early in the day but I had to downgrade my room to a different building to get it because of electrical problems in the area I reserved. When we returned to our room after 4 pm the next day, room service had still not cleaned the room. The breakfast bufffet was really terrible and over priced. The pancakes were dried out & hard, eggs cold and hard."
349480,377,Steve8857,1,3,1,2,1,,4,FALSE,TRUE,2,Michigan,10/[YEAR-0],11/10/[YEAR-0],FALSE,"Be wary. Service is uneven, fragmented.",3,My 2nd (and probaly last) stay,"My first experience with this hotel occurred a couple of years ago. There were a number of disconcerting problems which I shrugged off as anomalies. I returned for a 2nd week-long stay last month. I was terribly disappointed. I had to wait in a very long check-in line only to find my room reservation was wrong. That took a full day to fix. I had to move into another room. After a day there, the A/C started leaking, soaking the carpet and leaving a moldy smell for the rest of my stay. I tried repeatedly to get this fixed and was ignored. Service was uneven. I felt treated as a low class citizen compared to the ""BPG Elite"" customers who frequently get to the front of the rest of us who had been waiting in long lines. To cap off the sub-par experience, at checkout I was surprised to be hit with WiFi fees that had been advertised as free. That took yet another call to management to fix. Given the price to stay there, I had expected a little better treatment. There is something terribly fragmented and uneven about the service here. Be wary. It's not as nice as it looks."
349500,3068,ShannonDoor,3,1,4,4,3,4,3,FALSE,FALSE,1,"Harrisonburg, VA",11/[YEAR-0],11/10/[YEAR-0],FALSE,"It is very well kept, clean. Internet is not free.",2,Noisy Room,"A nice facility hampered by unacceptable mechanical systems noises in my room, Room 434. HVAC dampers slamming shut and water hammer of pipes would have made anything other than a heavy sleeper think that they were in a haunted house. Just way too noisy. And why in the world would one want to pay for in house internet?"
349844,3175,Cowboys,3,4,2,4,3,4,7,FALSE,FALSE,2,"Las Vegas, NV, USA",11/[YEAR-0],11/10/[YEAR-0],FALSE,Good location for Arlingtons great attractions,3,Trying to be nice.,"I will keep this short. We were told that our room was not ready and that they would contact us thru my cell when it was. Even asked for the number, never got a call. We asked for adjoining rooms, they said we got you adjoining rooms. I guess we should be happy they were on the same floor. I asked do you have wi-fi they said yes, I should have asked if they have working wi-fi."
349950,1776,Gina,5,5,5,5,5,3,8,FALSE,FALSE,2,"LI, NY",11/[YEAR-0],11/10/[YEAR-0],TRUE,Everything was worth the price.,1,Excellent Stay,"Other than the extended wait to check in because our room was not ready. Our overall experience and stay was EXCELLENT. The 1 king bedroom room was very spacious, sexy and comfortable. The room looks exactly like the picture on the website. Belvoir staff, keep up the good work. Customer service means EVERYTHING!"
350105,421,Cookie26,5,5,5,5,5,6,7,FALSE,FALSE,3,"Phoenix, AZ, USA",11/[YEAR-0],11/10/[YEAR-0],TRUE,Very Clean - in the heart of the city,3,Fabulous Location,The updated rooms are great. The location of the hotel is within walking distance of all major attractions. You can't beat the price!
350172,756,1234,5,5,5,5,5,3,8,FALSE,FALSE,2,"Hartford, CT, USA",11/[YEAR-0],11/10/[YEAR-0],TRUE,Great Service!,3,Hospitality is outstanding,"The hotel staff gave us great service. They were prompt, polite, and accommodating, despite the fact that they were very busy the weekend we were there. They were extremely helpful."
350303,13,beauxeault,3,3,4,4,3,,4,FALSE,FALSE,4,,11/[YEAR-0],11/10/[YEAR-0],TRUE,,2,Good experience - average Belvoir,"My experience here was in line with what you generally expect at a typical Belvoir. Nice facilities that are not astounding but offer a good degree of comfort. As a BPG platinum member, I was upgraded to a room referred to as a ""suite,"" but which was actually a junior suite (i.e. the living area was not in a separate room from the sleeping area), but was grateful for the upgrade."
350652,989,FremontDave,5,5,5,5,5,5,4,FALSE,FALSE,2,"New Hampshire, USA",11/[YEAR-0],11/11/[YEAR-0],TRUE,"Great all-inclusive facilities - comfortable room and bed, fitness center (w/pool), location, business center, food, staff.",3,Great hotel with lots of available features,I stayed in a very clean and comfortable room. Great pool for lap swimming as it is a good size for a hotel pool and the exercise facility opens early. The food at the bar/restaurant was excellent and the staff was friendly. You do have to pay for parking that is part of the hotel but it is not too costly for an underground facility in a city. Internet service in the room also had a charge but access to a computer and printer at the business center was available for free.
350664,91,selcal,3,4,3,3,3,5,4,FALSE,FALSE,3,"Elk Grove, Elk Grove Village, IL 60007, USA",10/[YEAR-0],11/11/[YEAR-0],FALSE,transportation provided by this hotel is lacking,4,The transportation to and from the hotel is below par,"The transportation that is provide by this hotel is inferior to what this hotel offers. The van is old and dirty, the drivers barely understand English and is operated by an outside vendor. The van is not even painted the Belvoir logos. The hotel restaurant is very expensive and the food is below par. The closest restaurant within walking distance is about 1 mile."
350803,829,Cosmo57,4,4,3,5,2,4,8,FALSE,FALSE,2,"Richmond, VA",11/[YEAR-0],11/11/[YEAR-0],TRUE,Parking is $20/night.,1,City View vs DC View,"Overall experience to Belvoir National was great. However, during the reservation process, I specifically asked for a DC view room since it was the room type we had 25 years ago. When the confirmation was emailed to me, it showed City view so I called the property to inquire about the mixup. The property assured me we had a DC view room. Long story short, we ended up with a City view room. Very disappointed when we were told no DC view rooms available."
350827,693,luvtotravel,3,3,3,3,3,5,7,FALSE,FALSE,2,PA,9/[YEAR-0],11/11/[YEAR-0],TRUE,Ask for a riverview room,4,Elevator needs repaired,"You need to use your room key to punch in your floor number on the elevator. Everytime I did so, it would take me about 7 or 8 tries before it actually worked. Proved to be very frustrating and time consuming. The plate may need to be repaired."
350858,761,MrsM07,1,4,1,4,1,3,3,FALSE,FALSE,1,"Niagara Falls, NY, USA",11/[YEAR-0],11/11/[YEAR-0],FALSE,Their service is way below expectations,4,The service was horrible,"Room service contacted me after my expected delivery date of my breakfast to inform me that they had misplaced my meal card, needless to say breakfast was almost 30 minutes late!! I called guest services to inquire about what time the shuttles left and I was informed that they were made by appointment only. Why was I not informed of this prior to my stay?? When I called guest services a second time inquiring about taxi service I was assured that a taxi would be waiting when I came down to the lobby. Needless to say there were no avilable taxi's, I had to wait for one to be called. After 20 minutes of waiting a taxi finally arrived but it was not the one that was called. Once again needless to say I was late for a very important business meeting I was attending at the University of Michigan. My colleagues and I travel year round and I am very disappointed in the level or lack of service I received from beginning to end. I would never recommend anyone, business or personal to stay at any Belvoir especially when one nights stay was almost $200!!"
350891,115,DLR15,3,3,2,4,3,5,6,FALSE,FALSE,2,"Alabama, USA",11/[YEAR-0],11/11/[YEAR-0],FALSE,,3,Not up to par,Room and beds were small. No special areas for Grandbourne members. Took 30 minutes to park the car and get luggage up to the room. The staff was friendly but didn't seem to be well organized or trained.
350999,607,KansasNate,5,4,5,5,5,2,4,FALSE,FALSE,3,"Washington, DC, USA",11/[YEAR-0],11/11/[YEAR-0],TRUE,Great staff and location,2,"Excellent Location, Friendly Staff, Quirky Rooms",I frequently travel to Cambridge for business and I always try to stay at the Commander.
351423,421,DocLove,2,3,2,3,2,4,4,FALSE,FALSE,4,"San Francisco, CA, USA",1/[YEAR-1],11/11/[YEAR-0],TRUE,Value hotel so if its expensive avoid,4,Only good if you are paying a cheap rate,This is a value hotel in NYC for the Grandbourne brand so if you don't get a rate cheap rate you will be very disappointed most likely
351575,421,Drews,1,1,1,2,1,2,4,FALSE,FALSE,2,"Washington, DC, USA",11/[YEAR-0],11/11/[YEAR-0],FALSE,"Great location, terrible rooms and service",3,Terrible Hotel in a Great Location,"I experienced two major problems, one related to an unacceptable room, the other incompetent service."
352542,166,Annville21,1,,,,1,,5,FALSE,FALSE,1,,11/[YEAR-0],11/12/[YEAR-0],FALSE,Don't use the Valet!,,Valet service scraped my car,"We didn't notice until we drove home that we had the scrapes. The car is 4 months old. We called the vallet and they said there is nothing we can do. Very frustrating, because we haven't used valet before, so we didn't know what to look for."
353329,379,Janie,4,4,5,5,4,5,6,FALSE,FALSE,4,"San Diego, CA",11/[YEAR-0],11/12/[YEAR-0],TRUE,Amazing staff -- wonderful if you're a Grandbourne Platinum member.,3,Amazing Staff,"Wow, does it pay to be a platinum Grandbourne Member. Even though our ocean view room was to be vacated by noon and we had a flight leaving at 11:30 p.m., the Belvoir staff found us a room in their garden view section and let us stay until 8 p.m. -- no charge because I was a platinum member. Unbelievable! They were so courteous and friendly, we couldn't believe it. Although the hotel is undergoing some renovations, its location is perfect and the amenities noteworthy. Well worth the stay."
353685,171,jechho,2,1,3,2,2,3,8,FALSE,FALSE,4,Norway,8/[YEAR-0],11/13/[YEAR-0],FALSE,,4,Below average,"Not exactly thrilled with our stay at this hotel. I have stayed at several Belvoirs, and this is one of the worst."
353694,1582,jechho,4,3,4,4,4,3,8,FALSE,FALSE,4,Norway,8/[YEAR-0],11/13/[YEAR-0],TRUE,,4,"Good hotel, great service",Stayed here one night as a part of a roadtrip.
353766,760,HilltopGuy,5,5,5,5,5,6,6,FALSE,FALSE,2,North Georgia - Blue Ridge Mountains,11/[YEAR-0],11/13/[YEAR-0],TRUE,Free parking. Easy to get to and from your room. Totally relaxing atmosphere. Across the street from a great beach.,2,Wonderful Experience,"This hotel is perfect for a Key West visit. We loved the location which is away from the noise and clamor of Duval Street, across the street from a great beach. Beach is great for sunning, walking or just sitting enjoying the sun and breeze. Easy to get to ""the action"" on and around Duval Street and the docks. Shuttle transportation is available or rent scooters or bikes. Hotel staff is so acommodating and the rooms are gorgeous. We had a poolside room with great balcony and the mini bar was so nice as we could bring in some snacks or even fix sandwiches in the room. Nice poolside bar/restaurant and the pool is terrific. It is worth the price to have a nice place to stay. There are some less than attractive places in Key West and we were glad we paid a little more to get a great hotel. We don't get down there often and we are happy we picked such a wonderful spot. Go to the La Trattoria restaurant just down the street for a wonderful meal experience."
353856,1564,BZ53,4,4,5,3,4,5,4,FALSE,FALSE,2,"Davenport, FL",11/[YEAR-0],11/13/[YEAR-0],TRUE,Request water view rather than city view to stay away from city traffic noise below.,4,Friendly helpful staff,"Throughout my 3 day stay, interacted with Front Desk staff, Room Service staff, Bellman and Parking Garage Valets. All were friendly, professional & helpful. Food was good, bed was quite comfortable, clean sheets. Bathroom included very good quality personal items, plenty of soft clean towels. Plumbing was in order, water was hot. There was just a bit of dust around the floor lamp electrical socket, otherwise no problems. A definite recommend to stay here!"
354032,1991,Roadwarrior99,2,2,2,3,1,3,4,FALSE,FALSE,3,"Reno, NV",11/[YEAR-0],11/13/[YEAR-0],FALSE,It's old and tired,4,"Tired, old hotel","Wow, if you're interested in staying at an old tired hotel than this is the place. I think it's due for a remodel but until then it's really outdated."
354200,760,kkcakeklady,5,5,5,5,5,5,6,FALSE,FALSE,2,"Las Vegas, NV",11/[YEAR-0],11/13/[YEAR-0],TRUE,Take advantage of the free shuttle into Old Town Key West,2,would stay again,"although this hotel was not near old town key west, it had free shuttle service since parking is difficult in town. Room was large and spacious and clean. If you fly into Key West airport, you could really walk to the hotel. Breakfast was okay, nothing special with the buffet, many better and fun eateries in town."
354859,421,waikiki122864,4,5,5,4,5,4,4,FALSE,FALSE,2,"Huntington Beach, CA, USA",11/[YEAR-0],11/13/[YEAR-0],TRUE,Great location & wonderful staff!,3,Much bettter than the reviews read,"A special thank you to Hotel Mgr Kenny & Front Desk Rep Joy for proving the prior negative reviewers of this hotel worng. The bed was & room extremely comfortable. A great nite's sleep!!!! Large flat screen TV and mini bar was fantastic. Very clean room, except for the bathroom which had a slight musty smell (shower curtain). Otherwise a very nice stay & parking was convenient having driven my new Porsche to NYC without any problems with parking."
355431,1726,jechho,4,4,3,4,3,3,8,FALSE,FALSE,4,Norway,8/[YEAR-0],11/14/[YEAR-0],TRUE,,4,Nice hotel if you do not need or want beach location,"Modern hotel with nice rooms, but probably not somewhere you take you kids for a beach vacation. The hike to the beach was pretty long (especially when its hot!) and there are a lot of hotels smack on the beach in this area. If you are looking for a reasonable deal and comfortable rooms, however, this may be a good choice."
355490,760,Mike738,5,5,5,5,4,4,8,FALSE,FALSE,3,"New Hampshire, USA",11/[YEAR-0],11/14/[YEAR-0],TRUE,"Smathers Beach is across the street--literally! My only complaint, if you can call it that, was that they didn't have a jacuzzi tub in the room. Great resort.",2,Anniversary trip,"We spent a night here for our anniversary trip to Florida. Fantastic location, great property with a nice room and very comfortable bed. Plan to come back because there's much too much to see and do in two days. If we can manage it, this will likely be where we stay next time, too."
355826,198,Mark5933,3,4,2,4,2,4,2,FALSE,FALSE,3,"Dallas, TX, USA",11/[YEAR-0],11/14/[YEAR-0],FALSE,,2,Needed tech upgrades,"There was no wireless network in the rooms, I travel with an I pad now and could not access the internet unless I was in the lobby. There used to be a small store in the lobby with is closed now.Belvoir has spent a lot of money on making most of their hotels nicer but they forgot about these item at this hotel"
355833,1236,cmaawards,5,5,5,5,5,,8,FALSE,FALSE,2,,11/[YEAR-0],11/14/[YEAR-0],TRUE,,,Great Hotel; Great Location,This was our first visit to Nashville. The Belvoir was wonderful. We were told that the hotel was recently renovated and it shows. The rooms were very clean and they gym was impressive with two separate rooms that held a variety of workout equipment.
