reviewID,hotelid,userName,overall,roomComfort,staffMetNeeds,cleanRoom,facilitiesMetExpectations,ageRangeID,tripPurposeID,travelAgent,meetingPlanner,BPGStatusID,guestFrom,arrivalMonth,datePosted,recommend,everyoneShouldKnow,frequencyID,title,comment
356140,693,djpelleg,3,2,2,2,1,4,6,FALSE,FALSE,1,"Lake Mohawk, Ohio",11/[YEAR-0],11/14/[YEAR-0],FALSE,Utilize the shuttle service to save on money for additional parking. The drivers are so nice and accomadating.,2,Great location but in serious need of upgrades,"Station Square is a great location with lots to do. Restaurants and shopping really close by. Utilize the shuttle for going in to Pittsburgh to save money on parking. The drivers are really nice! The person who checked us in needs customer service skills as she was not helpful when we asked her questions, like we were a bother to her. I read reviews about the cost for the room and if your room is located by the elevator how loud it will be. That is no lie. Not much sleep for the 2 nights we stayed. Those rooms should be offered at a severe discount. I have stayed on beautiful oceanfront property cheaper."
356533,3079,CabFare10,4,5,5,5,4,5,3,FALSE,FALSE,1,"Frankfort, KY 40601, USA",10/[YEAR-0],11/14/[YEAR-0],TRUE,lack of shuttle service.,3,Hotel worst feature,"The hotel is nice, the only problem I have is having to pay $50.00 for a cab roundtrip from the airport. A motel of this quaility that caters to conferences should provide transportation. Also, I didn't like the paper coffee cups in the rooms."
356915,865,OnTheRoadAgain,1,2,3,2,1,3,4,FALSE,FALSE,4,"Philadelphia, PA, USA",9/[YEAR-0],11/14/[YEAR-0],FALSE,Showing its age; needs a renovation.,4,Please renovate me!,"You know those really dirty cars, where someone scribes ""wash me"" in the dirt? Consider this a sort of hotel equivalent. The elevators are old and worn and the hallways and rooms upstairs scream ""renovate me."""
356964,94,JoeR,5,5,5,5,5,5,4,FALSE,FALSE,4,"Akron, OH, USA",11/[YEAR-0],11/14/[YEAR-0],TRUE,they treat you like family,4,President & CEO,They treat you like family!
357220,2017,Earlene,5,5,5,5,5,6,7,FALSE,FALSE,2,Virginia,11/[YEAR-0],11/14/[YEAR-0],TRUE,"Has the friendliest, well trained, helpful staff I've ever encountered!",2,Happy Experiences in Charleston,"This 30 year old hotel is amazing,The staff is friendly, well trained & focused on the needs of the guests. If there are problems, they are solved in minutes not hours. Amenities offered are super. Shuttles to the airport & downtown Charleston are readily available. On the Club level, the bath amenities equal many 5 star properties. The staff is terrific--Traci, Willie, LeAnn & Percy are simply the best! I'll never stay any where else in Charleston!"
358520,421,Robyn62,2,4,1,4,1,4,7,FALSE,FALSE,3,"Manhattan, New York, NY, USA",11/[YEAR-0],11/15/[YEAR-0],FALSE,The employees are rude and the hotel is so unaccommodating.,4,This Grandbourne property is AWFUL,"I must start by saying the Men at the attractions desk were extremely helpful and kind. The young lady at check-in was very pleasant as well. Our rooms were clean but extremely warm. We had to keep the window open all day and night in order to stay comfortable. As a Grandbourne owner, I have a certain standard I expect at all Grandbourne properties. The staff at this location was arrogant and completely unapproachable. They seemed to do everything they could to make things as difficult on the guests. I tried to get a box to ship items home and they transferred me 4 times to an obnoxious nasty girl named Kim in the Fed-Ex office. I have NEVER been treated so horrible. We usually stay at the Westin or the W Times Square when we come to New York, and I can guarantee we will never ever stay at this Belvoir again. The Westin or the W are the most comfortable and accommodating hotels in the city. They're location is great and the hospitality is amazing. This Belvoir hotel gives Grandbourne a big black eye!!"
358549,1776,Saint,3,4,5,5,2,5,5,FALSE,FALSE,2,"Philadelphia, PA, USA",11/[YEAR-0],11/15/[YEAR-0],TRUE,,3,Bathroom Needs Renovation,Sink stopper detached from control rod. Shower fixtures corroded and imprecise on water temperature control.
358702,421,soxtr7,2,1,1,5,3,4,3,FALSE,FALSE,2,"Spokane, WA, USA",11/[YEAR-0],11/15/[YEAR-0],FALSE,the $3.25 a bag bell hop fee.,4,Great location,"This hotel is in a great location, but the rooms are tiny. Our room was clean and newly renovated. The worst thing was that you had to pay $3.25 a bag to the bell hop to hold your luggage before and after check in/check out. Also if you arrive in a car there is no one to help you with your bags."
358880,95,CRBY,1,,,,,3,6,FALSE,FALSE,1,"Portland, Oregon",11/[YEAR-0],11/15/[YEAR-0],FALSE,very exspensive for the none services and extremely dirty!!,2,This hotel was the dirtiest place we've ever stayed!!!,when we got to the hotel they messed up and gave us one king instead of 2 doubles. Got to room and it was very filithy tv screen was covered with something the bathroom looked as if it hadn't been cleaned in some time. The hot tub and pool which we did not use was also a mess with empty alcohol cans and bottles laying around. For the money we spent we were very dissapointed- will never go back!!!!!
358900,111,carrie1,3,5,4,4,2,4,6,FALSE,FALSE,1,"Atlanta, GA, USA",11/[YEAR-0],11/15/[YEAR-0],TRUE,,2,poor service in restaurant,"The hotel itself was very comfortable. The staff at the front desk was friendly, helpful, and accomodating. Nyla, one of the dest receptionist is amazing! Competent, friendly, and welcoming."
359027,421,aeschylus,1,3,1,3,1,4,3,FALSE,FALSE,2,"Austin, TX",11/[YEAR-0],11/15/[YEAR-0],FALSE,Don't expect good service,3,Did not meet expectations,"Each year I attend a conference at this hotel and travel with a colleague who is mobility impaired. The check-in clerk was surly and insisted that my mobility impaired colleague come to her to verify her identity. Someone who cared about customer service would have gone to the customer. My colleague's room was not as represented requiring a change of rooms. All in all, the check in process took over an hour."
359549,380,Matt,1,1,1,1,1,3,2,FALSE,FALSE,4,Pennsylvania,11/[YEAR-0],11/15/[YEAR-0],FALSE,There are many better options in the same area.,4,"Terrible Hotel, Lousy Management","As a Platinum member I don't expect a closet that barely fits a bed. Also the view that I had out my window was a drain pipe and a wall. If I looked to the side I could see a parking garage. Hotel Manager refused to give me a better room, even after clerk told me that many better rooms were available. The furniture was damaged and very old."
360568,353,honey,3,3,3,2,2,5,8,FALSE,FALSE,2,"New Orleans, LA, USA",11/[YEAR-0],11/16/[YEAR-0],TRUE,location,4,Great location,The room had a hole in the wall and the ceiling was peeling. The bathroom was dated and not very clean. It was warm in the room and difficult to lower the temperature. This hotel is a great location but needs updating for the price.
360686,468,KJSierra11,1,1,1,1,1,4,6,FALSE,FALSE,4,"New Jersey, USA",11/[YEAR-0],11/16/[YEAR-0],FALSE,Don't expect to be treated with any kind of respect. Because of it's location you are just a number.,4,Worst BPG property in the United States,"I'm Platinum with BPG, at 10:30 am we were told it would take a few minutes for our (2) rooms to be ready, it took 4 hours for the first room and about 6 for the second. Staff was rude. One of our rooms smelled moldy, issue was reported and we were told it's common and nothing was done to fix the problem. Room service trays littered the halls for days without being cleaned up. pool area was frequently closed to guests for private parties. Food in the restaurants was of poor quality and at top dollar. If this had been my first BPG property I would never stay at another one. As it is, I may cancel all my BPG reservations at other hotels for the rest of the year due to this extremely poor service. There is no excuse to treat guests the way we were treated, especially someone who has close to 50 stays this year with BPG!"
360880,1282,JWsTravel,5,5,5,5,5,4,6,FALSE,FALSE,2,"Chicago, IL, USA",11/[YEAR-0],11/16/[YEAR-0],TRUE,It is very convenient to the down town area.,1,Provided greate service,"The staff provide great service, even when I forgot to take in the ""Do Not Disturb"" flag, they still cleaned my room after I called the front desk. This was greatly appreciated."
360956,421,anthonyj,1,1,2,1,1,4,3,FALSE,FALSE,3,"Philadelphia, PA, USA",11/[YEAR-0],11/16/[YEAR-0],FALSE,dont stay here,2,Do not stay here,"Unbelievably small and cramped. When we arrived pillows had no cases, duvet had a blood stain. Three calls to concierge before they came to remediate problem.Paid for the upgrade because I wanted to use my computer, only to find out that you had to go to club floor for wireless. (In room charge for wireless is $15. what a joke."
361476,392,andek,4,2,2,4,4,2,8,FALSE,FALSE,1,MN,11/[YEAR-0],11/16/[YEAR-0],TRUE,,2,Mixed feelings,"Beautiful hotel, great location, nice facility. While some of the staff were lovely and kind, others were very cold and rude. Also, the breakfast through room service was over priced, cold, grossly greasy. Bed and couch were basically rocks."
361844,1428,sonorguy,3,5,3,5,3,5,2,FALSE,FALSE,2,"Tarrytown, NY, USA",10/[YEAR-0],11/16/[YEAR-0],FALSE,,4,4 week's experience to date,I have been staying at the Tarrytown Belvoir for 2 or 3 days a week since early October.
362104,1494,cosplaymom,1,2,1,2,1,3,5,FALSE,FALSE,1,"Sand Springs, OK, USA",11/[YEAR-0],11/16/[YEAR-0],FALSE,Reservations are pointless,1,Don't Bother Requesting Specifics In your Reservation,"We made our reservations four months in advance for a room with two double beds. When we arrived we were given a room with one king size bed. When we asked for a room with two beds we were told the rooms were "" First come first served""."
362172,756,Bigdog,1,1,1,1,1,4,4,FALSE,FALSE,4,Connecticut,10/[YEAR-0],11/16/[YEAR-0],FALSE,This hotel is on par with the Red Roof in down the street.,4,Not to BPG standards,"Stayed in this hotel twice in the last 4 weeks as it is the only BPG option west of Boston. The hotel claims to have been recently remodeled but it is closer to a Red Roof than one of the newer Belvoir's. Staff was overwhelmed and although acknowledged BPG paltinum stauts, found it easier to put me in a room off the lobby that was part of convention meeting rooms, rather than override the computer for BPG level. Doors dont close properly, fould odor in the hotel. Grandbourne needs to close theis for a year and do a complete rebuild rather than room b room remodels."
362709,1726,VTDAD,5,5,5,5,5,4,6,FALSE,FALSE,1,"Burlington, VT, USA",11/[YEAR-0],11/17/[YEAR-0],TRUE,Comfortable and Convenient,2,Always great,"I stay at this hotel routinely with my daughter. This hotel makes the trip memorable every time. The people are great, the hotel is clean and welcoming and it is convenient to everywhere you want to go in Myrtle Beach. I can't say enough positive things about it."
362802,421,trishins73,3,4,3,4,3,3,3,FALSE,FALSE,1,"Niagara Falls, NY, USA",11/[YEAR-0],11/17/[YEAR-0],TRUE,"Great Location, Food and Beverage service available in the Lobby.",3,GREAT LOCATION,"Ther location is extraordinary.I was a little disappointed that your hsk staff does not adher to the linen policy (I hung my towels every day and they were still taken and replaced with clean except for the one and only washcloth in the room which was taken and never replaced)). As a Hotel Manager myself this concerns me, as this costs money not only supplies but labor. Also they do not respect the Do Not Disturb signs. I placed the DND sign on my door and when I returned it was off and the room was made back up."
362832,1557,crazyboy,1,2,4,3,1,4,2,FALSE,FALSE,4,"Richmond, VA, USA",11/[YEAR-0],11/17/[YEAR-0],FALSE,It's worn out and looks circa 1980,3,Worn out hotel,"This is one of those worn out hotels, that not only hasn't been remodeled lately, it likely is exactly the same as it was when it opened in 1980 or whenever it opened. This property is worn out and needs help. I would not stay here again. Too many other choices of nicer hotels."
362840,1317,crazyboy,1,2,3,3,1,4,2,FALSE,FALSE,4,"Richmond, VA, USA",11/[YEAR-0],11/17/[YEAR-0],FALSE,"Neglected, worn out.",3,"Disgusting, neglected hotel",Another worn out Belvoir Suites hotel. Are they all like this? I've stayed at three and they were all in the same condition.
376155,1391,RainZone151,5,5,5,5,5,3,6,FALSE,FALSE,3,"Seattle, WA, USA",11/[YEAR-0],11/17/[YEAR-0],TRUE,Tranquil grounds.,2,Great views of open spaces,We have stayed at this hotel several times now and we always enjoy our stay. The location is away from the freeway and there is much quiet and solitude available.
396675,1497,John33,1,1,2,1,1,3,5,FALSE,FALSE,3,"New Jersey, USA",11/[YEAR-0],11/17/[YEAR-0],FALSE,"Dirty, out of date and smelled like mildew.",2,Poor at best!,"We have been BPG members for 6 years and we have stayed at many properties and this by far was the worst. The rooms were out of date, the rugs were stained and had burn holes in it. The room had a terriable mildew smell. There were rips and stains on the couch. I had my 2 young daughters with me and was worried about there health. I would not recommend this hotel to anyone and was shocked that BPG onwes this low level of a hotel."
396854,1144,Norm53,5,5,5,5,5,5,6,FALSE,FALSE,3,"Marblehead, MA, USA",11/[YEAR-0],11/17/[YEAR-0],TRUE,Incredible helpful and friendly staff,2,Fabulous Experience,"During my last visit to Atlanta, my daughter and I stayed at the downtown Belvoir. This was my first stay at this Belvoir. My daughter has stayed there before and has told me of how much she had enjoyed her stay there. As a Gold level BPG member, I enjoyed the club lounge in the morning and the well equipped work out room. What most impressed me the most was how friendly and helpful the Belvoir staff tried to make my visit a most pleasant one. I look forward to staying there again."
396880,96,CRBY,4,4,5,5,4,3,6,FALSE,FALSE,1,"Dallas, TX, USA",11/[YEAR-0],11/17/[YEAR-0],TRUE,Friend of Children's Hospital families.,3,Friend of Children's Hospital Families,"We were recently at Children's Medical Center in Dallas for 7 nights. My husband and I took 12 hour shifts between staying with our son and getting some rest at a hotel. We started at another hotel close by and it was terrible. I called the Belvoir, told them what was going on, and they gave us a Children's Hospital discounted rate and allowed us to check in at 11 AM instead of having to wait till 3 PM to get some rest the day we switched. The staff was very hospitable and the bed was wonderful. Thank you Belvoir for helping make our situation much more comfortable and less stressful."
397126,693,jeff,3,2,3,2,2,3,8,FALSE,FALSE,4,virginia,7/[YEAR-0],11/17/[YEAR-0],FALSE,you can hear everything someone is saying in the next room.,4,not so good,the room walls are exceptionally thin. there was a party going on in the room next to us and i asked to be moved. the staff was nice enough to move us. the wall were thin in the new room as well. both rooms are old and dated. wallpaper was peeling off the walls in both rooms and molding was coming apart in one room. not the typical standards you would expect from Belvoir. the view was spectacular. the lobby area was nice. overal just a mediocre hotel with old rooms.
397865,861,gapper,1,1,1,3,1,5,4,FALSE,FALSE,2,"Atlanta, GA",11/[YEAR-0],11/18/[YEAR-0],FALSE,Don't go to the bar. It is dirty.,4,Disappointing in many ways,"The A/C was either ON or OFF in the room, there was no temperature control. The pillows were too firm and to use one your neck was at 90 degrees to the bed --hard to sleep that way. The bar could not find a clean glass -- very disgusting."
397870,832,cnDallas,1,1,1,2,1,3,4,FALSE,FALSE,4,"Dallas, TX",11/[YEAR-0],11/18/[YEAR-0],FALSE,Don't stay here!,4,Beware of this hotel,"I recently stayed at this dump. First, my room was next door to the Club Lounge. Not only was it next door, it actually had a connecting door option. The headboard of the bed was on the shared wall and next to the connecting door. To say it was loud is an understatement. I could actually hear the conversations next door... had a tv blaring at 3am (called the front desk and it was turned off) and then heard all of the breakfast prep at 5:30 am. I brought this up to the front desk at checkout and they laughed and said 'sorry.' That was it."
398251,861,chironut,1,3,2,3,2,3,4,FALSE,FALSE,2,Texas,11/[YEAR-0],11/18/[YEAR-0],FALSE,Not recommended.,3,This hotel is not Belvoir quality,The hotel was outdated. Not what you would expect from a Belvoir. The Club floor was not any better. My room was right next to the food serving area so very early you would hear dishes clanging around and people talking. The food was not good especially in the restaurant.
398320,344,ganesha33,4,5,5,5,1,5,3,FALSE,FALSE,2,,11/[YEAR-0],11/18/[YEAR-0],TRUE,Peace + Quiet if you ask for it.,1,Simple Needs,Operating on overload? Just gotta be close to the airport and get basics taken care of? Need quiet and privacy? No need for entertainment at this time? The Belvoir Gateway will serve you well. Bare bones works on a lean budget.
398646,1364,Yogi01,5,5,5,5,5,5,5,FALSE,FALSE,3,"Wichita, KS",9/[YEAR-0],11/18/[YEAR-0],TRUE,Convenice of light rail station and walking distance to river front area and stadium,2,"Great hotel, great location","Walking distance to ballpark and river area. Or, take the light rail right across the street! We had a suite that was the size of a small apartment. Comfortable and clean. Will stay here on our next trip to St Louis."
399263,655,BPGPlatium6,3,3,5,4,4,4,7,FALSE,FALSE,4,"Port Columbus International Airport, 4600 International Gateway, Columbus, OH 43219, USA",11/[YEAR-0],11/18/[YEAR-0],TRUE,Great staff,4,Belvoir IAD,"Location is far from the airport and restaurant closes early but superb staff, and nice club lounge which opens early."
399919,1506,tlsps,4,4,1,5,4,5,4,FALSE,TRUE,4,"Bloomington, il",11/[YEAR-0],11/19/[YEAR-0],TRUE,,4,Club Lounge,"Stay at Belvoirs as often as possible for the Club benefits and great hospitality I receive from the Club Lounge Concierge. However, my experience the night of November 14th was NOT what I've grown to expect and anticipate."
400147,802,ZACK,3,5,3,5,1,4,4,FALSE,FALSE,3,"North Carolina, USA",11/[YEAR-0],11/19/[YEAR-0],FALSE,DO NOT GET A ROOM ON THE CREEK SIDE. YOU WILL BE AWAKENED BY TRAIN HORNS ALL NIGHT LONG.,,"""TRAIN HORN/WHISTLE ALL NIGHT LONG!!!""","Belvoir SUITES AKRON/CUYAHOGA FALLS, THIS Belvoir IS A FIRST CLASS OPERATION. IT'S MODERN FACILITIES WERE IMPRESSIVE. HOWEVER! AT CHECK IN, MY INCOUNTER WAS NOT WARM AND FRIENDLY. I WAS GIVEN A ROOM FACING THE STREAM. SOMETIME AFTER 12PM I WAS AWAKENED BY A LOUD TRAIN HORN. AND ABOUT EVERY HOUR AFTER THAT. EVERYTIME I GOT TO SLEEP ANOTHER TRAIN HORN. THE NEXT MORNING I WAS TOLD NEXT TIME I STAY I SHOULD GET A ROOM ON THE CITY SIDE OF HOTEL. THAT INFO WOULD HAVE BEEN OF USE AT CHECK IN."
400840,861,ftrrac,1,1,1,1,1,6,6,FALSE,FALSE,2,,11/[YEAR-0],11/19/[YEAR-0],TRUE,Generally it is accomodating and service oriented.,2,This was my worst experience at this Hotel,"I have stayed at this hotel frequently and have to say this was the worst experience ever. The room was not the room I selected (it did not have 2 double beds). They could not relocate me. I had to order the sheets for the sofa bed. It was so uncomfortable that I had to sleep on the sofa not the sofa bed. The heat did not work, even after having maintenance come to the room for 1/2 hour who said it would warm up. It never did and I had to turn the system off and bury myself in blankets, etc. to try to keep warm. No one checked after an hour or so to see if things improved. No one asked about the service in the AM. If I had not had better experiences previously I would never stay at this hotel again."
401106,3207,Coco777,5,5,5,5,5,4,3,FALSE,FALSE,1,"Los Angeles, CA, USA",11/[YEAR-0],11/19/[YEAR-0],TRUE,Wonderful staff,2,Friendly staff and clean rooms,"Stay for 4 nights at this hotel. My room was always kept clean by the housekeeping staff. If I had a question, the hotel staff was friendly and willing to help."
401551,460,SCoPE,5,5,5,5,5,5,3,FALSE,FALSE,2,"Napoli, Italia",11/[YEAR-0],11/20/[YEAR-0],TRUE,"Camere spaziose, massima pulizia, ottime strutture",4,Ben posizionato e con ottime strutture,"Abbiamo trovato una camera molto spaziosa, pulitissima e con un grande bagno. L'Hotel era centralissimo, e per di pi immediatamente all'uscita della Interstate 5, praticamente ci si arriva subito. Grandi infrastrutture, ottimo ristorante. Un bar che vende caff蠥 croissant dalle 5 del mattino !"
401556,861,EnglishTim,3,4,3,4,4,5,6,FALSE,FALSE,3,"Dorchester, Dorset UK",11/[YEAR-0],11/20/[YEAR-0],TRUE,Very convenient for Car rental and airport,1,Excellent location,This was our second stay and it's extremely convenient if flying in or out of IAH. We have stayed pre and post cruises from Galveston.
401834,3207,CleanAirBill,3,4,3,5,5,6,2,FALSE,FALSE,1,"Phoenix, AZ, USA",11/[YEAR-0],11/20/[YEAR-0],FALSE,Easy access to downtown,2,The fitness center was the best,"However, I do not feel that they were responsive to my requests.. I booked at least one month in advance, and was very specific that I did not want a room next to the elevator. There was no such note when I checked in and the only room they had available was across from the elevator. And, yes you could hear it all night long."
401858,1047,3/1/1948,3,4,3,4,4,5,6,FALSE,FALSE,2,"Syracuse, NY, USA",9/[YEAR-0],11/20/[YEAR-0],TRUE,"Comfortable, but no breakfast and no free water!",2,Don't drink the water!,"The room was very nice, although it would have been nice if there was even a small continental breakfast included. My main complaint is that there were two bottles of water on a counter, with no sign in the room that stated that the water was not free! We drank the water, as we were thirsty just coming off a flight, and when we got home, we were charged an additional $5 for each bottle of water for a total of $10. When I called the hotel, they said that happens a lot, but would not reduce or eliminate the charge."
402132,3205,silentshawno,3,5,3,5,4,3,2,FALSE,FALSE,2,"Sudbury, ON, Canada",11/[YEAR-0],11/20/[YEAR-0],TRUE,,2,Very good hotel with potential to be great,SUMMARY:
402658,198,BillA,3,3,3,4,3,0,7,FALSE,FALSE,1,"Fort Washington, MD, USA",11/[YEAR-0],11/20/[YEAR-0],FALSE,Don't expect quality accomodations,2,poor room quality,Suite was missing mirrored door which was the only full length mirror in room. Reserved suite for ambience which was lost with open closet.
402991,1046,ForPetesSake,4,4,4,4,5,3,4,FALSE,FALSE,3,"Houston, TX, USA",11/[YEAR-0],11/20/[YEAR-0],TRUE,Great Gym,4,What's Important to you...,"This Belvoir has an outstanding fitness center - usually seen in much higher end hotels. Includes stretching area, weights, and cardio in a large, open area."
403129,96,Rajesh,5,4,5,5,5,4,6,FALSE,TRUE,3,"Austin, TX, USA",11/[YEAR-0],11/20/[YEAR-0],TRUE,All suites. Very close to downtown but feels like the suburbs.,2,Good hotel,Positives:
403304,1021,GLC06,1,1,1,1,1,4,4,FALSE,FALSE,3,"Atlanta, GA",11/[YEAR-0],11/21/[YEAR-0],FALSE,The bed was very comfortable.,4,The lack of service and room functionality,"As a frequent traveler and first timer at this hotel, I was extremely disappointed. At check in, I was informed that a king size bed was unavailable as I originally requested through my reservation. Although not pleased to hear this, I accepted a double with the intention of changing rooms when a king became available the next day. The associate in turn decided to give me a king instead after being told that one was not available. The assigned room(615) toilet did not work which I reported right away. I left the premisies for 5 hours only to return to the room where the top of the toilet was sitting on top of the vanity(how filty is that?) and the bathroom floor was wet with spots all over the floor(just nasty). I immediately went back to the front desk and requested another room but my overall first impression was a nightmare and I definitely will not return to this location."
403670,127,ScottOC,2,2,2,1,2,5,8,FALSE,FALSE,3,"Orange, California, USA",11/[YEAR-0],11/21/[YEAR-0],FALSE,The Bay Tower is a different hotel next to the Belvoir Hotel & Marina.,3,Bad Hotel,"We made this 2 day stay reservation with a debt card and Belvoir put a hold on it to the tune of $750.00, we checked in and gave them our credit card to pay for the room and Belvoir still hasn't credited our account for the $750.00 also the room was dirty and they had left clothes still in the drawer from someone elses stay. Also they chargered $90.00 dollars for food & bev and when I checked out they said that was a accounting problem."
403755,1784,Diane67,2,2,4,2,2,3,2,FALSE,FALSE,3,"Chicago, IL, USA",11/[YEAR-0],11/21/[YEAR-0],FALSE,Staff is nice but parts of the hotel need an overhaul.,4,Not Up to Par,"The staff was friendly and helpful and the common spaces were fine. The carpeting in the rooms, however, was so stained that I requested a new room. The flooring in my new room wasn't much better and my colleague said the same of his. It made the whole place feel less than clean to me."
403777,3207,Diane67,3,2,3,2,2,3,2,FALSE,FALSE,2,"Chicago, IL, USA",11/[YEAR-0],11/21/[YEAR-0],FALSE,Update the South Tower,4,South Tower Needs Updating,"The staff was very friendly and helpful and the common spaces were nice. My room in the South Tower, however, was old and tired. The bathroom hasn't been updated in decades as indicated by the peach sink, toilet, tile, etc."
