reviewID,hotelid,userName,overall,roomComfort,staffMetNeeds,cleanRoom,facilitiesMetExpectations,ageRangeID,tripPurposeID,travelAgent,meetingPlanner,BPGStatusID,guestFrom,arrivalMonth,datePosted,recommend,everyoneShouldKnow,frequencyID,title,comment
270601,1177,consult001,2,5,3,4,2,5,4,FALSE,FALSE,4,"Phoenix, AZ, USA",6/[YEAR-0],11/1/[YEAR-0],FALSE,"This would be a great hotel for infrequent travellers who want a more economical option to staying in Manhattan, but still want easy access to the city. I would recommend that frequent travellers and business travellers find another option.",4,Disappointed,"Perhaps this location is no longer interested in the business traveller. This was my third engagement in the area and I looked forward to returning with excitement as the prior two extended stays with this hotel had been wonderful. Management has changed though and I never felt appreciated as a recurring guest. The renovated rooms are lovely, but with restaurants in walking distance in such short supply, the lack of a microwave or refrigerator was a hardship when I am there week after week. Room service never did get it right for me and no attempt was made to encourage my repeat business."
270786,19,Jack320,1,2,1,3,1,3,2,FALSE,FALSE,2,,10/[YEAR-0],11/1/[YEAR-0],FALSE,,2,"No Electricty, No Hot Water No Internet yet charged full price","I stayed at the Belvoir on 29 October room 621, when the power went out in the area because I was told that the back up generator will start shortly and the hot water system is on the back up power."
272071,1506,flyboy,2,2,2,4,1,3,2,FALSE,FALSE,4,"Denver, CO, USA",10/[YEAR-0],11/1/[YEAR-0],FALSE,"Despite being renovated, the rooms still have very dated furnitre, lack of meaningful HD content and poorly appointed bathrooms.",4,Marginally OK,"Not sure what ""recent renovation"" means. The lobby was OK, but the hallways and rooms didn't even come close to reflecting being ""transformed by a recent $5.7 million renovation"". This is definitely one of the worst Belvoirs I've experienced in some time. I'm horrified to think what it was like before the ""renovation"". I would strongly recommend going elsewhere unless location next to the noisy interstate is a must."
272123,795,stillhungry,1,5,1,5,1,5,2,FALSE,FALSE,3,Texas,11/[YEAR-0],11/1/[YEAR-0],FALSE,,4,Service,"Ordered room service at 8 pm...waited an hour & was told they'd send it up....waited another hour...no food...when I called front desk, they explained that hotel was full and only one person working room service..why didn't they know that they were going to be busy? Don't they check their reservations? Terrible service, cannot get connected to wifi either...worst Belvoir I have ever experienced!!!"
272661,96,Sheri,3,5,1,5,2,5,7,FALSE,FALSE,3,"Garland, Texas",10/[YEAR-0],11/2/[YEAR-0],FALSE,Staff service stinks!,2,"While the hotel was very nice, the staff were rude, unhelpful, and discourteous","The room itself was very nice. The sofa bed didn't have sheets or a blanket or pillow, so when asked the staff simply stated they didn't have any more. They didn't even bother to offer an alternative. There weren't any cups in the room to accomodate water, so we asked the staff for cups. They were rude and said they didn't have any. The lounge for Grandbourne patrons was very nice with ample food and flavored water. Why couldn't the staff be as nice as the accomodations? So, if you don't need anything from the staff you would have a nice stay here."
272807,127,gail60,2,4,2,4,1,4,2,FALSE,FALSE,2,"San Diego, CA, USA",10/[YEAR-0],11/2/[YEAR-0],FALSE,iPad use in lobby main floor only. Most inconvenient for business work in the comfort of your room,3,Short on amenities,disappointed that the customer has to use lobby computers for internet access as there isn't wi-fi in the rooms unless one uses the cable. Most inconvenient for iPad users.
273285,460,DARRYL,2,3,1,4,2,5,6,FALSE,FALSE,4,"VICTORIA, CANADA",10/[YEAR-0],11/2/[YEAR-0],FALSE,"The staff are clearly not a unit or team. Its a case of I'll do it my way, good bad or in between. The concierge staff was excellent as were the Club Lounge staff and food.",4,"NOISY, STARK ROOMS, NON RESPONSIVE STAFF","I am a Platinum level guest who stayed at this hotel for the first time last week. I was told at check in I was UPGRADED to a JUNIOR SUITE. I arrived on the 27th floor to find my room opposite the elevator (think noisy and you'll be correct) and when I opened the room, it was far from a suite but rather an oversized room with a sofabed and a room meeting table with 4 chairs - stark and uninviting I'd call it. I called the front desk to express my concern about being so close to the noise of people coming and going at the elevators and waited as the phone rang and rang, for over 10 minutes on 2 different attempts to reach someone. I finally gave up as I was heading out for dinner. I tried again when I came home and once again, no once answered. I had a sleepless night with noise from the guests coming and going and when I checked out I expressed my concerns to the front desk agent. She offered a few points, none of which were ever deposited, and that was it! I told her how unhappy I as with the hotel and that Id look to the Westin the future for my Seattle accommodation. She gave me a 'do what you want look'. When I went to retrieve my car, the doorman and parking attendent stood by my car for a full 5 minutes waiting for me with hand out, EXPECTING a tip for what they had done which was part of their job! I felt pressured to leave them each something, their body language and facial expressions screamed 'where is my money' and with disgust I drove away thinking I'll never, never return to the hotel. It has alot of work to do personnel wise."
273291,828,Ted62,5,5,5,5,5,4,4,FALSE,FALSE,4,"Manhattan, New York, NY, USA",11/[YEAR-0],11/2/[YEAR-0],TRUE,,4,Why stay anywhere else,"My advice, why stay anywhere else. The staff is the best in teh business. helpful, friendly and anticiaptes your needs. Teh facility (room, Gym, restaurant) all rate at the top of the list. I stay at least 60 nights per year in hotels. This one is a gem"
273402,421,MissCherryBomb,2,5,2,5,4,3,8,FALSE,TRUE,2,"Oakland, CA, USA",10/[YEAR-0],11/2/[YEAR-0],FALSE,"Good location, beautiful hotel, bad service.",2,Unprofessional Staff,"Very unhappy with nearly all experiences with the hotel staff. When we drove up to the curb, the bellmen ignored us--despite that it was pouring rain and snow (Oct 30 storm). I had to get out of the car and ask for help. The bellman said he would help me, so I went back to the car. 10 mins later, he was still tending to other people, hailing cabs. I got out of the car again, to ask for help AGAIN and he said ""oh yeah"", as if he forgot about me. This was my first impression of the generally unprofessional attitude of the staff. I then waited to 20 mins to check in, just to be told that I could not do so until 3pm! There was only two people checking in dozens and dozens of guests, but the staff were still working at a SNAILS PACE! No sense of urgency at all. I then went to see where my luggage was, so I could figure out what to do with it and was told it would be taken to the storage room until we could check in later. We left and came back later, to check in. Upon return, I waited for another 30 mins in line, just to be told that because I did not have a ticket for my luggage, I could not get it out of the storage room! I walked around, trying to find someone to help me with the situation and saw my luggage just sitting on a luggage cart, in the middle of the lobby! I was furious. We went up to our room and decided to stay indoors, since the storm was so bad outside. Then entire rest of the night, we were awoken by drunken Halloween partiers, because the door was too small from the frame and there was a 1/2 inch gap, which allowed all of the hallway noise to funnel into our room. The next morning, we were up early. We did not have a ""do not disturb"" sign on the door, but did not think that the housekeeping crew would bother us so early. Wrong. We heard a knock at the door at 8:45. Before we could answer, she just let herself in! I couldn't even believe it. I was so happy when we finally left. NOT a good experience, what-so-ever."
273413,865,Kathy50,5,5,5,5,5,5,5,FALSE,FALSE,2,New Jersey,10/[YEAR-0],11/2/[YEAR-0],TRUE,They went out of their way to help us.,,Warn and Friendly,"We stayed here 2 nights after the snow storm this past weekend. The hotel and it's staff were slammed!! People, children and dogs everywhere you looked! I never saw a staff member without a smile and a friendly word. The bartender Sat night in the Pub,deserves a medal! He must have handled 100 orders in th short time we were in there and never messed one up, or seemed rushed or cranky. He has my vote for employee of the month :) The room was large, clean, warm. The people wonderful. If our stay went this well in this situation it can only be better normally Thank You Belvoir !!!"
274049,353,tommyo,1,1,1,1,,4,4,FALSE,FALSE,2,barbados,10/[YEAR-0],11/3/[YEAR-0],FALSE,its not up to the standard i would expect for a Belvoir,4,its a dump,i stayed from sunday to wens morning in a club room .....Club lounge was a nice room but the facilities for breakfast were basic with no bottled water available unless on request.
274626,95,BB5770,4,4,3,2,3,1,8,FALSE,TRUE,3,"Kansas City, MO, USA",7/[YEAR-0],11/3/[YEAR-0],TRUE,They allow dogs under 75 pounds.,2,"Overall good stay, but some details were sloppy and valet was slow","The Belvoir on the plaza is a great place to stay. It is in a very convenient location, we had fun walking to the shops and restaurants. The valet was slow, so we ended up parking our car ourselves a couple times. The room was nice, but certain details were sloppy. For example, the popcorn ceiling was peeling and obvious spray paint touch ups in areas."
274628,460,uamchris,5,4,5,5,4,2,7,FALSE,FALSE,2,,Multiple,11/3/[YEAR-0],TRUE,Best Platinum Recognition,4,Best Platinum Benefits in Seattle,"I've stayed at Grandbourne hotels in Seattle over 30 times in the past 16 months and the Belvoir Seattle Hotel provides the best upgrades, service, and platinum amenities in Seattle."
274640,421,PORTTRAVELER,4,5,5,5,5,2,7,FALSE,FALSE,2,"Washington, DC, USA",10/[YEAR-0],11/3/[YEAR-0],TRUE,,3,Very Pleasurable experience!,"This is a very nice hotel in the middle of Manhattan. Location could not be more prime. It is close enough to Times Square but yet not on top of it. Hotel staff was VERY pleasant and accommodating. Obtaining taxis was very easy due to the Taxi person whistling taxis for us. Room size was also very nice. If possible try to ask for a corner room. :) Rooms well kept and renovated. (We were told we were in a renovated room?) Def would recommend and visit again. Only thing I did not like was paying $3.25 per item to check baggage at the Baggage Check upon check out since we were staying in the city a few hours after check out. Overall, :) ."
275513,1765,Guest,2,2,1,3,2,3,3,FALSE,FALSE,3,Brasil,10/[YEAR-0],11/4/[YEAR-0],FALSE,,4,The worst Grandbourne Hotel I had ever been,"Extremely rude check in, with one or two exceptions, staff is terrible and room is not confortable. 100% sure, the worst Grandbourne hotel I had ever been."
276218,995,asoto,1,2,1,2,1,2,8,FALSE,FALSE,3,"San Diego, CA",10/[YEAR-0],11/4/[YEAR-0],FALSE,The elevator sucks. Front desk staff aren't any better.,4,Get a ground floor room and no internet.,"The location is a great benefit for this cute, older hotel. The lobby and grounds are really cute. That's where it ends."
276264,377,Vicky72,5,5,5,5,5,3,6,FALSE,FALSE,2,"Sydney NSW, Australia",7/[YEAR-0],11/4/[YEAR-0],TRUE,Excellent pool area for kids!!! Great location!!! Friendly service...,4,An Amazing Time!!!,"It was our 8th visit to Honolulu and our 2nd time staying at the Belvoir. First time being our Honeymoon 16 years ago. We bought the kids this time and I would have to say we all had an amazing time. Excellent staff, service , amenities, views and the list goes on. We would definitely come again hopefully next year. My kids loved the pool area , Baskin Robins and the beach. We had access to the 30th floor for Breakfast and it was excellent, great food and amazing view. Loved our stay with you and have been recommending to all our friends. Thank you again and hope to see you soon."
277962,865,VeryGoodPointsStacey,2,3,3,3,1,3,2,FALSE,FALSE,4,"Charleston, SC",7/[YEAR-0],11/5/[YEAR-0],FALSE,I wouldn't return until the rennovation is done.,4,Desperately In Need Of Renovation,"have a love hate relationship with the Belvoir Parsippany. Ive spent over 6 weeks at the Belvoir this year alone and sometimes feel like Im a glutton for punishment. The hotel is finally undergoing an very long overdue $15 million dollar renovation. Until the renovation of the guest rooms is complete, the hotel will be at a disadvantage to any other hotel in the area. In the lobby, you can check out the new fabric, paint chips and floor plan for the renovations, but dont expect to see them anywhere else. The gym, however, just reopened after a major renovation. The service at the hotel is spotty at best. Some of the staff at the front desk is great one guy in particular remembered me by face (not name, thats okay though) and had some great restaurant suggestions. Unfortunately, even though Im platinum, I didnt get any type of room upgrade. However, they did offer a coupon for free sliders at the bar and two free breakfast coupons (the concierge lounge was closed a few days)."
277999,1719,tml[YEAR-0],5,5,5,5,5,3,1,FALSE,FALSE,2,50888386758,8/[YEAR-0],11/5/[YEAR-0],TRUE,,2,Beautiful views / great amenities,"Great views, great service and wonderful grounds. I would highly recommend this resort to business people and vacationers alike!"
278012,421,Unhappy07,1,2,4,4,2,4,8,FALSE,FALSE,2,"Los Angeles, CA, USA",10/[YEAR-0],11/5/[YEAR-0],FALSE,"Rooms are extremely small, no drawers to put your clothes, and the first night we arrived, the heater wasn't working!!",2,Worst hotel I have ever visited!,"I was tagging along on a business trip with my husband who was in New York for a conference. We arrived at the hotel, checked in and made our way to our room. Room is over stating, it was the size of a closet! No drawers to put your clothes, the in room safe was locked and the heater wasn't working! The morning after we checked in, promptly at 8:00 am, the whole room started shaking!! Not an earthquake, but construction that was being done! It was so loud the mirror in the bathroom was vibrating!! I wish the front desk had warned us about the construction! We stayed a total of two days and it was an absolute nightmare! You couldn""t even hear yourself think, much less carry on a conversation! I don't think I would recommend this hotel to anyone, nor would I ever stay here again!"
278287,3079,737823,3,3,4,2,2,,7,FALSE,FALSE,3,"Boston, MA, USA",10/[YEAR-0],11/6/[YEAR-0],FALSE,,,Rough around the edges,"Overall this hotel is very dated and rough around the edges. Due to its proximity to UT, there are many loud groups of college students and young adults. I stayed in a clubroom on the 15th floor and found the room to be incredibly musty and had numerous carpet stains. There are better BPG properties in the Austin area."
279501,421,GKGLondon,2,2,4,1,2,4,2,FALSE,FALSE,2,"Westminster, London, UK",11/[YEAR-0],11/7/[YEAR-0],FALSE,Construction going on!,2,Yuck!,"For the price I paid, I expected a clean room with furniture that was intact. What I got was a bathroom with dirty floor/walls and a dresser with a piece of the top ripped off. (I have photos but no way of posting them here.)"
280007,115,ThrownOut,1,1,1,1,1,4,6,FALSE,FALSE,3,"Boulder, CO",11/[YEAR-0],11/7/[YEAR-0],FALSE,"Do NOT consider a thrice personal confirmation for a booked, prepaid room to be held for you!!! They will sell you out, given any chance to do so.",2,GOLD preferred member Kicked out @ 1am,"I had pre-booked and pre-paid for a 2 night stay at the Birmingham Belvoir Hotel. Called the morning of and immediately after our flight arrived in Huntsville to confirm our room. Upon arriving at the Hotel @ 1am, we were told the hotel had sold-out 20 minutes earlier and even though I had called several times and prepaid we were kicked out. A group of pilots and flight attendants entered the hotel as we were leaving, I bet they were not turned down."
280227,468,Franko963,4,3,5,4,5,3,6,FALSE,FALSE,4,"Coconut Creek, FL, USA",5/[YEAR-0],11/7/[YEAR-0],TRUE,So much to see you will have to come back to see it all!,4,A fabulous resort hotel!!,"I travel over 100 days a year, all over the world. Trust me, there is no place like The Swan & The Dolphin, anywhere! The architecture is completely unique, it will have you admiring it's magnificent use of water effects, shape and color. It's location is fabulous for keeping yourself entertained. I would even recommend skipping the parks one or two day's to just relax and enjoy all this jem has to offer. ,, relax by one of their pools, play tennis, basketball, miniature golf, or ride on their private lake in a Swan paddle boat (a favorite past time of Michael Jackson when use to frequent the place in the 1990's), ride the water taxi just for fun or to Epcot and Disney Studio's. Stroll down the replica 1930's New Jersey Boardwalk next door, you might run into side walk magician! They have a play ground for the kids and offer children's programs to give you an your mate few hours to yourself if you need a break. Did I mention the fabulous spa or one of more than 8 dining choices including four 4 star choices. Did I mention the Candy shop, ice cream shop and art gallery? Don't even think you have to put on heirs here, it's Disney friendly staff will make you feel at home no matter if you want to dress up for a magnificent meal or just throw on shorts and tee shirt. This hotel was once the only 5 star property at Disney and she has aged magnificently. She is starting to show her age a slight bit accounting for the 4 of 5 star rating I gave her today but, if you want a fantastic resort vacation with your family this place will not disappoint."
280311,1726,navygurl,1,1,1,2,1,3,5,FALSE,FALSE,2,"Marine Corps Base, Camp Lejeune, Jacksonville, NC, USA",11/[YEAR-0],11/7/[YEAR-0],FALSE,It is not that good!,2,Miserable stay!,"I reserved my room almost a month in advance and king size beds were available, BUT yet when we checked in we got two doubles? So my husband and I were to sleep in separate beds??? We slept horribly! They don't explain all their hidden taxes and they charge for parking at THEIR own hotel? I thought staying here for the Marine Corps Ball will be best. I would've rather stayed at a rinky dink hotel after staying here!! I will never stay here again or recommend people stay here!"
280359,1751,SJFSDF,1,3,1,3,1,5,3,FALSE,FALSE,1,"Salinas, CA",11/[YEAR-0],11/7/[YEAR-0],FALSE,They don't know how to keep and honor a reservation made many days in advance.,2,Worst Hotel Stay ever!,I recently stayed at the Belvoir in Pleasanton and I will NEVER stay in a Belvoir hotel again. The experience from
280759,177,Travler4,1,1,1,1,1,5,6,FALSE,FALSE,2,"Mesa, AZ, USA",10/[YEAR-0],11/7/[YEAR-0],FALSE,"Not to stay at this hotel, health issues",4,Never Stay at this hotel,"This hotel should not be a part of Grandbourne list. The room was dirty, broken lamp, mold and stains in tub and, ect..."
281043,1523,marysolc,5,5,5,5,5,4,8,FALSE,FALSE,2,"Ponce, Puerto Rico",5/[YEAR-0],11/7/[YEAR-0],TRUE,,4,Location location,"Excelenre and geogeous hotel right in old san juan. Waking distance from the best bar, restauranr and shopping. The hotel staff is very courteous and helpful, Ill be staying back in january for Las fiestas de San Sebastian."
281397,1784,hungryballerina,2,3,2,3,3,3,7,FALSE,FALSE,2,"Manila, Philippines",10/[YEAR-0],11/8/[YEAR-0],TRUE,,4,Underwhelming,"Generally ok for the price. The room was big and clean enough. The breakfast buffet was nothing great, the front desk did not give us coupons (breakfast was included in our rate) and there was some delay in checking out because we were charged for our breakfast. There was also one day when we left our hotel around lunch time and when we got back that evening our rooms were not cleaned and I had to call the front desk for towels. The gym is adequate."
281518,1719,Kimmy63,5,,,,,4,4,FALSE,FALSE,4,"Accra, Ghana",7/[YEAR-0],11/8/[YEAR-0],TRUE,The neatness and calm atmosphere,4,This hotel is superb!!,The reception is just wonderful and people are so very nice. Rooms are spacious and great views. Ah! great meals too in a couzy restaurant. I love everything!!
281733,270,daughters2,3,2,3,1,3,5,3,FALSE,FALSE,3,New Jersey,11/[YEAR-0],11/8/[YEAR-0],TRUE,no smoking or gambling,2,room cleanliness,"I have stayed at this hotel many many times. This is the first time i was disappointed. I returned to my room to at 4pm to find it had not been made up. The first response was to tell me that they clean until 5. I find that interesting since check in is at 3. I explained to the manager this was unacceptable and that I would out for a drink and return in an hour, at which time the room needed to be done. I then asked for some compensation. On my return there was a note notifying me of a $40 credit. They could have done more with my 2 night stay."
281758,760,PhoenixNR,5,5,5,5,5,3,8,FALSE,FALSE,3,"Phoenix, AZ, USA",11/[YEAR-0],11/8/[YEAR-0],TRUE,Location! You don't need to stay on Duvall street with the shuttle - plus you have the beach!,3,A welcome surprise!,"We used our starpoints to book this Belvoir, when we were hoping to get the Westin, which is closer to Duvall Street where the action is. I could not have been more wrong! This property is across the street from the beach, has a great pool and a FREE shuttle to and from Duvall street! It has the best of everything. We loved it and our room was great. Shout out to Grant at the front desk who gave us great recommendations for places to try and Mr. Ed who drove the shuttle and told us all about Key West. You guys are great! Thanks for a great stay in Key West!"
282047,270,farcpr,5,5,5,5,5,5,3,FALSE,FALSE,2,"Cherry Hill, NJ, USA",11/[YEAR-0],11/8/[YEAR-0],TRUE,The hotel personnel are very interested in making your stay perfect,3,Perfect,It's very easy to find things to complain about (usually) but my stay at this hotel was perfect. There was nothing to complain about and all my requests were handled quickly and politely.
282146,380,FrequentFlyerGuy,1,1,2,1,1,2,7,FALSE,FALSE,4,"Denver, CO, USA",5/[YEAR-1],11/8/[YEAR-0],FALSE,Hasn't been renovated in forever.,2,What a dump,"This hotel hasn't been updated in forever. Nothing inside fits the Belvoir brand standard. The carpets, bathrooms and walls are soiled and stained. The hotel is very large and there is no personal attention or sense of urgency with the staff. There are lines for everything. They don't even have the regular shower head or bed. There is a very loud and touristy dinner show at the pool at night, so don't plan on falling asleep before 10pm. The food is ludicrously over priced. No BPG recognition beyond a higher floor. No club lounge. Poor wifi signal."
282343,1391,jj49,3,5,3,3,2,5,8,FALSE,FALSE,2,"Phoenix, AZ, USA",11/[YEAR-0],11/8/[YEAR-0],TRUE,Its a beautiful facility that is lacking in customer service and places to eat.,4,Not enough restuarants,"Hotel is beautiful, but staff was slow to get us checked in ...we had to wait until 530, during our wait none of the restaurants were open just the lobby bar area and it was packed, and no where to sit down. This is a 5 star hotel with just two restaurants. Because we didn't have reservations we had to go drive to the casino for dinner at Shulas, great food, but it was an inconvience. None of the restuarants were open until 5:30. Really don't know what management was thinking......what a waste of opportunity to make money ......... instead they used the opportunity to upset everyone"
345052,3616,SteveSoccer,5,5,5,5,5,,2,FALSE,FALSE,1,"Stamofrd, CT",10/[YEAR-0],11/8/[YEAR-0],TRUE,The Belvoir name was upheld and should be proud thanks to the Stamford Belvoir.,,Best Hotel I've ever stayed in!,"I stayed at your hotel 6 nights (October 30-November 4) in room #930. This was this best hotel I've ever stayed in. Why? First impressions were great when I walked in your beautiful lobby. I really liked the free access to computers/internet (on large screen monitors) and printersin the lobby! Every staff member I encountered throughout the week was dressed neatly and very professionally in suits; and they were friendly to me whenever I walked through the lobby. A special thanks to Humberto (host/server) who graciously allowed me to read and write in the restaurant near closing time even though I did not buy anything to eat or drink. He was very hospitable to me. My room (#930) was immaculate and comfortable. I would really like to applaud whoever it was that refreshed my room every day. They went the extra mile, keeping the room spotless and stocking the bathroom with extra toiletries which I enjoyed using. Thanks for such a memorable stay that I won't soon forget. Great job!"
