reviewID,hotelid,userName,overall,roomComfort,staffMetNeeds,cleanRoom,facilitiesMetExpectations,ageRangeID,tripPurposeID,travelAgent,meetingPlanner,BPGStatusID,guestFrom,arrivalMonth,datePosted,recommend,everyoneShouldKnow,frequencyID,title,comment
7534448,3620,Donnyfs,1,2,2,2,2,3,6,TRUE,TRUE,4,"Jakarta Capital Region, Indonesia",7/2012,7/19/2012,FALSE,,4,far below expectations,no recognition beeing as BPG Platinum member.
7534458,421,Donnyfs,4,3,3,3,3,3,6,TRUE,TRUE,4,"Jakarta Capital Region, Indonesia",7/2012,7/19/2012,TRUE,the location,4,just ok,good location and convenience of the club lounge
7534494,468,Susanna1021,5,5,5,5,5,3,7,FALSE,FALSE,2,"Lakewood, CA",7/2012,7/20/2012,TRUE,It offers great water shuttle service - boat goes to Hollywood Studios and also to Epcot. From Epcot I took the monorail to Magic Kingdom. The only time I used the bus shuttles was to go to Downtown Disney or Animal Kingdom.,1,Stylish and Convenient!,"An outstanding value! This hotel is beautiful inside and out - quite the competion considering the ""official"" Disney properties next to it. You can't beat it's prime location and the ability to use the water shuttles.The staff was very friendly and courteous, and the restaurant food was great - a little pricey but to be expected. The room was very comfortable and soothing especially after a long day in the parks. Awesome pool area!"
7534564,380,brudda1,4,3,4,4,4,3,5,FALSE,FALSE,2,"Honolulu, Hawaii",7/2012,7/20/2012,TRUE,,3,Excellent Poolside Service,"Poolside cocktail service was provided by our server Angie. She was considerate, fast, and friendly. She was always trying to exceed our needs while we were spending the day at the pool."
7534798,344,Nepahere,4,4,4,4,4,4,7,FALSE,TRUE,4,PA,7/2012,7/20/2012,TRUE,,4,Nice Hotel,Nice Hotel and Staff when traveling thru LAX.
7535166,3679,rmart2,3,4,2,4,3,4,4,FALSE,FALSE,4,"San Antonio, TX, USA",7/2012,7/20/2012,TRUE,,4,Internet did not work,"Internet access was a failure. Belvoir Link did not work in the evening of 18 July. I had brief access via WIFI in the room that evening but it did not work in the morning of 19 July. I was told that Link did work on 19 July, albeit a bit late for my use."
7535626,802,TeachyMum,5,5,5,5,5,4,6,FALSE,FALSE,4,"Cuyahoga Falls, OH, USA",7/2012,7/20/2012,TRUE,The beds are as comfortable as your bed at home...and with more pillows to luxuriate in!,3,Blissful Comfort,"This is the second time we have stayed at the Belvoir at Cuyahoga Falls, and both times we arrived very tired after a long day's journey in the car. To be met with friendly yet efficient smiles, to be directed to a room that looks as lovely as the suites at the Belvoir, and to fall into a comfy bed and 4 assorted pillows (you're sure to find one that suits your pleasure)....well, it was just dreamy! Blissful sleep came very quickly to all three of us and we thank you for it! The only downside was that we couldn't stay a second night because the hotel was full. Too bad! Word must be getting out about this place!"
7535633,196,michga,5,5,5,5,5,,4,FALSE,FALSE,2,,7/2012,7/20/2012,TRUE,,,SEC,Quick check in. Easy access to Michigan Avenue and Navy Pier. Good recommendations from concierge.
7536237,814,GoodandBad,4,5,4,4,4,3,6,FALSE,FALSE,3,"Centreville, VA, USA",7/2012,7/20/2012,TRUE,Excellent location. Food price at the Cabanas has increased though not necessarily better quality.,2,5 stars if not for Aqua Vi,"This was our 4th consecutive visits in as many years. The staff are courteous as always. The updated room gives a more ""clean"" feel. The pool is narrow; we much prefer the former meandering pool, though the covered pavilion provides shades for those not wishing to be in the sun - something lacking previously. The main disappointment and dark spot of this stay was our experience with breakfast at Aqua Vi. We (party of 3 adults and 2 children) were made to wait about 40-45 minutes before we were seated. I noticed quite a few people arriving after us were seated before us. I enquired with the hostess and was told they are part of a wedding party of 25 who had reservation and that we will have a table soon. Fine. Meanwhile, the waiting room was cleared and only a few guest waiting. There comes a family of 4, unrelated to the wedding party, and they were seated within 5 minutes wait. Another family of 4 were seated right away upon arrival. I enquired again and complained. The hostess mentioned that she did not know that my party included 2 children. This is not good an explanation. COMMON SENSE should have prevailed that we have been waiting for 3/4 hour already and hence that everything should be done to accommodate our group, either to add another chair to a table or to join 2 tables together. But it never occurred to the hostess that there should be some parity and fairness, its 45 minutes versus 0 wait just because of 1 person. I wondered whether she would have kept us waiting had another family of 4 appeared, and until a table of ""5"" is freed. In the end, we were given a booth which is not even for 5 as one had to move out of the seat for the person inside to come out. I would not have cared for this had we been seated in the appropriate waiting time. I hope our situation is not repeated and that the hostess will look outside of the box."
7537996,166,anonymous23,1,4,1,5,4,2,5,FALSE,FALSE,2,,7/2012,7/20/2012,FALSE,,4,Front Desk and Valet,"Stayed at this hotel for a wedding recently, and was very disappointed with the service by the staff. Didn't have a room ready when we showed up at 6PM and front desk staff was not very friendly or apologetic for this inconvenience. Disappointed with this service and would expect alot more from a hotel in this area with high rates."
7544172,196,BigTfromSF,2,4,1,2,2,4,3,TRUE,FALSE,4,"Walnut Creek, CA, USA",7/2012,7/20/2012,FALSE,"great location for shopping and visiting clients downtown, worst thing too far from the convention center.",2,not real happy,the plus is the hotel is in a great location.
7544249,3054,Traci,2,2,2,3,1,3,5,FALSE,FALSE,2,"Florida, USA",7/2012,7/20/2012,FALSE,Awful hotel,3,Horrible Hotel,"The ONLY thing great about this hotel is the location. We were in town from Florida for a funeral. Read mixed reviews online about this hotel but trusted that a Belvoir would be nice and meet our expectations. Upon check-in we were asked if we would need a parking pass for the parking garage but were not told that it would cost us $25 a day to park at the hotel that we were guests at (ridiculous). We discovered this on the day we checked out and received our bill.The entire hotel desperately needs updating. Our room was on the pool level with a pool view. Every time a guest moved a chair at the pool it was extremely loud in our room. The room was warm and even though we adjusted the air it did not cool down. We asked for a 7:45 wake up call on the morning of the funeral but instead received a 5:45 wake up call. We then had to call back again to request another wake up call so that we wouldn't oversleep. The following morning we wanted to sleep in because we were exhausted so we did not request a wake up call but received one at 7:45 and could not go back to sleep. The pool was absolutely disgusting. The color was off, you could not see the bottom of the pool and there was hair all in the pool. There was nothing ""nice"" about the pool area either, only the view. You could hear a lot of hall noise in our room. The bathroom layout was small and the toilet is literally underneath the counter. Awful hotel and WAY over priced. Many nicer hotels to choose from in the area. Made a very difficult time even worse for us. Very disappointed."
7548524,127,toniD,4,5,5,5,4,5,3,FALSE,FALSE,2,San Diego,7/2012,7/20/2012,TRUE,great location,4,fridge,"we really enjoyed the hotel, the staff was helpful and kind. Loved the location."
7553613,421,nowanta,5,4,5,5,5,6,7,FALSE,FALSE,3,California,7/2012,7/20/2012,TRUE,GREAT location,2,Excellent,"Everything was perfect...except one minor thing....a previous guest had left a plastic baggie with some kind of food in it in the minibar. It had green things growing on it. It was easy to ignore, but so gross!"
7554030,674,mtljr,5,5,5,5,5,4,8,FALSE,FALSE,2,North Carolina,7/2012,7/20/2012,TRUE,Great Bed/Pillow combo,2,Great Memories,Had an awesome stay from 7/17-7/19. The most memorable stay I've had in any city. This Hotel will always be at the top of my list. Thank you for the service. MTLjr.
7554046,48,SJfromNC,4,5,4,4,4,3,5,FALSE,FALSE,1,,7/2012,7/20/2012,TRUE,,,Glad to see improvements from last stay,Overall the hotel was very nice. Nice to see a friendly face I remembered from my previous stay (Mr. D DIxon). I commented on the lack of recycling in 2011 and I was delighted to see that in place in rooms and the common areas. I want to suggest some type of cart that guests could check out (at their own risk) to roll their luggage and personal items in from parking lots. There was no staff available to assist with large hotel carts and I made three trips to my car to unload all my items.
7555389,421,babyv,3,2,3,2,3,3,5,TRUE,FALSE,2,New York,7/2012,7/20/2012,FALSE,"small rooms, but good location within good walking distance to lots of places",1,Was average,"The rooms were small, for the price we paid I feel the rooms could have been bigger also it stated that the beds were queen size however they were full, also the bathrooms didn't have a fan in them and they were small as well. Every day we didn't receive a full service of bath towels or bath mat and had to search for housekeeping in order to get more towels they were very nice in getting more if we couldn't find them we were told to just take from their carts but it was just inconvenient. Overall was an average stay have had way better hotels for less price and much bigger rooms and better accommodations."
7555452,90,Sparkie1602,4,4,5,4,4,3,6,FALSE,FALSE,2,"Lexington, KY, USA",7/2012,7/20/2012,TRUE,Staff was great!,1,Washington DC vacation,This hotel was nice. The sleeper sofa wasn't great so i wouldn't really count on that as a great option. The mini fridge upon arrival wasn't working in the room and after calling the front desk we had a replacement within 15 minutes. I also asked for an extra towel to be left each day and this was done without ever mentioning it again.
7556019,378,BillW,5,5,5,5,5,5,6,FALSE,FALSE,4,"San Luis Obispo, CA",7/2012,7/20/2012,TRUE,,4,Great Hotel,"First stayed in 1991 for our 15th wedding anniversary. My wife and I learned to scuba dive at the Black Rock. Since then we have been coming back every year or two, sometimes with our kids and sometimes without. We were last here in October for our 35th wedding anniversary. We have 4 rooms booked for next week for the whole family including the grandkids. Simply put, there is no better hotel and location for a family vacation."
7556205,2003,jackie222,5,5,5,5,5,4,7,FALSE,FALSE,1,"Phoenix, AZ, USA",7/2012,7/20/2012,TRUE,Self parking is bad!!!,1,Love the place,wondrful stay and place. San Diego is great and Hotel is walking distance from Zoo
7568234,460,roemer123,4,5,5,5,5,4,6,FALSE,FALSE,2,"Calgary, AB, Canada",7/2012,7/21/2012,TRUE,"Great, except for extra parking charges.",3,Excellent but watch out for the extra costs!,"Stayed at the Belvoir from July 6-9. The location is perfect!. It's right in the heart of downtown. Close to some serious shopping and walking distance to the Pike Place Market and an abundance of restaurants. I adore the scent in the main lobby.The rooms are very clean but the electrical outlets were old and worn. I tried to plug in my blowdryer and straightener and couldn't, they just kept falling out. I was charged extra for Wi-fi access that barely worked. I called the front desk and was told they would waive the wi-fi charge. Parking is NOT included in the room rate. Be prepared to pay extra for parking and WA state parking tax. Also i was still charged for the Wi-fi that was supposed to be waived.. an error on the hotels part that they kindly corrected. Overall good - it's a great place to stay. Overall bad - I wasn't made aware of the extra parking fees. The hotel chain should advertise the extra fees upfront when booking online."
7568819,94,sashiker,5,5,5,5,5,5,4,FALSE,FALSE,3,"Baltimore, Maryland",6/2012,7/21/2012,TRUE,"Food is very good; location good, room comfortable",3,Great Place to stay,"The hotel is located in a favorable area of Columbus; i.e., close to other restaurants and highway. The staff are helpful and professional, especially the bartender - an asset to Grandbourne. I will stay here again when traveling to the midwest."
7569239,350,CRBY,2,4,1,3,1,5,6,FALSE,FALSE,1,Indiana,7/2012,7/21/2012,FALSE,Totally unorganized.,2,Troubles continue,After a long day on the road with a tour group we returned to the Belvoir at 4:30. Our rooms were not ready. When we finally got to our room after an hour or so our luggage was not there. We were told to wait. After 5 hours and 2 more calls we finally went to the front desk and lo and behold someone checked on it and found it in another room. Something that could have been done 5 hours earlier if anyone had bothered.
7569863,2011,Kris87,4,4,4,4,4,3,6,FALSE,FALSE,2,"Ohio, USA",7/2012,7/21/2012,TRUE,"Excellent, safe location, right off the highway",3,Exceeded expectations,"I was very pleased with our stay at this Belvoir! The location was excellent for traveling around the Washington or Baltimore area without being the in middle of the city. It was set back in a nice, quiet area right off the highway."
7570437,1776,rf17,4,4,5,5,5,,2,FALSE,FALSE,3,,7/2012,7/21/2012,TRUE,,,Great Value,This hotel is conveniently located; has a great staff and is a great value for the money
7571321,166,StevenB,4,4,5,4,3,,8,FALSE,FALSE,2,,7/2012,7/21/2012,TRUE,,,Front Desk Staff Saved the Day,"Everything was just fine with our one-night ""romance package"" stay except for one thing. There was a wedding that night and our room must have been right over or near the ballroom. The noise was so loud from the music and guests, that our room was literally vibrating. This went on from 9:30 pm to 11:45. Needless to say we couldn't sleep - and it sure wasn't romantic. We called the desk and complained. They said it would be ending at 11 pm (not true) and said they'd have security quiet it down (didn't happen - it got even louder). The next morning we complained about this. The front desk staff couldn't have been nicer. They were apologetic, knew about the problem, offered to buy us breakfast, gave us Grandbourne points, etc. There can always be a problem, but if the management accepts responsibility and makes it up to you - that really saves the day. So I think Belvoir should do two things. Says thanks to their front desk staff for a job well done - and soundproof their ballrooms. No guest should every have to lose sleep because of too much noise in the hotel."
7571330,954,GE70,2,3,4,2,1,3,4,TRUE,FALSE,3,"Miami, FL, USA",7/2012,7/21/2012,FALSE,,3,Not very clean and a little run down,Very dirty carpet in room and hallways. Rundown intreriors (for example my room had a chipped bath tub). The bedsheets were wirnkled but otherwise looked clean (I hope they were!)
7571397,90,Robert03,1,3,1,3,1,,4,FALSE,FALSE,3,,7/2012,7/21/2012,FALSE,,,very poor experience - beware elevator!,"Had the pleasure of getting stuck in the elevator for approx. 10 min. Extremely hot. Once I finally heard response to the red button, it was 'SOMEONE IS ON THE WAY!"" No apologies. No sorry for the convenience. After being extracted, the front desk had nothing further to offer. The hotel staff appeared completely unprepared to address this situation. I was rewarded by being charged for drinking a 2nd bottle of water on the hotel bill.."
7571410,1327,Buffalo83,4,4,5,5,5,2,4,FALSE,FALSE,4,"Buffalo, NY",7/2012,7/21/2012,TRUE,"Outside appearance aside, a great hotel",4,nice hotel,Had two stays over a one week period. hotel was extremely accommodating to me to find a room with my specific needs on short notice and during a period of high occupancy.
7571436,90,Jim86,4,3,4,4,4,4,4,FALSE,FALSE,4,"Winona, MN, USA",7/2012,7/21/2012,TRUE,,2,"Pretty standard, room for improvement",This hotel is pretty standard for the Belvoir Suites Hotels.
7572150,127,Sue777,3,4,2,4,4,3,5,FALSE,FALSE,2,,7/2012,7/21/2012,FALSE,,3,A hassle,"This was my first stay as a Belvoir Preferred Guest. The room was above average, and I enjoyed the upgrade to club level and the club lounge and breakfast. My primary complaints are the following:"
7572181,468,tapatee,5,5,5,5,4,5,6,FALSE,FALSE,3,"Boston, MA, USA",7/2012,7/21/2012,TRUE,"The people here are courteous, attentive and always have a smile. Makes coming here like coming home.",2,Amazing Hotel,"Have been staying at the Dolphin for 10 years. Hotel is beautiful. Every restaurant has excellent food and wonderful staff, courteous and attentive. Rooms are clean and beds are so comfortable. Housekeeping is excellent. Location between epcot and Hs cannot be beat. can walk to both. Pools are fabulous, spa is gorgeous. I would definitely recommend this hotel and I have. I plan to come here for many years to come."
7572260,127,MarkG438257348,3,4,3,2,3,2,5,TRUE,FALSE,2,"California, USA",7/2012,7/21/2012,TRUE,,3,This place was okay,"I came during Comic-Con so I expected it to be really busy. My room was clean, except for the fact that my duvet had a gross stain on it. The shuttle service is nice, and the drivers are great if you're trying to get somewhere on time."
7572665,1703,pegg2002,2,1,3,2,1,4,2,FALSE,TRUE,2,"San Diego, CA, USA",7/2012,7/21/2012,FALSE,Do not expect much.,2,Over rated and really needs help.,"The staff was friendly but my toilet clogged up and my tub would not drain. Asked for the toilet to be fixed and the guy came with a stopper in a plastic bag, fixed the toilet but left the liquid mess. I took a shower and the tub took over an hour to drain."
7572715,158,laflaca,2,2,2,3,3,,6,FALSE,FALSE,3,,7/2012,7/21/2012,FALSE,,,not my first choice for future stays,"We always stay in Grandbourne properties but were disappointed with this hotel. Check in was slow (only one clerk, and a very busy lobby with a large youth sports group on site). There is self-parking on site - the hotel is in a suburban area with plentiful parking, next to a large shopping mall - but the valet was overly persistent in offering his services to two able-bodied adults with only one small bag between us."
7573099,795,andI3456,5,4,5,4,5,4,2,TRUE,FALSE,4,"St Louis, MO, USA",7/2012,7/22/2012,TRUE,its a hidden secret,4,best kept secret,"great hotel. great staff, great area, great club lounge, great bar, great pool"
7573587,102,Sister5,4,4,5,4,5,4,4,FALSE,FALSE,2,,7/2012,7/22/2012,TRUE,Great location to visit patients at John C. Lincoln Hospital.,4,Great for business meetings,"We visited a relative and found the hotel to be convenient and meeting our needs. In addition, the staff was very helpful. I complement the hotel for having a relationship with the nearby hospital."
7574055,1495,ronjl,1,2,1,3,1,,4,FALSE,FALSE,2,,7/2012,7/22/2012,FALSE,,,"Slow shuttle, bad management",I was extremely dissatisfied. After being delayed in airports for 6 hours I had to wait for 50 minutes for the shuttle after being told it would arrive in less than 20 minutes. The driver blamed the front desk the front desk blamed the driver. Neither seemed to care. I had to wake up at 4:45 the next morning and got only 4 hours of sleep. Never going there again
7574175,741,AJHICK,2,3,3,3,3,3,3,TRUE,FALSE,4,"Atlanta, Ga",7/2012,7/22/2012,TRUE,,4,Hotel needs updating,Bathrooms need updating. Location is good.
7574183,468,doglover6,3,4,2,5,4,4,1,FALSE,FALSE,2,"Charlotte, NC, USA",7/2012,7/22/2012,TRUE,It's clean and the pools are THE best thing about it.,2,Great Resort - but not the food,"The resort itself was grand and impressive, exp. compared to the official Disney Resorts. The room was nice and clean, the pools were fabulous, but the food was terrible, exp. for the price and we're not picky eaters. A hot dog, fries and drink was $10. A salad was a head of uncut lettuce, with a spoon full of cheese, yogart, and a thin slice of cucumber for $19! I sent it back! They had to be joking!! Most of the staff was courteous, but not as much as you would expect from a ""resort"". The housekeeping staff was nicer than the front desk and concierge staff! We would stay here again because the room was clean, the pools were great, and it's convenient and free shuttle to the main parks."
7574269,3115,Jodikay,5,4,5,5,5,4,6,FALSE,FALSE,2,"Illinois, USA",7/2012,7/22/2012,TRUE,"Kind, helpful staff from reception, to transportation, to housekeeping.",2,Fabulous Staff and Wonderful City!,"From the moment we stepped into the lobby, the staff of this hotel treated our family like valued guests! We enjoyed our stay in this hotel and Louisville so much, we stayed an extra night! If you are coming to Louisville, this hotel is a must stay!!"
7574443,3205,Jackson2012,2,2,1,5,5,5,3,TRUE,FALSE,1,,7/2012,7/22/2012,FALSE,They have no relational skills,4,Guest relations nightmare,I stayed at the Denver Belvoir for a conference with School Nutrition. I travel 40 weeks a year. The accommodations were fine except the bed was very uncomfortable (loved the pillows). I was in conference Suday morning thru wednesday. I stayed over Wed night to sight see thursday and lounge around the pool before I flew back that night. I called the front desk to request a late checkout and they told me that noon was checkout and anything past that would be a $50 chg per hr. I will NEVER stay at Belvoir again!
7574513,1569,Papillo,5,5,5,5,5,3,6,FALSE,FALSE,3,Estados Unidos,7/2012,7/22/2012,TRUE,,2,Muy buen hotel,Super󠮵estras expectativas
7574578,1798,PDPlatinum,2,3,1,3,3,3,6,FALSE,FALSE,4,"Dallas, TX, USA",7/2012,7/22/2012,FALSE,"If you expect a smile from the staff, you are expecting too much.",3,Poor service,"All the staff, with a glaring exception of one (Cindy at the front desk) , needs to improve on following :"
7574592,1506,Ljean,3,2,5,3,4,,8,FALSE,FALSE,2,,7/2012,7/22/2012,FALSE,The staff is awesome!,,Room small for BIG price,"The staff was most accomodating , we take our dogs everywhere we go and they were a big help in looking after them while we went to a concert. I was a little disappointed in the room size, we frequent hotels often and we always pay much less for the same or higher quality hotels and except for Grandbourne have always ended up with very large rooms, this one was quite small. Also if you are going have exposed pipes in the bathroom, they should be kept clean as well as those places behind the toilet, After all we are paying to have the best of the best."
7574784,166,Belvoirguest,1,5,1,5,1,4,3,FALSE,FALSE,2,"Wilmington, DE, USA",7/2012,7/22/2012,FALSE,Don't stay there if you are a traveled business person.,3,Understaffed and acquard,Understaffed and Confusing
7574874,832,GQ4Life,1,1,2,2,1,3,4,TRUE,FALSE,3,"Atlanta, GA, USA",7/2012,7/22/2012,FALSE,"The hotel is very old and it desperately to need to renovated, upgraded, torn down and rebuild.",2,Desparate Renovation and Upgrade,"This hotel is old and smell like mildew from the moment I walked in the door. The hallway smell stale and very warm. The rooms was horrible with the stale smell. Furthermore, the pictures of the rooms on the website are deceiving. The phones were old from the 1970's. The floor was extremely dirty and needed to be clean. The floor was so dirty until the white socks I was wearing were filled with dirt. I stayed on the club level and the food was dry and not fresh at all. I was suppose to stay two nights but after arriving and checking in to my room, I could not bear another night at the hotel. So I checked out after the one night stay moved to another BPG 25 min away. Finally, this hotel is very dull and old and it's in desperate need of a major renovation. For the amount of money I paid for the one night was not worth. I understand that Belvoir has been around for long time. But this hotel look like it was the first one built and there has not been any change except for the 40 inch flat screen tv on the wall. I highly recommend this hotel being torned down and rebuilt and this will bring new life to the Midlothian area and I am sure the residence in the area will appreciate it. Therefore, until changes are made short pump will be the area that I will stay in when I visit Richmond."
7574889,3054,sm73,2,2,4,4,2,3,5,FALSE,FALSE,3,Chicago,7/2012,7/22/2012,FALSE,,2,Hotel in poor condition,Air conditioner in unit made loud noise while opertaing
7575155,1327,Zeke33,2,1,3,2,1,4,4,FALSE,FALSE,4,,7/2012,7/22/2012,FALSE,,4,Needs Improvement,"As a Lifetime Platinum I stay in many Grandbourne properties and this one rates as poor. Many of the ""Upgrade"" rooms have small bathrooms, poor/bad drainage in the tubs and sinks, and the ventilation is very poor."
7575216,421,Steph972,5,5,5,5,5,6,5,FALSE,FALSE,3,"Dallas, TX, USA",7/2012,7/22/2012,TRUE,Personal service,2,caring staff,"I suffered a death in the family while I was staying at this Belvoir.From the moment I asked the staff if I could extend my stay to deal with this tragedy, everyone from manager to door staff went out of their way to help me and to ease this terrible time for me. I never expected all this from what appeared to be a big impersonal NY hotel. I cannot say how much i appreciate my experience there."
