reviewID,hotelid,userName,overall,roomComfort,staffMetNeeds,cleanRoom,facilitiesMetExpectations,ageRangeID,tripPurposeID,travelAgent,meetingPlanner,BPGStatusID,guestFrom,arrivalMonth,datePosted,recommend,everyoneShouldKnow,frequencyID,title,comment
7352280,942,JStiles,3,3,3,5,3,2,4,FALSE,FALSE,4,"Denver, CO, USA",7/2012,7/11/2012,FALSE,eat at restaurant instead of ordering room service.,4,"decent, bad food","I ordered the BBQ chicken, which ended up costing $25 with fees. It's listed as chicken thighs with vegetables and jasmine rice. When it showed up, it was a pile of over-microwaved stir fry with approximately 3 ounces of cut up chicken. Very very disappointed."
7352330,196,RB06,2,3,2,3,1,4,3,FALSE,FALSE,1,"Long Island, New York, USA",7/2012,7/11/2012,FALSE,,2,Billing issues/miscommunications,"When we arrived at the room, the bureau was broken so unable to use the drawers. Called immediately to ensure I was not charged for damage and they were aware the problem existed and would send someone up to correct. Engineers came two days later when we were busy. Told them to come back in an hour, which they agreed to, and they came back two days later as we were checking out."
7352482,421,RR10,3,3,3,3,2,,6,FALSE,FALSE,2,,6/2012,7/11/2012,TRUE,Great location for turist.,,Better first stay,"Although our stay was comfortable the first experience staying at this location was better. Some of the advertised amenities were not available as promised at the time of booking and the bathroom was not as clean and had an odor. My schedule was such a busy one so I didn't have time to complain, but for the price I just expected better. The location was perfect and the breakfast in the market was great as usual."
7352484,1556,Mauidave,2,2,3,2,2,5,6,FALSE,FALSE,3,"Palmdale, CA, USA",7/2012,7/11/2012,FALSE,Good location,2,review your options,We expected more from Belvoir. The freeway side is very noisy. Choose a room in the back if you want to sleep. We were moved three times because of defects in the rooms. Sink that we could not shut off and a front door that would not open. Musty smelling rooms. The last room we were put in was an Accessible room(808).The toilet leaked on to the tile and carpets were very dirty and stained. Not the standards I expect at a Grandbourne Belvoir property!
7352496,96,SCOTT1,5,5,5,5,2,4,6,FALSE,FALSE,4,Dallas,7/2012,7/11/2012,TRUE,So comfortable,2,Can Wait To Get Back!!!,"Excellent Excellent Excellent, one problem the floor is too slippery in the indoor pool area it an accident waiting to happen. please add so rubbish water water absorption mats."
7352530,1196,21Aurora,1,3,1,3,2,3,6,TRUE,TRUE,1,"Santa Barbara, CA",6/2012,7/11/2012,FALSE,"Rude Front Staff, Horrible Food, and I can go on on.",4,Horrible Front Desk Service,"I drove from Santa Barbara, CA and I work for a Luxury Resort as well, I had my two daughters, I had my Father who was just discharged from a surgery, and I came to find a Hotel Manager who was extremely rude, as wel his staff. Horrible Food, fair service in the breakfast,"
7352592,430,LDMassachusetts,5,5,5,5,5,3,6,FALSE,FALSE,3,"Massachusetts, USA",7/2012,7/11/2012,TRUE,The view from the club lounge is excellent!,2,Home Away From Home,"Belvoir Boston is our home away from home. We live just an hour away from Boston and, if we have the points, we always opt to stay there instead of driving home after a night activity in the city. The club lounge is excellent and worth the extra $25 charge. The lobby bar is excellent; love the fresh flowers from Winston's! We don't love the restaurant, but it doesn't matter since the location gives us so many options. Being close to Summer Shack is an added bonus!"
7352656,460,Rob76,1,2,2,4,2,4,8,FALSE,FALSE,1,"Newport, oregon",7/2012,7/11/2012,FALSE,"The lobby is bustling 24/7 so if you need to chat with the one and only concierge on duty, plan to wait.",2,Big disappointment,"What a surprise to stay at a high end, top quality hotel, only to find the following disappointments:"
7352745,468,GatorHawkTLH,5,5,5,5,5,3,6,FALSE,FALSE,3,"Tallahassee, FL",7/2012,7/11/2012,TRUE,Luxuirous hotel on Disney property,2,Great hotel for families,My family and I were looking for a place to stay on Disney property and chose the Disney Dolphin. We could not have had a better experience. The hotel staff was friendly and inviting. The room and bed were very comfortable. We were able to watch the fireworks from Epcot outside our window as our 8 year old and 5 year old got ready for bed. I cant tell you the memories we made at the Dolphin. We cant wait for our next visit. The Disney Swan and Dolphin hotels are now our hotels of choice on Disney property.
7352889,127,MarkA2012,3,5,3,5,4,4,6,TRUE,FALSE,3,CA,7/2012,7/11/2012,TRUE,,2,"Great location, too noisy, parking terrible",I like this hotel. Stayed here for several times. This time we faced the airport on 10th floor. VERY noisy in the AM on Sunday. Parking was terrible and they charge you $22 to park on a dirt lot where my clean car got dirty. Pool is nice. Location is very nice. Pool was understaffed. Jacuzzi did not work.
7352915,270,BC03,4,4,4,5,5,3,7,TRUE,FALSE,3,"Neptune, NJ",7/2012,7/11/2012,TRUE,great envirionment,4,Great Weedend Stay,"Great relaxing environment in a busy town, everyone from the bell man, to the front desk and beyond were ""great"" I travel at least 12 times a year and enjoy a friendly staff as well as a great environment and room facility...they had it all."
7352984,664,Private1,5,4,5,5,4,4,7,TRUE,FALSE,4,New York,6/2012,7/11/2012,TRUE,Location is prime!,4,People are the best.,"Everyone is great at this hotel, especially the Front Desk, Camila, and restaurant manager, Buu. The hotel may not be the nicest when compared to others, but the staff is one of, or if not, the best I have encountered."
7361667,127,Bob1234,2,3,2,1,2,4,8,FALSE,FALSE,1,"Arizona, USA",7/2012,7/11/2012,FALSE,House keeping needs improvement,4,Average Hotel,"Stayed 3 nights, room was had garbage on the floor under the stools, under the couch and hand prints on the balcony door. Asked to have the room cleaned with attention to those areas and only the window got cleaned. The garbage stayed there until we left. The shower was broken the whole time, couldn't get the shower switch to engage the full way, so half came out the shower and half out the shower head, also no hot water, luke warm water the whole time we were there. I have been to almost all the hotels in that area and this falls below lots of others around there. The view is very nice of the Navy base and downtown SD. You also get all the noise from the helicopters until about 9pm during the weekdays. Only one on the staff that was nice was Dave the Bellman. The valet staff was very rude, took my keys and then when they found out i would be self parking the park my truck in the sun and wouldn't have anything to do with me. The cleaning staff ignored our requests and the people up front at the desk gave the appearance of caring but had no followup on the room. Prices were comparable to other hotels. Swimming pools were very crowded with lots of families and drunks, maybe it was just that time of day, but i went back several times through out my stay and always the same. Also the TV would keep going out and having no signal at night. Good place to drop your bags and go see the rest of SD. Wouldn't recommend it."
7375008,421,RM656,2,3,2,3,1,,6,FALSE,FALSE,3,"Ashburn, VA, USA",7/2012,7/11/2012,FALSE,Poor guest service,,Room not well serviced,"When we checked in, we realized that the room did not have a shower curtain and housekeeping had not provided wash clothes or hand towels. After repeated calls to guest services, we finally got them to install a shower curtain but we never got the towels."
7381269,1162,SweetSue,5,5,5,5,5,5,6,FALSE,FALSE,3,"Fort Myers, FL",7/2012,7/11/2012,TRUE,Get down to the pool early if you want a lounge chair in the shade!,2,Never Went to Disney!,"This hotel was beautifully and thoughtfully remodeled. We enjoyed the amenties so much that we never went to Disney! The staff were wonderful, helpful and knowledgeable. The pool bar servers including Elizabeth & Melissa as well as Enrique were top notch! Oscar came by with cool washcloths to ward off the extreme heat and Jayson was hard at work (and with only one arm we even saw him lift patio umbrellas)! The only little complaint was the price of the breakfast buffet $14 seemed a bit steep as there were only the basic selections - nothing out of the ordinary. However all tasted fresh and delicious. Dinners were great and bar-b-que by the pool was just perfect. Many thanks for a wonderful stay - see you real soon!"
7382816,2019,DON43,4,4,4,4,4,6,6,FALSE,FALSE,4,Ontario,7/2012,7/11/2012,TRUE,Great restaurant with outstanding staff and kitchen.,4,A good category 3 hotel,This is a hotel that we often use for weekend visits and have got to know many of the staff. Check in was speedy and an upgrade was made to the Club Floor: I believe that there are some suites but have never been offered an upgrade to one. Dinner on the Saturday night was outstanding. Great service from Sophia and excellent meals. On this visit we did not use the pool or fitness center. The only negative of the visit was breakfast on Sunday in the Club Lounge. When we arrived there were dirty dishes everywhere and the trash can was overflowing. We had to remove dishes and clean a table off ourselves before we could eat. Some time later a service person came to tidy up but all she did was compress garbage in can:there was still not room to put anything more in. Usually there is someone up in the lounge all the while to take care of things: I was told later that he was on vacation. Checkout was good and I had the opportunity to mention the lounge problems to Noelle.
7403591,270,Ike61,3,3,3,2,3,5,8,FALSE,FALSE,3,PA,7/2012,7/11/2012,TRUE,We stayed there before and it was an exciting place to spend our anniversary. Hope they return to the same great services we experience the first time we was there,3,Lack of response to room repairs.,The day we arrived there were no face towels and it took them until 1am to bring some to our room.
7416458,1162,JimP,3,3,4,4,3,4,6,FALSE,FALSE,3,"Connecticut, USA",7/2012,7/11/2012,TRUE,Location great and new pool area is great.,3,Great new pool area,"We are staying at this hotel even as I write. The welcoming staff who greet you and offer to park your car are terrific. As well, most of the staff who work the pool area are very attentive. The housekeeping staff needs special recognition for the job they do here. Get rid of the fees for ""resort fees"", microwaves and most of all parking. These are an insult, especially for BPG members. There is no special recognition for being an BPG member and there should be. Get rid of the cabana rentals too...most people will not ever pay for these. What is the ""resort fee"" for? There was almost no activities planned and while the pool area is well done, this fee should not exist for that alone. This hotel is in a great location and most staff do a great job."
7443963,1137,CRBY,1,1,1,1,1,4,6,FALSE,FALSE,1,ma,7/2012,7/11/2012,FALSE,find another one,2,woderful stay? not,"passing through NJ. we need a stop and rest bed. checked in at 9pm with no reservations,(my fault) when we got to the room the walls in the shower were not very clean, there was mold growing in between the grout joints and fresh caulking was aplied over existing mold.the room slept 4 but there was only 3sets of towels in the bathroom. after driving all day, figured what the heck we'll watch a little TV before retiring for the evening, Oh sorry No TV for You tonight, it didnt work. all this for 205.85"
7444512,3052,Luckyoyo,4,4,4,4,4,1,2,TRUE,TRUE,4,"Chicago, IL",4/2012,7/12/2012,TRUE,The lounge!,4,good hotel,Fair hotel with good location and customer service. The lounge is great!
7444518,3052,Luckyoyo,4,4,4,4,4,1,2,TRUE,TRUE,4,"Chicago, IL",6/2012,7/12/2012,TRUE,The lounge!,4,good hotel,"Great location and service, and the amazing lounge!"
7444548,1991,oneFrequentTraveler,1,1,1,1,1,4,2,TRUE,TRUE,4,"New York, NY, USA",7/2012,7/12/2012,FALSE,"Horrible customer service by front desk staff, especially Nina.",4,HORRIBLE HOTEL - AVOID,"Do not be deceived with the ""newly renovated"" claim. The rooms are still the same and the rudeness of the staff is still extremely obvious. Especially if you are unlucky to check-in in the morning. The evening shift leaves and the rude morning staff gets in and they are awful. Yes, they renovated the lobby and it's nice but it doesn't change how awful everything else is. AVOID!! There are other better hotels in the area."
7444567,1138,MM53,5,5,5,5,5,4,6,TRUE,FALSE,2,"California, USA",5/2012,7/12/2012,TRUE,Hospitality,2,Great location,"My family and I did really enjoyed the stay at this hotel, staff were very accommodating to our last min request for room avail and also polite. We recommend anyone that wants to be treated well."
7444638,1552,yukidevil,4,4,5,2,3,6,6,FALSE,FALSE,2,"Garden Grove, CA, USA",7/2912,7/12/2012,TRUE,The Staff was extremely friendly and helpful.,2,not bad,Parking was not good for handicap. Not enough stalls. I was willing to park across the street in the Target parking lot.
7444643,48,Npir,2,3,4,2,2,4,4,TRUE,FALSE,3,"California, USA",7/2012,7/12/2012,FALSE,Not to BPG standards,4,This hotel does not uphold BPG standards,"furniture, bath room are not consistent with BPG standards. Older furniture, worn carpet, average bathroom. Terrible room noise isolation"
7445123,151,Aunteez,5,5,5,5,5,5,7,FALSE,FALSE,2,Georgia,7/2012,7/12/2012,TRUE,Home away from home comfort,3,Wonderful,We recently visited your facility on our first vacation to New York. It was a wonderful experience. The bed was comfortable and the room was very clean. The club lounge had good food and friendly hostesses. I would recommend the place to all my friends.
7445155,1130,CTdead,3,4,2,3,2,3,5,FALSE,FALSE,1,"Winchester, VA, USA",7/2012,7/12/2012,TRUE,Great Location,3,Plumbing needs upgrade,Hotel location was great (few blocks from merriweather). Room was nice and furniture was very comfortable. Plumbing in the room was not adequate. Tub did not drain and toilet would run after flushing. This was not what I expected from a Belvoir facility.
7445169,1047,DocD,2,4,2,4,2,4,5,TRUE,FALSE,2,"Dallas, TX",7/2012,7/12/2012,FALSE,Eat somewhere else.,3,Disappointing,"My experience here was sub-par. The room was average, which is fine, but the restaurant was a real let down."
7445227,127,Benidorm,5,5,5,5,5,3,6,FALSE,FALSE,3,"Arlington, VA, USA",6/2012,7/12/2012,TRUE,Fantastic Tower Views of the San Diego Skyline,4,San Diego Relaxation,"I was highly impressed with the hotel and its amenities. The pool added a resort like feeling to the atmosphere and movie night at the pool is great for the kids. The front desk, cleaning, valet and pool attendants were all hospitable. Although the hotel lies on the outskits of downtown we were able to use the Big Bay Shuttle for $1 to get to downtown."
7445295,664,Qsgv,4,4,5,5,4,5,6,FALSE,FALSE,3,"Frankfort, KY",7/2012,7/12/2012,TRUE,Mexican restaurant is very good. Staff are very helpful and courteous.,4,Great Location & Service,Had a beautiful view overlooking the marina & beach. Food in Mexican restaurant was delicious. We were meeting a friend of my husband from high school. Waitress at the pool restaurant was wonderful. She kept our drinks refreshed and courteously let us visit for hours. The burgers and fries in the Whale Watch hit the spot. Staff at this hotel are very good! Someone left Mont Blanc pens in the safe of room. I meant to leave with desk. Now must ship back to hotel.
7445341,196,ppat,5,5,5,5,5,4,8,FALSE,FALSE,2,"Maryland, USA",7/2012,7/12/2012,TRUE,Location is perfect for people interested in staying in downtown Chicago,2,"Excellent hotel, excellent location","Besides the location which was perfect with most downtown attractions within walking distance and great views (Hancock and Navy Pier in the North, and Willis Tower and Chicago River in the South), we found the hotel staff to be very accommodating and courteous. They checked us in much earlier than normal and extended our check-out time to early evening at our request. The concierge was very knowledgeable and helpful in charting out a plan for touring Chicago."
7445361,460,gad1206,4,4,4,5,4,2,6,TRUE,FALSE,4,Boston,7/2012,7/12/2012,TRUE,The hotel was renovated last year,2,Weekend Trip,"Was in Seattle for a wedding and decided to stay at the Belvoir in the heart of Downtown Seattle. Its in a great location and pretty convenient to anything we wanted to see. Ended up getting an BPG Platinum upgrade to a suite which overlooked the city. Great view. The staff was friendly and attentive, the Concierge Lounge was nice but incredibly busy. Overall, enjoyed our stay at the Belvoir especially for the price we paid."
7445387,3175,Deb12,5,5,5,5,5,6,5,FALSE,FALSE,2,"Houston, TX",7/2012,7/12/2012,TRUE,It's very close to Ranger Stadium and Six Flags over Texas!!!,4,Great Staff!!,"We were very pleased with the staff at this hotel - they were very attentive and helpful when our cards didn't gain us access to the Club Room and our floor. Very friendly, very helpful and service oriented!! Would highly recommend this particular Belvoir!!!"
7445451,1113,jr58,3,1,4,4,1,5,6,FALSE,FALSE,2,"Simpsonville,SC",7/2012,7/12/2012,FALSE,,2,Pain in the back,My wife and I usually stay at a different hotel chain when in town. The Belvoir was more strategically located to our business this time so we thought we'd give it a try...Over all the hotel was OK. The problem was the hotels choice of mattresses. It appeared to be a cheap knock off of some type of memory foam gone bad. It was the most uncomfortable mattress I'd ever tried to sleep on. It offered absolutely no support. I sank in the bed to the point where I swear I could feel the box spring below.Needless to say I ended up sleeping on the couch.The next morning we were offered another room. While the next bed was slightly better another night of sleep depravation was in store for me.Needless to say if you have back problems as I do this hotel would not be for you.
7445506,865,gaprince,5,5,4,4,5,3,5,FALSE,FALSE,2,"Parsippany, Parsippany-Troy Hills, NJ 07054, USA",7/2012,7/12/2012,TRUE,You will not be disappointed!,1,An excellent stay,This was my first stay in a number of years and I must saw it met every best possible standard. I will definately stay here again.
7445631,691,Bobbie001,3,2,2,2,2,6,3,FALSE,FALSE,2,"Vienna, Virginia",7/2012,7/12/2012,FALSE,No Comment,3,Problem with hotel room keys,Hotel stay would have been great if we would have not have to keep getting our hotel keys activated on a daily basis. This was not caused by nothing we were doing wrong. We had to keep going down to the front desk to have our keys activated to get into our room. The hotel was too occupied to move us to another double bed room at that time. Maintenance came to fix the door and we still had to keep getting our keys activiated after that. Something was seriously wrong with that hotel room door.
7445696,1726,LisaGJ,5,5,5,5,4,4,3,FALSE,FALSE,2,"Mobile, AL, USA",7/2012,7/12/2012,TRUE,Great Customer Service,3,Great Home Away From Home,We stayed at this hotel for 6 nights during a dance competition. That's a long time to stay in a hotel room but this was very comfortable accommodations for an extended stay. Every employee from front desk to housekeeping seemed genuinely happy to assist in any way possible. The only things I would change about the property would be an outdoor pool and access to wireless internet in the guest rooms.
7445709,460,auntsissy,5,5,4,5,5,6,7,FALSE,FALSE,2,"Cape GIrardeau, MO",7/2012,7/12/2012,TRUE,It is right in the heart of the shopping district,3,Good Experience,"Hotel is nicely put together, great location. Clean, comfortable, appreciated the BPG amenities. The on site grill was excellent! Would stay here again."
7445725,96,Benjy,4,4,4,4,5,5,7,FALSE,FALSE,2,"Colorado, USA",7/2012,7/12/2012,TRUE,Dog friendly,2,Great stay,"We had the double suite. It was smaller then expected but adequate. The beds are very comfortable. A couple of times we had to ask housekeeping for linens as they were not replaced. The front desk staff is wonderful. They will answer all your questions, give directions and help you in many ways. Very dog friendly."
7445741,350,BeckyC,4,5,4,5,3,4,8,FALSE,FALSE,2,"Orange County, CA",6/2012,7/12/2012,TRUE,,3,Very comfortable,Beautiful place. Very comfortable room/bed. We were not informed of any breakfast at check in if it was included with our room.?? Our biggest issue - no free wifi in our room. For a huge chain it is hard to believe it wasnt provided in-room. We had to sit in the bar. Good marketing for sales - but bad on customer service. Overall - a very nice stay.
7445883,741,Geosn00p,4,4,5,4,4,1,6,FALSE,FALSE,3,"New York, NY, USA",6/2012,7/12/2012,FALSE,May and the rest of the staff are amazing!,2,"Elegant Hotel, Charm is in its Age","This was a wonderful hotel and has the best staff of any Grandbourne Property I have stayed at. I stayed here with my family and there were a bunch of us in a suite. A woman from housekeeping, May, deserves recognition. Not only is she hilarious, offering to bring me a sandwich from cozy (obviously she was joking) since she saw me doing work at the desk, but she brought us extra bottles of water and a truck load of towels."
7445903,741,Geosn00p,3,3,3,3,3,1,3,FALSE,FALSE,3,"New York, NY, USA",3/2012,7/12/2012,FALSE,"It's dated, but if you know that then it's not a bad place to stay.",2,You Get What You Pay For,Room rates are cheap here which is the reason I chose it. The hotel is dreadfully old and the rooms could use an upgrade although the beds were really comfortable.
7445969,1162,Ed1950,5,5,5,5,5,5,7,FALSE,FALSE,3,"Mt. Laurel, NJ",5/2012,7/12/2012,TRUE,The staff is the best!,2,Great staff/great facilities,"My daughter had a great stay back in May. She found the new facilities outstanding and the entire staff was very helpful and friendly. The only thing she missed out on was the extra BPG points for not having the linens changed. See didn't see the offer until she was packing up to leave. Otherwise, her stay could not have been better."
7445971,713,Elizabeth100,5,5,5,4,5,4,6,FALSE,FALSE,2,TX,6/2012,7/12/2012,TRUE,The rooms and rest of the interior are awesome!,2,You get more than expected,"I was very pleased with the new updated Belvoir! For the price I paid; it was an exceptional value! Good location, VERY friendly and helpful staff, and a great room! I loved the room layout-keeping the bath & closet completely separate from the rest of the room. I am the only early riser in my family and for once I was able to get up and go out in the morning without waking my late sleepers up!!"
7446392,353,Whatever21,3,4,5,5,2,4,5,FALSE,FALSE,2,NY,7/2012,7/12/2012,TRUE,,,"OK, not that impressed","It was an ok stay. I would recommend, but I would recommend others first."
7446775,5607,MONIFA1974,5,5,5,5,5,3,6,FALSE,FALSE,2,"Orlando, FL, USA",8/2011,7/12/2012,TRUE,"VERY CLEAN,FRIENDLY EMPLOYEES,GOOD VALUE",,Always Great,We've been coming the the Belvoir Villages for the past 6 years and this is the only place we stay the staff is always so nice and friendly.The rooms are always nice and clean I love that they do movie night for the family.I will be returning in December with my granddaughter for her first experience I love the Villages!!!
7446938,1162,delta,4,4,5,3,4,5,6,FALSE,FALSE,3,"Pascagoula, MS",7/2012,7/12/2012,TRUE,parking is impossible after the parks close,4,Changed since Disappointed in April,"Thank you for making our July visit much better than our April visit. The outstanding BPG recognition by Elizabeth, Teo and Kelly's going out of their way to assist in whatever ways needed, and Jon and Michelle's going out of their way to be friendly and attentive to us and our furbabies made us feel as though the hotel's mission statement has been changed to ""make the guest feel welcomed!"""
7446976,2017,infini35,4,3,4,4,4,3,6,FALSE,FALSE,2,Aiken SC,7/2012,7/12/2012,TRUE,Staff is Great!,,Great Weekend Trip!,The staff was always pleasant and helpful. Keith was helpful in recommending places to eat. Our children enjoyed the pool. We really appreciated the shuttle to downtown Charleston.
7447044,1998,TransitTravel01,2,4,1,4,4,,4,FALSE,FALSE,2,,6/2012,7/12/2012,FALSE,,,Need better service,I stayed here on transit for an international travel with 2-3 bags. I had to locate a cart by the entrance and also had to load and take it up to my room with no assistance. Same for checkout. The hotel needs to provide better service.
7447442,196,LadyD,2,2,3,2,1,5,7,FALSE,FALSE,2,"Radcliff, KY",7/2012,7/12/2012,FALSE,Not an ideal place for a single person on vacation.,2,This GrandbourneS hotel is not for me,"The smell coming from the room as I opened the door was less than pleasant. I could see stains on the carpet. The rooms need serious remodeling/upgrades in furniture, curtains, and bathroom fixtures. When I turned on the hot water and cold water at the bathroom sink, it defaulted to only COLD. There seemed to be a leak around the sink fixtures. Rust was on the shower rod. The safe should be upgraded to digital. Who wants to carry such an awkward styled safe key around. Many times I found no signal for the TV -- it came and went. The hallway was always cluttered with room service trays, extra beds, and loud people. Evidently, there is no soundproofing applied between the hallway and guestrooms. I did leave an item in the room when checking out and never received an email even though you have it. Eating options close to the hotel are limited and many close supper early because the businesses in the area are closed for the evening/weekend."
