reviewID,hotelid,userName,overall,roomComfort,staffMetNeeds,cleanRoom,facilitiesMetExpectations,ageRangeID,tripPurposeID,travelAgent,meetingPlanner,BPGStatusID,guestFrom,arrivalMonth,datePosted,recommend,everyoneShouldKnow,frequencyID,title,comment
7646981,3052,winey1,5,5,5,5,4,0,7,FALSE,FALSE,2,"New York, NY, USA",7/2012,7/26/2012,TRUE,,4,Great stay!,I only was here 1 night as I do live in NYC but my apartment was unavailable. I got a last minute pre-paid rate that was great. I usually stay at BPG luxury collection hotels but I'll have to say I was pleasantly surprised! The room was clean and the bed was VERY comfortable. I didn't have much interaction with the staff but what I did was courtesy and welcoming. I definitely will stay here again when my apartment is unavailable!
7652807,430,Zeva0811,3,4,2,4,3,3,4,FALSE,FALSE,2,"Chicago, IL, USA",7/2011,7/26/2012,FALSE,,2,I'll Try Another Boston Hotel,"I love Grandbourne properties and try to pick them whenever I travel. I picked the Boston Belvoir because of it was close to where I was meeting the next day. The Boston Belvoir left something to be desired. A lot of the issues are minor, but because they all happened on the same trip, I was annoyed."
7652892,421,frankr,4,4,4,4,3,5,5,FALSE,FALSE,2,,7/2012,7/26/2012,TRUE,Location is fantastic,4,Great Location,"Was thrilled to have access to so many subways nearby, We had to go to Brooklyn for a wedding and it was easy."
7653571,468,DoleWhip1,5,5,5,5,5,3,3,FALSE,FALSE,1,"Nicholasville, KY",7/2012,7/26/2012,TRUE,The cleaning staff is amazing.,3,Perfect,I attended a conference while also extending my stay for a vacation to Walt Disney World with my family. We could not have had a better experience. We were able to view the fireworks at Epcot from our balcony and the staff attended to every need. This hotel offers more than we were able to take advantage of.
7655153,421,mm52,5,5,5,5,5,5,7,FALSE,FALSE,2,south florida,7/2012,7/26/2012,TRUE,excellent location....great service,2,comfortable,i have stayed there several times....always very satisfied...will stay again when in NYC
7657310,1046,George66,5,4,5,5,5,6,6,FALSE,FALSE,2,"Wichtita, KS",7/2012,7/26/2012,TRUE,It is a block away from Bricktown and the Amtrack Station.,2,Great staff,Staff went out of the way to assist us in returning a rental car. Also enjoyed the managers reception and breakfast on the 15th floor!
7660364,607,Greg41,5,5,5,5,5,3,8,FALSE,FALSE,2,,7/2012,7/26/2012,TRUE,,3,Great Hotel,The staff at the hotel were very pleasant and helpfull. The room size for the city was also very good. Enjoyed our stay and would recommend this hotel for leisure or work.
7667218,3107,dianew,5,5,5,5,5,5,5,FALSE,FALSE,1,"Houston, TX, USA",7/2012,7/26/2012,TRUE,Convenient to stay at if you're visiting someone at a nearby apartment complex.,1,Fantastic Experience,"The room was very nice, clean and quiet. The beds were very comfortable. The staff was friendly and most helpful. The decor and atmosphere was very relaxing. And the breakfast was delicious. Absolutely no complaints and I would definitely stay there again."
7668755,1726,disappointedgal,1,1,1,1,1,2,6,FALSE,FALSE,3,"hope mills, nc",7/2012,7/26/2012,FALSE,Rude staff and some of them don't know what they are doing,3,extremely disapppinted,When I tried to check in at the BPG counter @ 4:05 pm the front desk clerk tells me my room isn't ready it is being inspected ( which I find hard to believe with everything that went wrong with our room).. so she gives my husband 2 keys for him to park in the garage with while I'm waiting to check in. Well 5 minutes later my husband comes back because the keys aren't working this process takes her forever to fix. Finally when our room was ready we get there and the furnutre is in really bad condition. Especially with it being a junior suite the table looked as if of was gotten from the dumpster and oh yeah there was an old blood stain on the coverlet on the bed. We also requested a rollaway bed and this room had a dbl pull out sofa as well and there were no bedding items for this in our room and when the lady came to drop of the bedding she was rude and said did you even check the closet ... Of course I checked the closet ... Don't recommend this to anyone save your money and points. You are better off paying to stay elsewhere.
7672300,691,disappointedguest1311,3,4,3,3,1,5,1,FALSE,FALSE,2,"Jacksonville, FL",7/2012,7/26/2012,FALSE,Don't pay $30 for concierge upgrade.,4,Concierge not worth upgrade,"I upgraded to concierge rooom because I was told there would be snacks all day (per sign on concierge door), breakfast, and cocktail hour food. I paid for the day I came in $30 and the coffee maker was out of milk and there was no cream or sugar out for coffee. The next day we had breakfast, snacks, and the evening cocktail hour food. All good. We had breakfast on Sunday and went up all day trying to get a coffee, water, snack and there were none to be had. We started lookin at 10:30 pm and at 3:00 pm I went to the front desk to inquire. They told me that snacks were placed out after breakfast and then no one came back on until the cocktail hour. I told them that I couldn't even get a cup of coffee and it said snacks were provided all day. They told me it had been very busy and food would arrive at the cocktail hour. Now the same snacks that had been there the day before were being sold to a dance competition. I suspect they were using the product from the concierge for that. I was pretty much dismissed. I do know that the employee that was working the room the most had to cover another employees schedule because they had called in. I spent in total $90 and only had one day where the food and drinks were availible to me. I came in on Friday around 10 pm and and left on Monday. It was disappointing."
7677419,1995,MOT2,4,4,5,2,4,3,6,FALSE,FALSE,2,RI,7/2012,7/26/2012,TRUE,,2,Good choice,This is a good hotel and I would stay again. There are a few things that need improvement. One of the elevators was out of order all four days we were there. In a 10 story hotel that is a big problem. We spent way too much time waiting for a lift.
7678513,3023,newbody24,5,5,5,5,5,5,3,FALSE,FALSE,2,"San Angelo, TX, USA",7/2012,7/26/2012,TRUE,"Excellent staff, Everyone was very accomodating, Always asking if there any thing they could for us.",3,room upgrade,"After making a reservation with the frisco hotel, I received an e-mail with an upgrade that was available for my stay. The cost was very nominal, So I didn't think it would amount to much,But I decided to try it anyway. When we checked in, I was surprised when the upgrade included a room on a prefered floor, Late night snacks and breakfast in a private lounge. We really enjoyed the extras. GOOD JOB! LOVED IT!"
7684298,1556,Muggsy,5,5,5,5,4,6,5,FALSE,FALSE,3,"Bend, OR",7/2012,7/26/2012,TRUE,Good location.,2,Convenient to airport.,"We only needed a 1-night stay prior to catching a flight out the next morning. The Belvoir Mission Valley was an easy 10-minute drive to the airport, even in the morning commute traffic. The only negative to our stay was the parking charge. SInce the hotel was located in the Hotel Circle area, as opposed to a downtown location, there was ample parking available so the extra charge for parking was unexpected."
7685755,1523,HArroyo,4,5,3,5,5,,5,FALSE,FALSE,1,,7/2012,7/26/2012,TRUE,,,"Great hotel, but Guest Services' staff needs to improve",The hotel facilities were impeccable. The room was very comfortable and clean. My only concern was the guest services staff. The waiting time for check-in was not appropriate. I had to call several times in order to someone to pick up the phone during my stay. It seems that they were not ready to deal with certain volume of guest as the hotel was completely booked.
7686220,760,ML2012,4,5,3,4,4,4,5,FALSE,FALSE,2,"Los Alamos, NM 87544, USA",7/2012,7/26/2012,TRUE,Beautiful and comfortable rooms,3,Beautiful Room,Really nice hotel. The hotel is a couple of miles away from other restaurants and shopping so I was really glad I rented a car. The rooms are clean and comfortable and the hotel is convenient to the beach. The restaurant and bar were fairly pricey and there was an hour wait for dinner one evening but the food was good. I would stay again!
7688766,3054,Payche,3,3,3,2,2,2,8,FALSE,FALSE,2,"Indianapolis, IN, USA",7/2012,7/26/2012,FALSE,This hotel does not keep up on cleanliness.,3,Needs improvement,This would be a nice hotel if it were updated. The room was ok other than the toe nail clippings on the carpet! They obviously did not vacuum when they cleaned the room. The pool was a dirty green color for our entire stay there and continued to get worse each day. There was even a staff member that mentioned they would not get in the pool because it looks disgusting! They said they have told the manager on numerous occasions that someone needs to clean it and they still had not taken care of the problem.
7692482,111,Guest1027,2,2,2,3,3,2,5,FALSE,FALSE,2,,7/2012,7/26/2012,FALSE,Great Location...Average Accomodations.,2,Hotel Rooms Need to Be Fully Renovated,Typical Belvoir room. Great location...short walk to mall and easy access to highways.
7697723,96,Anonymous,3,3,3,1,3,3,6,FALSE,FALSE,1,TEXAS,7/2012,7/26/2012,FALSE,FRONT OF HOTEL NOT ON STEMMONS,2,THIS HOTEL NEEDS TO CLEAN ROOMS,"STAYED A COUPLE OF DAYS AND NO ONE CLEANED OUR ROOM. CALL THE FRONT DEST FOR TOWLES AND TOILET PAPER, NEVER CAME. I HEARD THE HOUSE KEEPING CREW OUTSIDE IN THE HALL. I HAD TO GO ASK THEM. DON'T KNOW IF THE CREW WAS JUST HAVING A BAD DAY........."
7699318,468,TeacherKY,4,5,5,4,5,2,3,FALSE,TRUE,1,"Kentucky , USA",7/2012,7/26/2012,TRUE,It is wonderful minus courtesy airport transportation.,3,Wonderful Experience Except...,"Everything about the hotel was fabulous - amenities, location, staff and comfort. My only complaint - which is significant - is the lack of complementary transportation to and from the airport. For a hotel that hosts people from such far distances, the convenience of a hotel shuttle is needed. Given the price of the rooms, having to spend so much extra for transportation seemed insulting. I would recommend this hotel with a transportation disclaimer."
7700382,814,lawbjw,4,4,3,4,4,4,6,FALSE,FALSE,2,"California, USA",7/2012,7/26/2012,TRUE,Right on the beach!,4,Great Stay!,"Hotel is very nice. Rooms were very clean and comfortable. Nice location. Only complaint would be, check in took a while becacuse of some computer problem houskeeping forgot to leave us soap. Room service was quick and food was delicious."
7701469,1727,Coco54,5,5,5,4,2,4,6,FALSE,FALSE,2,"Adelphi, Maryland",6/2012,7/26/2012,TRUE,That you staff is amazing.,4,GREAT HOTEL,"My experience at the Sherton Hotel was great. I love the hotel and will be staying there everytime I come to New York to visit my daughter, which will be very often. GREAT HOTEL"
7706749,3205,USMCVET,3,3,4,3,2,4,5,FALSE,FALSE,4,"Florida, USA",7/2012,7/26/2012,FALSE,Good location,2,Convenient Location,I would expect more from Belvoir based on previous stays at different locations. The room itself was VERY small and had a strange odor. The room was booked as part of a travel package so it is what it is. The location is incredibly convenient to all of Denver.
7706833,344,Llola,5,5,5,5,5,4,5,FALSE,FALSE,3,"Syracuse, NY, USA",7/2012,7/26/2012,TRUE,"Quiet, comfortable oasis from airport chaos",2,Excellent airport hotel,"Location to airport is ideal, but the BEST feature is the ultimate soundproofing and room-darkening drapes."
7706986,377,jess16,1,1,4,2,1,2,6,FALSE,FALSE,2,"California, USA",7/2012,7/26/2012,FALSE,,2,not good,"this hotel was beyond crowded. the rooms as seen online were not comparable to the room we had. our room was old and outdated. we had a kai suite with an adjoining room. the 2 rooms connected through the bedroom of the suite, how silly is that?!?"
7708727,1523,Azazelhell,5,5,5,5,5,3,2,TRUE,FALSE,2,"Juana D�, Puerto Rico",7/2012,7/26/2012,TRUE,Excellency and personalized service from staff.,2,Great Business & Vacation Hotel,"Restaurants were great, pool was a welcoming site, peaceful place. High security and professional personnel . Meet people and make new friends. If you know what I mean lol."
7709354,1364,FarleyFun,5,5,5,5,5,3,7,TRUE,FALSE,2,"Farley, IA",7/2012,7/26/2012,TRUE,Rachel at the Front Desk,2,Outstanding Front Desk!,"I would like to recognize Rachel who works at the front desk. I called on Thursday July 19th to confirm our weekend reservations and she was so polite and helpful. When we checked in the next afternoon (July 20th), a young lady asked if she could help me, so gave her my name and she said hello and she remembered my name from our phone conversation the previous day. It made my day:) Thanks for making our stay so pleasurable. We had 4 rooms for the weekend."
7712022,127,Workaholics,4,4,5,4,4,4,6,FALSE,FALSE,3,New York,7/2012,7/26/2012,TRUE,You'll love the harbor view!,1,Refreshing,"Got a room in the Marina tower overlooking the harbor - Beautiful! Staff service was great - from room, to dining, to front desk, to the valet service. We especially enjoy the Big Bay Downtown Shuttle ($1 a day) service."
7712024,1995,nyker,4,5,5,5,5,2,6,FALSE,FALSE,3,brooklyn ny,7/2012,7/26/2012,TRUE,enjoy,3,great accomodations,"We stayed here 5 nights on a Hershey Park trip from NY. The staff were extremely helpful, the facilities were excellent, great pool, great club lounge with tons of food. We would definitely stay here again when we come back to the area. the only downer to the hotel is the bvathroom is small, other than that if you are going for pleasure or business its a great hotel."
7719151,127,slider,3,3,1,4,2,4,5,FALSE,FALSE,2,"San Diego, CA, USA",7/2012,7/26/2012,FALSE,there are 2 separate room towers and parking lots. there are 2 separate entrances. it was as if 2 properties were purchased separately and merged as one,2,Did not receive what i booked,my reservation was a room in their bay tower which was explicit per their reservation. i was attending a wedding reception in THAT tower yet my room was literally at the opposite end of the hotel property. the two towers are at opposite ends of their property- separated by a marina and 2 pools. It took over 20 mins to go from bay tower to the lanai bldg.
7724347,1400,BENTLEY,5,5,5,5,5,5,6,FALSE,FALSE,1,"MURRIETA, CA USA",7/2012,7/26/2012,TRUE,"GORGEOUS, GOOD LOCATION, FULL SERVICE",3,Belvoir HOTEL OVERLAND PARK,"AFTER 3 WEEKS OF TRAVEL WE DETERMINED THIS WAS THE BEST HOTEL WE STAYED. HOTEL IS GORGEOUS, FRIENDLY STAFF AND COMFORTABLE ROOM. GREAT LOCATION CLOSE TO EVERYTHING."
7731320,3205,MichelleMarie,5,5,5,5,5,4,6,FALSE,FALSE,3,"Seattle, WA, USA",7/2012,7/26/2012,TRUE,Perfect location,2,Location,The location is perfect for walking and enjoying the downtown area; so easy to get around and the staff was incredibly helpful and friendly.
7742763,3207,Jakeelroy,4,5,5,4,4,6,2,FALSE,FALSE,1,"Portland, OR, USA",7/2012,7/26/2012,TRUE,Great Staff,3,Great Staff,The staff was helpful from the front desk to security. Cleaning staff was always willing to help.
7742976,3175,JFK9803,1,1,3,3,3,3,6,FALSE,FALSE,2,"Shawnee, OK, USA",7/2012,7/26/2012,FALSE,The rooms are very small.,2,Shower terrible,The shower had a access door on the ceiling it had black mold all over it and was rusted looking. The drain for the shower was clogged.
7743010,90,AshleyJessica,5,5,5,5,4,1,4,FALSE,FALSE,2,"Lowell, MA, USA",7/2012,7/26/2012,TRUE,The rooms are spacious!!,4,Great Stay!!,"I had a great stay at this Belvoir in Old Towne. I've stayed at many hotels before this and none compare. The only complaint I really have is that the shuttle didn't go everywhere I expected it to go, so I had to make adjustments to my schedule,etc. But other than that the staff was courteous and helpful!! I will definitely be staying here again!!"
7750825,177,rtraveler,5,5,4,4,5,5,6,FALSE,FALSE,3,"Memphis, TN, USA",7/2012,7/26/2012,TRUE,Worth the travel some distance from the interstate.,2,Comfortable!,We arrived late evening to a quite comfortable room in an appealing setting. The suite was well laid out. We would definitely stay here again.
7754030,607,guitarjazz,5,5,5,5,5,5,6,FALSE,FALSE,1,"Indianapolis, IN, USA",7/2012,7/26/2012,TRUE,Exceptional!,4,Just as good the second time,"Great staff, location and quiet. I'm coming back next month!"
7759431,171,Pops76,4,4,4,3,,6,5,FALSE,FALSE,2,"Mississippi, USA",7/2012,7/26/2012,TRUE,It is a nice hotel but nothing out of the ordinary.,1,Hotel was good but could have been better,"I expected to have a hair dryer at an upscale hotel. We had a ""harbor view"" room but our view was a tree and the pool if you looked down. The bottled water in the room should be clearly labeled as to cost. I believe some would think it is complimentary but it is $2.50 a bottle. The hotel is nice and the service was good. We found it difficult to locate our first time in Norfolk. You can't use the luggage carts without the valet (tips)."
7762525,3054,Boze,4,4,4,4,4,5,6,FALSE,FALSE,1,"Indianapolis, Indiana",7/2012,7/26/2012,TRUE,Great service and pleasant people.,1,Too much tax and hidden fees,I was shocked to find almost an extra hundred dollars tacked onto my bill for taxes! Also extra was charged for supposedly complimentary bottles of water that were put in the room. It was explained that the large bottles were not complimentary but the small bottles were. Where was this posted? It was not!
7762535,83,Mela,5,5,5,5,5,,6,FALSE,FALSE,1,Universal City,7/2012,7/26/2012,TRUE,,,Service,The hotel was packed with a special event and summer and the staff was amazing and kind and still kept their professionalism and humor through some tough moments!
7767981,1784,outnum5to1,4,4,2,,4,4,3,TRUE,TRUE,1,,7/2012,7/26/2012,TRUE,Great Location,2,advocare weekend,"On july 22 we left the room at 7:15, came back between 4 and 5pm, our room wasn't cleaned at all. I left the tag on bed to change towels, when we arrived at that time, our card didn't work , so we called the front desk and they sent one quickly,a guest personal came up to give us another key, we had told him about our room not being cleaned and he said he would get it taken care of. We didn't get a chance to clean up and change clothes and left to finish the conference, we made it back between 9:30 and 10pm, when we returned room still not cleaned no towels,we went down to use the computer to print out our plane tickets, printer was out of paper, The man handed me a stack of paper , I guess I was suppose to figure out loading it, We then spoke to the man at the desk around 10pm sunday night, And he said he would bring up our towels, 2 hours later we called and a girl brought up some large towels, We had to inform her that we needed wash cloths to, so she came back up and tby then we found out we neded coffee and cups,So that took close to an hour, I didn;t mean for that poor girl to have to keep running back and fourth , she was very nice, But I guess if our room was cleaned sometime that day, it wouldn't have been a problem. I know your Hotel was busy , but I do believe you have conventions all the time, Thank you for listening"
7773963,1494,nomma3,5,5,5,5,5,1,6,FALSE,FALSE,1,"Midwest City, OK, USA",7/2012,7/26/2012,TRUE,Its clean! You pay for what you get!,4,wonderful!,Checking in was easy and fast! Room was clean bed was comfortable! Will definitely stay there again
7774944,1784,blondie,5,5,5,5,5,4,3,FALSE,FALSE,2,"San Antonio, TX, USA",7/2012,7/26/2012,TRUE,,3,Great hotel,Staff and location of hotel was perfect for my conference.
7777617,942,meredithashley1,4,3,4,4,5,2,3,FALSE,FALSE,3,nc,7/2012,7/26/2012,TRUE,There is free breakfast and afternoon snack in the lounge. Pool is indoor and outdoor. Rooms are clean and staff is friendly.,2,Staff strives to meet your needs,Anything I asked for was given or done for us.
7779876,430,Inspired,4,4,2,4,4,6,5,FALSE,FALSE,2,Chicago,7/2012,7/26/2012,TRUE,Location,4,Great Location,"The hotel is in a good spot relative to the Christian Science Church where we had a conference. I think the elevators need to be upgraded. It took too long to wait for one, especially when one is suppose to meet someone in the lobby. The consierge could have been more knowledgeable about the area to offer help. The instructions given to take the subway was way off and fortunately we got it right after talking with others."
7784885,344,DIVA711,4,,,,,,7,FALSE,FALSE,3,,7/2012,7/26/2012,TRUE,great common area's and pool,4,UNIQUE HOTEL EXPERIENCE,This hotel is below average as the rooms go and to much furniture in the rooms not good layout to the flow of the furnishings. The rooms have very poor lighting also. The most upsetting thing is the bathroom door is always in the way since the room is to small. The suites are nice but overpriced for this location.
7788744,636,Coastfan,4,4,5,5,4,3,8,FALSE,FALSE,1,"Pembroke, NH",7/2012,7/26/2012,TRUE,Located across the street from the Isle of Shoals tour company.,1,Had a very pleasant stay,Quick and easy check-in and check-out. Staff very friendly and helpful. The food service was very good too.
7793157,2011,CLEANLINESS,1,1,2,1,1,,6,FALSE,FALSE,2,,6/2012,7/26/2012,FALSE,VERY UNCLEAN,,VERY UNCLEAN,"Last month my family and I checked into Sharaton Washington North after something like a 30 min wait time. We were not given the correct room type and were originally taken to the 3rd floor that smelled of sweaty gym bags, the second we left the elevator. Ater noticing that the rooms smelled the same and that the bathrooms didn't look to have been cleaned, we went back to the front desk (after about five minutes) and were finally given the room types we requested- the same rooms we were told, ""are not currently available."" Once we got into our connecting rooms and began to get comfy, it suddenly became VERY clear that there was a man in my bed who did not clean up after himself, nor was he cleaned up after. We were then given free this, waived fee that, free this, waived fee that, but it just doesn't seem like enough. My 12 y o twin cousins shared that room with me...Belvoir should definitely consider doing things right the first time, as although the cost was dramatically dropped, I will still never step foot in there. What other messes didn't we see...?"
7794517,1143,EDCEL1,5,5,5,3,3,4,6,TRUE,FALSE,3,"LAREDO ,TX",7/2011,7/26/2012,TRUE,LOCATION,4,MR. MARINA,"Parking a HASSLE, MAKES IT DIFFICULT"
7799887,166,Treb,5,5,5,5,2,,6,FALSE,FALSE,3,,7/2012,7/26/2012,TRUE,Location to historic venues,,Misleading Signage,I stayed on the fourth floor with a sign just off the elevator indicating vending and ice was down the hall. There is no vending or ice on the fourth floor. I had to go to the third floor.
7801990,353,lovedNOLA,3,4,5,2,3,,3,FALSE,FALSE,1,,7/2012,7/26/2012,TRUE,It is in a great location right on the edge of the quarter. Walking distance to Convention Center and SuperDome.,,Belvoir on Canal,"The hotel is still under going renovations so there is really no restaurant to speak of, and the pool is tiny. Plus the sheets were dirty in our room when we checked in. They came and changed them right away, but still it was a surprise to see stained sheets at a Belvoir. The staff was SUPER HELPFUL AND FRIENDLY."
7804946,3207,NITram,3,4,3,3,3,6,3,FALSE,FALSE,1,"London, UK",7/2012,7/26/2012,TRUE,It is downtown and everything closes after lunch and does not open aty weekends,1,Hotel,Attended conference so hotel fine but area lacked facilities for any other stay.
7807178,196,Anonymous,5,5,4,4,5,,5,FALSE,FALSE,1,,7/2012,7/26/2012,TRUE,Great location,,great bed,I stayed in room 1854. Can you tell me the brand of the bed and the brand of the bedding? I must get the same for my home.
7807235,1046,da1316,4,4,4,4,5,5,6,FALSE,FALSE,2,"Oklahoma City, OK",7/2012,7/26/2012,TRUE,Rooms are very quiet and is private.,3,Great location,Travel to OKC often for medical reasons. Location is great. Close to recreation as well as medical facilities. Staff very friendly and helpful. Room very nice and confortable every time we stay.
7807466,94,ghost51,5,5,5,5,5,5,6,FALSE,FALSE,2,"Cary, NC",7/2012,7/26/2012,TRUE,Clean and Comfortable.,3,Comfortable and restfull,"Coming up for a family function, we stayed at the Belvoir Suites. The room was clean and comfortable. It was very nice having a Micro and Frig in the room. We used the pool and hot tub which were clean and seemed to be well maintained."
7807543,760,Lizzard5031,5,5,5,2,5,4,7,FALSE,FALSE,3,"Key West, FL 33040, USA",7/3012,7/26/2012,TRUE,Conveniently located.,3,Housekeeping,Superb overall. However housekeeper for our room lacked..... Not the Grandbourne quality!!!!
7807596,127,arabianaz,2,2,2,3,1,,6,FALSE,FALSE,3,,7/2012,7/26/2012,FALSE,They try to nickle and dime you for everything.,,Not Happy with this Belvoir,"Parking was $22 and it was for the public also so if we came back at night we were lucky if we could find a place to park. As a Gold member one of my ""perks"" is to be upgraded to the Club house level and use the Club house - this Belvoir wants you to pay an additional $20 a night to use the Club house. I will never go back to this Belvoir."
7818407,1995,coasterjunky,5,5,5,5,5,4,6,FALSE,FALSE,2,"Cherry Hill, NJ, USA",7/2012,7/26/2012,TRUE,Truely a home away from home,1,Annual Hershey Park trip,Have been staying here the last 5 years for the family get together at Hershey Park.
7823276,1135,SteveandNancy,4,5,4,5,5,4,6,FALSE,FALSE,3,"Albuquerque, NM, USA",7/2012,7/26/2012,TRUE,,2,Thank you!,"We enjoyed our stay at the Belvoir Santa Monica. The room was comfortable and the hotel is within a reasonable walking distance of the pier, restaurants and shoping. Bus service is easy if you don't want to drive. Staff was very friendly, helpful and quick."
