reviewID,hotelid,userName,overall,roomComfort,staffMetNeeds,cleanRoom,facilitiesMetExpectations,ageRangeID,tripPurposeID,travelAgent,meetingPlanner,BPGStatusID,guestFrom,arrivalMonth,datePosted,recommend,everyoneShouldKnow,frequencyID,title,comment
1072284,693,commish,3,4,5,5,2,3,1,FALSE,FALSE,2,"Lester, Tinicum Township, PA 19029, USA",3/2012,3/12/2012,FALSE,Hard Rock is just down the street with other stuff to do right there.,3,update needed,"I stayed here over the past weekend 3/9/12. The loby,bar has a nice area to sit and meet with people.The room I had was on the 14th floor was nice,bed ok, pillows great! but the bathroom was out dated no room in the tube area .Friendsstayed on 5th floor wth river view try not to stay there trains keep them up most of the night"
1072893,341,AdrianB,3,3,2,3,3,3,4,FALSE,FALSE,2,"Minneapolis, MN",3/2012,3/12/2012,FALSE,Lots of opportunity to improve guest services.,3,Not up to BPG Standards,"This is the first time that I have written a review for a BPG hotel that I felt disappointed in. It started at the check-in where the young lady checking me in didn't ask for a credit card to cover incidentals. Although I had my card out, I figured they didn't need it and would use the one I have on file through the BPG system and charge purchases there."
1073319,3115,genmex3452,5,4,5,4,5,,8,FALSE,FALSE,1,,3/2012,3/12/2012,TRUE,,,Great stay,"Had a great stay here. Front desk staff was very helpful, and Frank and the convenient shuttle staff was a great way to explore the nearby downtown area. Would definitely return when visiting Louisville."
1073387,3620,CRBY,1,3,1,3,2,2,5,FALSE,FALSE,1,"Sarasota, FL, USA",3/2012,3/12/2012,FALSE,1.lackof communication among staff,4,A lot of inconvenience,"Let me share with everyone the kind of service weve received from this hotel and their staff, from the day of our arrival to the day of our departure. I have reserved two rooms in this Hotel, two weeks before our arrival to see the Miami game with the following (two connected rooms one with King Bed and the other room with two queen-sized bed for our friends children. On the day of our arrival in Miami around noon I called the hotel to let them know that we will be checking in by 4:00pm, the staff that answered the phone assured me that the two rooms weve reserved are ready and will be waiting for us. But then, when we got there, a lady from the registration desk told us that only one room is ready and that the second room (connected to one room) should soon be ready so she gave us the keys for only one room. After about 30 minutes I called the front desk to see if the second room is ready, another lady talked to me with a different tone on her voice and said the room will not be ready for another 30 to 45 minutes, I was very unsatisfied at that moment so I asked her why then she said there is nothing she can do the guest that was staying on that room had checked out late so their just starting to clean the room. After 20 minutes my husband came out the room and so the cleaning lady just got done cleaning it so my friend went downstairs, and a guy said that the room is not ready and it should be ready by the time we get back from the game so she went back to the room .Ive asked my husband to come with me down the front desk to talk to a manager about the whole thing. When we asked for a manager a Supervisor offered to talk to us and shell try to help us she said. We told her exactly what was happening and that we are very dissatisfied of all the staff that we talked to she apologized and asked us what she could do to ease our disappointment so we asked her to find if the room is ready and that because of all the delay that we should also have a late check out. She asked us what time we want to check out and we said 6:00pm if thats possible she said yes and she also said the room is ready but, there are no 2 queen beds in any of the rooms, but they can and will provide us a bed (a folding bed which by the way, my friends back ached so bad the next day). So that was the end of our first day, The next day on our way to eat breakfast, I went to front desk just to make sure that we are checking out at 6:00pm, what a surprise when the lady I was talking said it was not entered into the system at all, that if we had checked out at six they would charge us a full day extra. Thank God I went back to check before it was too late. So everything is set, we went out,came back around 5pm , guess what? We were locked out! Our keys were not reprogrammed to check out by 6pm so my husband went down to the front desk wanted to talk to the manager once and for all. But the lady he was talking to giving him more excuses for what happened instead of calling the manager so my husband just had enough , he just asked the keys to be reprogrammed. Overall, we had a great time in Miami except for the services that weve had from this hotel and made us all feel not to come and check in to any Belvoir hotel ever."
1073583,1047,BillN,4,5,5,4,4,5,7,FALSE,FALSE,4,"Wyomissing, PA, USA",3/2012,3/12/2012,TRUE,Consider leaving car here after spending the night and catching that morning flight,4,"Solid, and quiet, airport hotel","For over 10 years this hotel has met my needs when I've needed a reliable rest prior to an early morning flight. Reduced or free parking (policies and plans vary) and a good shuttle make this all suite hotel a logical choice. I'd prefer to have a more comprehensive and festive restaurant on this campus of three Grandbourne properties, especially as I am often with a friend about to start a vacation, but the burger-oriented Relish bistro excels in its specialty, and also offers sufficient variety for my 3 or so yearly visits."
1073681,1798,Traveler651,1,3,1,1,1,4,5,FALSE,FALSE,2,"Fort Myers, FL, USA",3/2011,3/12/2012,FALSE,Poor service and management,3,Awful service,"Staff was clearly overwhelmed during our group visit. Rooms had insufficient towels upon arrival, housekeeping did not replace used items (Coffey, shampoos, etc), removed towels from rooms without replacing. Our group breakfast buffet that we were charged $15 pp for consisted of grits, bacon strips, and scrambled eggs, without coffee, tea, or bakewares, not even toast. We ordered breakfast bags to go on day of departure: the hotel forgot!"
1073711,377,buyrctw,5,5,5,5,5,3,8,FALSE,FALSE,4,"Ann Arbor, MI, USA",3/2012,3/12/2012,TRUE,Don't let the Belvoir brand fool you at this outstanding property with great value for Elite Members.,4,Exceeded All My Expectations,"I have to admit that I have not been a big fan of the Belvoir portfolio within Grandbourne as my experience with the brand has been inconsistent over the years. However, I believe this property sets the standards on what the Belvoir brand should be and could be!"
1074175,353,CRBY,5,5,5,4,5,2,7,FALSE,FALSE,1,"Reno, NV, USA",2/2012,3/13/2012,TRUE,It is well worth the money!,2,I dont know what everyone is talking about,"I stayed here on 2/20/12 to 2/24/12, the last two days of Mardi Gras and a few extra days for the sights. First of all for wanting to see the sights this hotel is right where you wanna be close to everything including the trolley. The staff was AMAZING, they were nice as could ever be, real southern hospitality. No matter what it was from questions to extra coffee they were on it FAST. The rooms were very clean although yes the bathrooms needed remodeling but they are in the process of this very thing. Never heard any construction noise or other quests for that matter, very quiet and relaxing. The views were beautiful and stretch as far as the eye can see. The parking is pricey at almost 37 a night but you can take your car out and bring it back as much as you want no extra charge. It also doesn't hurt that they have one of 3 starbucks in town, downstairs open 9am to 5pm daily. Oh and that their in room coffee is also starbucks, hats off guys! I have stayed in many 4 star hotels throughout the USA and I must say they have well earned their stars."
1074191,344,Cameo,4,5,4,5,4,2,6,FALSE,FALSE,3,"Salt Lake City, UT, USA",3/2012,3/13/2012,TRUE,Great valets!,2,Nice hotel near the airport,"I recently visited the Belvoir Gateway LAX for a whirlwind 18 hour trip to LA. Upon arriving to the property, I was promptly greeted by a very cordial valet. In fact, every time I pulled up, the valets were so friendly and an ideal first impression of the hotel. The front desk was slow. Both agents I encountered were very friendly, but didn't move with any sort of urgency, instead demonstrating uncertainty. When I took a shower in the morning, the tub was very slow draining and in my brief shower, about an inch and a half of standing water accumulated. I mentioned this to the front desk when checking out, so another guest did not have the same experience and was apologized to and offered a meager apology with some BPG points. All in all, the staff was friendly and wanted to make sure I had a good time, but recovery and urgency was lacking at the front desk."
1074863,270,Kyler,3,2,5,3,4,4,4,FALSE,FALSE,3,"Dallas, TX, USA",2/2012,3/13/2012,FALSE,,4,It's just an OK hotel,"The location of the hotel was great, the lobby was very nice but once inside my room, I was disappointed."
1075132,1047,dk759,2,3,1,3,1,5,6,FALSE,FALSE,2,"Stroudsburg, PA",3/2012,3/13/2012,FALSE,Don't rely on shuttle service.,2,Extremely frustrating shuttle service,"We did a 10 day park and fly package at this hotel on 3/2/12. Upon our return on 3/10/12, we were left at airport for over 1 hour & 15 mts. Were constantly told shuttle would be there in 5 minutes during this period. Three shuttles passed us right by. We were returning from Fla. and standing out in the cold for over an hour was unacceptable. Would have been better if we were told that shuttle would take over an hour. Next time we will book a"
1075288,1776,AJ2012,5,5,5,5,5,2,8,FALSE,FALSE,2,"Jersey City, NJ, USA",3/2012,3/13/2012,TRUE,Even if you are afraid of heights please get on a high floor the views are spectacular.Amazing view from 25th floor stunning(ill post pics later promise),4,The good and the BAD about Belvoir DT Philly,"My partner and I travel a little too much and we WERE faithful patrons of another chain due to several bad experiences we decided to go with the Belvoir...Well, what an unbelievable weekend...."
1075492,377,jjjmom,5,5,5,5,5,4,6,FALSE,FALSE,3,"newport beach,ca.",12/2011,3/13/2012,TRUE,the location facilities amenities and bedding is superb!!!!!!,4,GREAT christmas holiday 2011,WE stayed at this hotel for christmas 2011 they gave us an upgrade of an oceanfront room it was beautiful best christmas in the island of oahu . It was Awesome. the shopping center and facilities at Belvoir waikiki are wonderful. the hotel has a wonderful buffet The Hotel is centrally located . you can walk everywhere to the beach the shopping Planning to go back and stay there in spring of this year WOW
1075650,865,Beth50,5,5,5,5,5,4,6,TRUE,FALSE,2,,3/2012,3/13/2012,TRUE,,2,Surpassed our expectations,For the price we were expecting much less. Our rooms were newly renovated and designated for Preferred Guests. Checking in and out was painless. I definitely will stay there every time I'm in the area.
1075731,127,GUSSTOFF,5,5,5,5,5,0,8,FALSE,FALSE,2,"Seattle, WA, USA",2/2012,3/13/2012,TRUE,OUTSTANDING SERVICE FROM THE STAFF,2,OUTSTANDING SERVICE,"HOTEL HAS A BEAUTIFUL VIEW, ATTRACTIVE LOBBY ANS ROOMS. IT IS WELL MAINTAINED. STAFF GOES OUT OF THEIR WAY TO BE HELPFUL, FRIENDLY AND CHEERFUL."
1075820,3207,wsu96,4,5,5,5,4,5,8,FALSE,FALSE,2,"Dallas, TX, USA",3/2012,3/13/2012,TRUE,"My only negative for my experience is that the third party parking cost is very high in my opinion. For a weekend visit, the rate should be lowered.",1,Club Lounge Experience,"The staff person for the evening I was at the hotel, Ms. Jackie, is one of the most hospitable people I have even met. She made each guest feel like they were the only person in the lounge."
1076562,127,smartset,3,4,2,2,4,5,6,FALSE,FALSE,2,"Victoria, BC, Canada",3/2012,3/13/2012,TRUE,,3,great location; lacking housekeeping,"Excellent location, great views. For the most part the room was clean although the light switches and light fixture itself had not been cleaned for some time. There seemed to be a dark shadow around the light fixture and upon examination I touched it to see if it was a stain and a big piece of dirt/fluff fell on the floor. The same was on the light fixture itself and in the connecting room bathroom to ours.(I took pictures) After waiting 2 hours for housekeeping to help us with remaking a bed that our child had been sick in we had to call again. Felt that was a bit long to wait. Also parking was an issue. There were events at the hotel 2 of the 3 nights we were there. We were told we could only park in 1 parking lot as the other was reserved for the events. After paying$22 per day to park we felt that we were not as valued as the patrons who only needed parking for the evening. With a small child and an infant, parking in the dirt parking lot quite a distance away was an inconvenience. Other than these issues it is a great hotel with a beautiful view."
1076594,1144,kman,1,2,1,2,1,4,3,TRUE,TRUE,3,"Houston, TX, USA",3/2012,3/13/2012,FALSE,Do not stay on 1st floor.,2,Not the Belvoir you expected,Our room on first floor was very small. I called front desk as my phone near the bed was not working. Nobody came and fixed it. The alarm clock was not working either. They should never rent out 1st level rooms near the parking lot as you hear cars in the parking lot. The amenities and the room is no better than any 2 star hotel. Not what you expect at Belvoir.
1076598,741,TurboTraveler,3,5,5,5,5,4,4,FALSE,FALSE,3,"San Diego, CA, USA",3/2012,3/13/2012,FALSE,This hotel has a great staff.,2,Changes for frequent stay folks,"Was disappointed that after all these years of staying with this hotel, they stopped access to the Club Lounge for Gold members. You need to be Platinum to access it now. I love their great staff, but will likely find another hotel next time."
1076687,1391,KWeshocks,4,5,4,5,5,4,5,FALSE,FALSE,4,"Tucson, AZ, USA",3/2012,3/14/2012,FALSE,"Wait to park until after check-in. The 2 wings have plenty of close parking, but the wings are spread out. The valets are wonderful to assist and suggest the best place to park.",2,3rd stay,"We stayed one night this time to ease an early airport drop off at PHX. As platinum members we have been upgraded the other 2 stays, but were told the hotel was full. There was also no late check out for the same reason. I wish I had known this information on check-in as it made the logistics difficult for an airport pick-up later in the day."
1076889,1552,LMG517,1,1,3,3,1,5,3,FALSE,FALSE,2,"Manhattan, New York, NY, USA",3/2012,3/14/2012,FALSE,Poor maintenance,4,This hotel needs work,On business trip and the internet does not work most of the time. Hotel response was when hotel is full the Internet does not work well.
1077154,674,JackieM,4,4,5,2,4,3,6,FALSE,FALSE,2,"Philadelphia, PA",3/2012,3/14/2012,TRUE,The front desk staff were very pleasant,3,Weekend Stay,We stayed at this hotel this past weekend. Positives:
1077298,1162,Nathan75,3,3,3,4,4,3,6,FALSE,FALSE,3,Phoenix AZ,3/2012,3/14/2012,TRUE,Nicely renovated. Beautiful pool area. Shuttle to Disney is poor...,3,Room & Pool were nice. Bus to Disney - not so much,Stayed 6 nights at this hotel in early March 2012. The room was recently renovated and comfortable. Pool area appeared to be all new and was above expectations. Staff was helpful.
1077491,1144,Rippedoffcusomer,1,1,1,1,1,3,5,FALSE,FALSE,2,North Georgia,3/2012,3/14/2012,FALSE,Dont stay here.,4,Dont stay here!!,"Terribly small rooms, rude front office staff.Paid to much for bad level of service and bad rooms. Double billed. Still trying to fix. This experience ruined our weekend and days off."
1077647,3052,shiframeir,5,5,5,5,4,2,8,FALSE,FALSE,3,NY,11/2011,3/14/2012,TRUE,down the block from Canal Room and Pearl Paints.,2,"great new hotel, perfect for a Soho/Tribeca visit",Really nice new hotel with reasonable pricing and small but functional rooms (about normal for NY).
1077745,1364,mck0582,4,5,5,5,3,2,5,FALSE,FALSE,1,Illinois,3/2012,3/14/2012,TRUE,"Great location, comfortable room but pricey add-ons.",1,Comfortable Stay,"The hotel staff were friendly at each interaction. They offered us printed directions to places we wanted to go and always had a smile. The rooms were large, clean and comfortable and the location was within walking distance (less than 10 minutes) to so many St Louis attractions."
1077747,15,lbch,3,2,4,4,2,4,6,FALSE,FALSE,2,pa,3/2012,3/14/2012,FALSE,not the best choice in the area,3,paper thin walls,"while the hotel has undergone some renovations and the rooms LOOKED nice, the walls are paper thin and we could hear every single word spoken next to us or in the hall near us."
1078087,865,guru3785,3,4,4,5,3,,8,FALSE,FALSE,2,,3/2012,3/14/2012,FALSE,,,no basic need,no basic need equipment in the room like freeze and microwave.
1078273,92,RCfly,5,5,5,5,5,4,6,TRUE,FALSE,2,"Troy, MI, USA",3/2012,3/14/2012,TRUE,The rooms are spacious and clean! The staff are polite and helpful. For a downtown hotel security was top notch!,2,"Spacious rooms, ample parking and attention to security, and a helpful and knowledgable staff!","My husband and I and our grown children, had a wonderful stay at this Wilmington downtown location for our 25th Wedding Anniversary!. We were greeted upon arrival, helped with luggage and given great directions to everything we needed to find in Wilmington. We enjoyed the pool and gym areas. The restaurant had no problems seating a party of 13 for lunch at last minute notice. We enjoyed room service for breakfast and the food was warm and enjoyable!. The rooms were clean and spaceous. We liked having a separate bedroom we could close off from guest, or put the grandkids in to play games or enjoy a movie on, while the adults visited in the other section of the room. I highly recommend this wonderful hotel and will return to it on my next stay in Wilmington. Good Internet or Grandbourne rates for the space!"
1078396,1162,mjmj8,4,4,4,4,4,3,6,FALSE,FALSE,2,tampa,3/2012,3/14/2012,TRUE,,2,"The new look is great, the pool is great.",The F&B staff was unfriendly and needed to pick up the pase. On Tuesday at the outside bar during a beautiful day you had staffed a blonde girl. I had sat at the bar ready to order some drinks and I could see that she was busy with a guest making frozen drinks. Which I know can be a pain...but as she was preparing the drinks more guests had approached the bar. Not at any moment did she greet myself or any of the new guests that stepped up to the bar. The total process took over 10 minutes with her going inside to grab things and coming back out. Maybe she was having a bad day but in hospitality you dont need to reflect that towards the guests in the sun.
1078727,636,Robertdavid,5,5,5,5,5,5,7,FALSE,FALSE,4,"Newfane, VT 05345, USA",3/2012,3/14/2012,TRUE,Great Value for a superior hotel,4,A Great Hotel at Exceptional Value,"We have been staying at The Belvoir Portsmouth for years, and it just keeps getting better. The rates are great, the rooms clean and inviting and the staff is exceptional. They welcome our dog James with open arms. Great location in downtown Portsmouth."
1078751,1364,Help,5,5,5,5,5,3,6,FALSE,FALSE,2,"Missouri, USA",3/2012,3/14/2012,TRUE,It is safe walking distance from the hockey games.,3,Staff,When I was checking in the computer was not wanting to work. Mr. Mitchell was trying his best to get the system to work. Mr. Mitchell was very professional and apologetic with the issue he was having. I always stay at this hotel when I am in the St Louis area. I have never had a problem during a stay. I would like to thank Mr. Mitchell again for his professionalism.
1078777,83,scgirl86,5,5,5,5,5,4,4,FALSE,FALSE,2,"California, USA",3/2012,3/14/2012,TRUE,It is very close to Universal Studios and the Gibson.,2,Quick but worth it!,"We had booked a room for 1 night for a specific event but it was very worth it. The staff was friendly and the hotel was beautiful. I had asked to get a late check out due to my event, and they were more than accomodating. The beds are some of the most comfortable I have ever had. Everyone from the concierge, to the desk staff and bell staff were amazing. I would recommend this hotel and I plan on going back soon."
1078815,127,Ellie10,5,4,5,5,5,0,6,FALSE,FALSE,2,"Sierra Nevada, CA",3/2012,3/14/2012,TRUE,"Convenience, comfort and very good value for travel with your dog.",3,"Large Rooms, great bay views.","We had a very nice large, king room overlooking San Diego Bay and North Island. The balcony with sliding door was wonderful, as we were able to have our coffee in the morning and a cocktail at night overlooking the bay. It was also nice to be able to turn off the heating and cooling in the room, open the door and get fresh air."
1079570,865,Canuck1,5,5,4,5,4,4,4,TRUE,FALSE,4,"Holmes Beach, FL 34217, USA",3/2012,3/15/2012,TRUE,"Fitness facilities, rooms and club lounge are all excellent. the restaurant menu is tired and the service is sporadic.",4,As Good As it Gets!,"I've been staying at the Belvoir Parsippany for over 5 years (not to mention dozens of other Grandbourne properties around the continent). The new renovations are brilliant and timely, the workout facilities are among the best I've experienced, the front desk staff (Justin, Mark and others) are professional and organized. Finally, the Club Lounge, hosted by Mary, is like walking into my Mother's ktichen. Always engaged, interested and in great spirits.(David in the evening is good too!) There is no other place worth trying in the Parsippany area. This hotel will not disappoint."
1080155,353,POPS,2,2,2,2,3,6,5,FALSE,FALSE,2,"New Orleans, LA, USA",3/2012,3/15/2012,FALSE,Very much over-priced for what it is...,2,Over Priced,"Rooms are dirty,"
1080940,1776,CanuckTraveler,3,4,4,4,3,2,4,FALSE,FALSE,4,"Toronto, ON, Canada",3/2012,3/15/2012,TRUE,,,I'd stay here again,I just spent 3 night at the Belvoir Philly and overall enjoyed my stay. Location was good for driving as most of my meetings were outside the downtown area. Highway is right there. As a Platinum I was upgraded to a suite with was very nice and comfortable.
1082455,1364,Eman21,3,2,4,3,2,4,4,FALSE,FALSE,3,"Cincinnati, OH, USA",3/2012,3/16/2012,FALSE,,4,Dated facility,"I was disappointed by my recent stay at this hotel. Although it was clean and the staff was professional, the decor was extremely dated. I would estimate that the carpets and furniture are at least ten years old. The same goes for the workout facility. Finally, the commuter bus terminal across the street gives guests the sense that crime might be an issue in that neighborhood."
1082531,664,Bluecello52,3,4,5,5,5,5,6,FALSE,FALSE,2,"Annapolis, MD, USA",3/2012,3/16/2012,TRUE,Nice setting on the beach and close to restaurants and night activity.,2,Great week!,"My wife and I stayed for five nights. Hotel is old, but very well maintained and clean."
1082649,127,Sparktheusa,5,4,4,5,4,4,6,FALSE,FALSE,3,"Kansas City, KS, USA",3/2012,3/16/2012,TRUE,"It is classy, fun, perfect location & great views!",4,Amazing view!,"We stayed in the Marina tower in room 1028 at the club level. The view of the marina was absolutely breath-taking. We loved having a balcony to enjoy the view. The convenience was great. Minutes from the airport, minutes from Sunset Cliffs, Point Loma & even downtown."
1082671,1557,1/1/1966,5,5,5,5,5,5,7,FALSE,FALSE,1,Swansea IL,3/2012,3/16/2012,TRUE,It is a clean and comfortable place with excellent staff.,1,Very nice!,"This was our first time staying at this hotel. It exceeded our expectations. The staff was wonderful, very friendly and helpful. The room was very nice. It is clean. The breakfast buffet is good and the waitresses are very friendly. It is convenient to everything. We will definitely stay there next time we go to Des Moines."
1082714,139,tmills91,3,3,5,5,3,3,4,FALSE,FALSE,4,"Dallas, TX",3/2012,3/16/2012,TRUE,Going through Renovation,4,Denver Tech Center,"It would have been nice to know they were renovating the hotel. Rooms were definitely on the small side, especially the bathroom. Very friendly staff and nice breakfast spread. Good internet connection for working in the evenings."
1083625,3023,WF789,5,3,5,4,4,2,4,FALSE,FALSE,4,USA,1/2012,3/16/2012,TRUE,,4,Hands Down Best Service,"I feel a little strange writing that this Belvoir has the best services hands down, but it's true. I've stayed at BPG properties 400+ nights and this one really sticks out. I guess I have lower expectations for this hotel since it's not a resort, vacation, or big city property, but their service really surprised me. This was the second time I stayed at this location and when I walked up to the counter I was greeted by ""Mr. ___, so nice of you to come back"". I don't know how they knew my name. The staff was extremely attentive, asking if I knew where the workout facility was, lounge hours, etc. Whoever did the training at this facility did an excellent job and the staff is also doing an excellent job."
