reviewID,hotelid,userName,overall,roomComfort,staffMetNeeds,cleanRoom,facilitiesMetExpectations,ageRangeID,tripPurposeID,travelAgent,meetingPlanner,BPGStatusID,guestFrom,arrivalMonth,datePosted,recommend,everyoneShouldKnow,frequencyID,title,comment
1060049,664,GolfBum43,5,5,5,5,5,3,7,FALSE,FALSE,2,"Albany, NY",2/2012,3/7/2012,TRUE,A classic beach hotel with modern amenities.,3,Perfect,My friends and I meet someplace warm every winter to play a few rounds of golf and catch up. The Fort Lauderdale Beach Hotel is the perfect venu. The hotel is right on the beach and it's close to a ton of great golf courses. Dos Caminos has the best homemade guacomole I've ever had.
1060122,3052,Bernie,4,4,5,4,4,,2,FALSE,TRUE,3,United States,3/2012,3/7/2012,TRUE,"They have made improvements in their service, it is a pleasant place to stay, and very reasonably priced.",4,Glad to see improvements!,"The first two times I stayed were excellent, the two abominable and unacceptable. I decided to give it one more try."
1060210,115,run2him,2,1,2,2,3,3,6,TRUE,FALSE,1,"Dothan, AL, USA",3/2011,3/7/2012,FALSE,Great location but it may be a hit or miss on comfort of room accomodations.,2,EXPECTED BETTER,"Great location and hotel design. Due to high volume of guests, check-in was horrible. Lobby area was chaotic and crowded. However, front desk clerk that finally assisted me was courteous. Bathtub was dirty. Bed was hard and uncomfortable. Could hear next door guests talking late at night and partying in other locations of the hotel. Getting vehicle out of valet took way too long."
1060279,1196,rnwn,2,3,3,3,1,4,6,FALSE,FALSE,2,Pasadena,3/2012,3/7/2012,FALSE,,2,This hotel had too many late check outs,"We arrived after 2 long days of driving at 4:30 p.m. They offered us 2 double beds, instead of the king we asked for since they let too many guests have late check out. ( the excuse given). We were exhausted, and just wanted a nap before our evening engagement."
1060633,270,Dina,5,5,5,5,5,,7,FALSE,FALSE,2,,3/2012,3/7/2012,TRUE,Service and cleanliness of the hotel were amazing!!,2,This hotel met our expectations,"This was my second time at this hotel and the first time for my friends. We had an amazing experience at the hotel. Our luggage was brought up to our room by Mr. Mitchell and he was excellent. He answered all our questions about the hotel and made sure we were comfortable before he left. We stayed in the club room so we enjoyed the appetizers/drinks the lounge had to offer which of course was a treat because we didnt expect that. Pool had very comfortable water temperature. All in all, would defintely go back again."
1060695,693,KayKay914,4,4,5,4,4,5,5,FALSE,FALSE,1,"Charleston, WV, USA",2/2012,3/7/2012,TRUE,Pleasant place to stay. The room with the view of the river is very comforting.,4,Most Helpful Staff,"Upon arriving ask for Johnny, he was so friendly, helpful and kind. I was fortunate to obtain his service both checking in and out."
1060756,1364,Zombie737,5,5,5,5,5,4,5,FALSE,FALSE,2,"Chocago, IL",3/2012,3/7/2012,TRUE,The staff was extrememly friendly and helpful,3,Excellent hotel!,"I was very happy with my experience. The lobby was very large, clean and nicely decorated. It's a great place to relax. Many people took advantage of it because of it's inviting feel."
1061062,421,SGarts,4,4,5,5,5,3,3,FALSE,FALSE,2,"Abilene, TX, USA",2/2012,3/7/2012,TRUE,"Very clean, friendly staff",2,Great Conference Hotel,"I stayed here as an overflow from a conference down the street. I was surprised at the low rate (a conference perk) and pleased with the cleanliness of the freshly updated room. The only complaint I had was the room was a bit small, but hey, it's New York!"
1061185,270,SharonY,4,4,5,5,4,4,6,FALSE,FALSE,3,"Buckingham, PA",3/2012,3/7/2012,TRUE,perfect for convention attendees,4,Great birthday celebration,The front staff was very welcoming and accomodating. We were celebrating our daughter's 21st birthday and wanted her and her friends to have a special experience. We asked and they were able to put a big HAPPY BIRTHDAY message in the front lobby for everyone to see. The location is convenient and the view from our rooms on the upper floors were dazzling.
1061714,1196,cliff,1,1,1,1,1,6,5,FALSE,FALSE,1,"San Francisco, CA, USA",3/2012,3/7/2012,FALSE,"The service stinks, the place is nice, if only the staff understood what standard they represent.",4,just sell the room even if it's defective,1. they offered me a paid upgrade to club level via email; no one knew anything about the offer or my written acceptance.
1062179,421,GW02,2,3,1,1,1,4,2,FALSE,FALSE,2,DFW,2/2012,3/8/2012,FALSE,Poor customer service.,4,Not Customer Friendly,"When I arrived in the room, the room was dirty with hair on the floor and sink. Clock was broken. The restaurant only has an overpriced buffet for breakfast. The oatmeal tasted like water, and I didn't eat it, so I was charged $30 for fruit. When I objected, the staff showed obvious disdain. I tried to contact the management, and could not get a response. I left a comment card on the front desk and never heard from them. Nobody at this hotel cares about the customer. Stay somewhere that treats their customers with respect and dignity."
1062219,315,Anonymous,4,4,4,4,4,4,4,FALSE,FALSE,3,"Palm Beach Gardens, FL, USA",3/2012,3/8/2012,TRUE,Good location in Fisherman's Wharf,2,Over all....a good experience,"As with many big cities, the food was extremely expensive. The hotel breakfast buffet was $24.95. No thanks."
1062344,115,Brimav,4,5,4,5,5,2,2,TRUE,FALSE,2,"Tampa, FL, USA",3/2012,3/8/2012,TRUE,Great staff when you arrive,2,Friendly Staff,"Overall, great experience. Staff was friendly and took care of most of my needs. There were one or two bumps in the road during the stay but I am sure were not usual practices or the fault of the hotel (busy, unavailable front desk; difficult to get a cab from hotel; was not serviced quickly at the Atrium Buffet one morning)."
1062404,1021,QueenBee,5,5,5,5,5,6,5,FALSE,FALSE,3,Phila. PA,3/2012,3/8/2012,TRUE,Staff is exceptional,1,Very pleasaant experience,"From check in to check out, all went smothly. Staff was friendly. I would highly recommend this hotel and if I am ever in the Tampa area again, this is the hotel where I would stay."
1062478,1564,LeeG,4,5,4,5,4,4,2,TRUE,FALSE,3,"Dallas, TX, USA",4/2012,3/8/2012,TRUE,,4,Very Good Location and Value,Recommend this hotel right on the riverwalk. Management team cares about their guests. Clean room and comfortable beds.
1062577,1556,BlackCloud,1,1,3,1,1,2,4,FALSE,FALSE,4,"New York, NY, USA",3/2012,3/8/2012,FALSE,Don't even consider staying here.,4,A Belvoir in name only,"Simply put, the rooms are unacceptable. Dirty, stained carpets, drapes, and furniture (that wouldn't be out place in a college dorm). Was in two rooms (the first was so bad they moved me) and the second wasn't much better than the first. If you face the highway, you'll hear traffic all night too."
1062670,1144,Stephen4976,4,4,4,4,4,3,3,FALSE,FALSE,3,USA,3/2012,3/8/2012,TRUE,Easy MARTA access.,2,Great Value for Downtown ATL,"Excellent value for Downtown Atlanta where hotels may fetch 2x as much per night. Lounge was comfy, but don't expect a full breakfast. Some traffic noise, but its expected Downtown in a major city. Gym was a standard hotel gym, but very low ceilings made it feel like a cave."
1062809,177,ArizonaVacation,5,5,5,5,5,2,2,FALSE,FALSE,3,"Winnipeg, MB, Canada",2/2011,3/8/2012,TRUE,Nicer than your average category 2 property,2,Exceeded Expectations,"This hotel was a pleasant surprise. As it is rated only a category 2 Grandbourne property, we were not quite sure what to expect. We were impressed with the following:"
1063321,855,Dave88,5,5,5,5,4,4,8,FALSE,FALSE,3,"Long Island, New York, USA",3/2012,3/8/2012,TRUE,"the entire staff, managers, waitresses, bartenders, even the room service people were all very polite and accommodating and made us feel welcome and relaxed",2,Anniversary Celebration,"It was a last minute decision, we booked a room online using points and cash. We arrived and asked for a specific room, however, we could see and was told that the hotel was booked and that particular room was not available. I mentioned to the staff member, Samantha, that we were celebrating our anniversary - she responded "" give me a minute, let me see what we can do"" Samantha tracked down one of the managers, Ben, and for what seemed like a long time (but prob. was only 2 or 3 minutes) they clicked and clacked and found us the room we wanted only on a different floor. This was the start of a great weekend in which we had drinks and snacks @ the bar, Dinner late that evening and a great breakfast in our room the following morning all without leaving the hotel. ."
1064224,1556,Tigerlilly,5,5,5,5,5,3,6,TRUE,FALSE,1,Hawaii,3/2012,3/8/2012,TRUE,,2,This hotel has great employees,"Jennifer, the night manager, was working the night we came in. She appeared to be working alone. It was pretty late. She was our front desk agent and our concierge and she did a magnificent job! She made us feel welcome and she made us feel comfortable."
1064443,421,Mishimoqua,5,4,5,5,5,,3,FALSE,FALSE,4,,3/2012,3/9/2012,TRUE,,,Great,"Comfortable and clean, nice staff."
1064622,127,VegasBandN22,4,5,5,5,5,4,8,FALSE,FALSE,3,"Las Vegas, NV, USA",2/2012,3/9/2012,TRUE,"Bay tower, either side has the best views in my opinion",2,Big Bang for the Buck,"Love this hotel, have stayed here many times at both towers. The Marina Tower has a tad smaller rooms, but is the hub and the buzz of this location. The Bay tower is really quiet and rooms are larger. The two towers are not connected by a covered walk way. To walk to either you are exposed to the elements. This Hotel is so convient to the airport, gaslamp dis. and shopping. Hats off and special thanks to Blanca at the front desk, she works both towers and is a joy! I let people pass in front of me, just so I can have my turn to be waited on by her. If business (marina tower) Pleasure (bay tower) Enjoy, I Did!"
1064793,1552,djDv1,1,1,1,1,1,4,4,FALSE,FALSE,3,"Edmonds, WA, USA",5/2011,3/9/2012,FALSE,sub par service in every area,4,Worst experience ever,"Having stayed at all the Belvoirs in the area, and loving them, I was looking forward to trying out this remodeled property. What a mistake. Rude front desk people, my room never got cleaned, restaurant so understaffed it took half an hour to have my order taken. On top of this at check out I was charged $12 per day for parking and had never been told that in advance. Stay anywhere but here."
1065461,954,pikejo,3,3,3,3,2,,4,FALSE,FALSE,2,,3/2012,3/9/2012,FALSE,,,Hotel needs upgrading,"Hotel is a little ""tired"". Needs updating. Several projects such as fitness upgrade appear in process. But my room was a little on the tired side. The work area was old. The breakfast buffet was average--food quality was ok. I think once upgraded, the location is pretty good--close to airport and close to restaurants in Tempe."
1065509,1719,ronlan,5,4,3,5,5,3,6,TRUE,FALSE,4,"Kelowna, BC, Canada",3/2012,3/9/2012,TRUE,Kid friendly pool area and one of the best fitness rooms I've seen in a hotel.,2,Great location for families with kids,We used points to stay here for the final 3 days of our family vacation. We decided to stay where they had a heated pool for our young kids (aged 3 and 1) and a close location to Legoland.
1065637,111,Eljay,3,4,4,4,3,6,6,FALSE,FALSE,2,Colorado Springs,3/2012,3/9/2012,TRUE,The roominess of the suite.,2,Watch your rate,"My husband and I enjoyed a 5 night stay at this hotel. I had booked the room 2 months ago and paid in advance to get a better rate. What a surprise when I checked the rate 3 days prior to arrival and found the exact room was $54 per night cheaper (including tax). I did not bring this to the attention of the front desk when we checked in. (My mistake) If the rate had dropped that much, I would have appreciated knowing this when we checked in. It was made very clear to me when I made the reservation that once I had paid for it, I was locked into that rate. I felt penalized for planning ahead!!"
1065729,214,battery1986,4,4,4,4,4,3,4,FALSE,FALSE,2,"Somerset, NJ, USA",3/2012,3/9/2012,TRUE,,1,Nice property,Overall nice hotel and experience.
1065876,460,SunflowerRita,5,5,5,5,5,2,8,FALSE,FALSE,1,"Palmetto, FL, USA",2/2012,3/9/2012,TRUE,"Amazing staff, beautiful hotel & in an excellent location!",3,Best experience ever at a Belvoir!!,"My husband and I stayed at the Belvoir Seattle for a few days in Feb 2012. It was the best experience we have ever had at a Belvoir! Our room was beautiful, the staff was wonderful & the concierge was extremely helpful. The location is perfect too. A great place to stay when you want to be in downtown Seattle close to all the action. We highly recommend this hotel. It is worth every penny!"
1066678,1719,nikkin,5,5,5,5,5,4,6,FALSE,FALSE,4,"Moreno Valley, CA, USA",3/2012,3/9/2012,TRUE,"This is one of the best hotels. I have stayed in other brand hotels, but Belvoir has done great job with this resort and for the price it is definitely worth it.",2,Great Resort,This is a great resort for a weekend getaway. Rooms are spacious and bathroom too! Excellent staff. I would definitely come again.
1066851,166,Anonymous,4,4,5,4,3,3,6,FALSE,FALSE,3,"Montclair, NJ",2/2012,3/10/2012,TRUE,If you have young children the pool will be your best friend!,2,Perfect Historical Location Location Location,The hotel is under construction so be prepared.
1066880,353,Tigerlilly,2,3,2,4,5,3,6,TRUE,FALSE,1,Hawaii,3/2012,3/10/2012,TRUE,Its centrally located,,Ms,"Hotel has great features and is in a really good location,,, but the service is inconsistent. The bellmen are very friendly. I encountered two front desk staff . The first was very friendly and helpful, the secend was basically just doing her job. No smile."
1067183,760,BECCAT,5,5,5,5,5,6,6,FALSE,FALSE,2,"Charlotte, NC, USA",3/2012,3/10/2012,TRUE,The whole facility was so clean and the staff was wonderful.,3,Beautiful and Convenient to Everything,Our suite was absolutely wonderful. We did not know about the shuttle service at first but caught on quickly . Great service . The staff was wonderful. The whole property was so very clean and we felt so safe. OverAll this facility was A1A....Thanks for making our first trip to Key West so enjoyable.
1067525,3125,seanny,4,4,4,5,2,,2,FALSE,FALSE,2,,2/2012,3/10/2012,TRUE,the gym equipment is horrible. Please fix the tv in 904.,,Clean & Friendly but Lacking...,"Overall, the hotel is nice, the food was good and the staff was friendly. However, the fitness center is a joke (except for the cadio which is fine). Also, if you want to use the lobby internet computers, be prepared for ""dial-up"" type speeds. Lastly, the television signal goes crazy about every 15 seconds for unknown reasons. I was there 3 nights and this was a major annoyance which no one in the hotel could explain or fix."
1067615,3052,Adam,4,4,4,4,5,4,8,FALSE,FALSE,4,"Nyack, NY, USA",1/2012,3/10/2012,TRUE,"Good value, clean hotel",4,"Nice,Clean Belvoir",I initially stayed at this hotel because I received a low rate for a single night stay with my wife.
1067792,1177,CRBY,5,5,5,5,5,4,7,FALSE,FALSE,2,"Binghamton, NY, USA",1/2012,3/10/2012,TRUE,"For 169.00 a room, I felt like we had a suite!",3,Wonderful Time!,"This place has everything you need! The Beds are wonderful! I have no idea where they buy their pillows, but they are the best I have ever put my head on. After a long day in NYC we came back to a clean and comfortable place to stay. The staff was friendly, over the top to help. The fairy is right outside the hotel. You can get your tickets at the front desk. They have a indoor pool, which we didn't use, but will the next time we stay there."
1068070,1703,Mark2072012,1,4,3,5,1,4,3,FALSE,FALSE,1,"Columbus, OH, USA",3/2012,3/10/2012,FALSE,Does not live up to what one would expect for this brand and price,2,"Food was terrible,pool way too small and extra charges were out of line",For a first class hotel the food was terrible - at the main restaurant - we tried twice and both meals were very poor quality. Also the pool is way too small for a property of this size - people were actually fighting over pool chairs and finally charging for wireless service in this day and age is not competitive - I would not recommend this facility to anyone and will not stay there again.
1068705,1047,jreyes41,2,,,,1,,6,FALSE,FALSE,2,,3/2012,3/10/2012,FALSE,Caveat emptor: mkae sure your reservation is solid at this hotel.,,Don't expect your confirmation to honored,"I have been a an BPG member for over 10 years and have booked at several Grandbourne facilities in PA and other other states and have never been told that there was no room available upon my arrival. Evidently this hotel doesn't give much credence to the room committments it makes. The room, I was finally given was one of the noisest I have ever been in. I was offered another room at the hotel ""down the street"". If I had wanted to stay in that hotel, I would have booked there. I will not make any future reservations at this hotel."
1068949,90,CentralBA,5,5,5,5,5,5,2,FALSE,FALSE,2,"Alexandria, VA, USA",3/2012,3/10/2012,TRUE,Great Accommodations!,2,A Great Place to Stay,"Very pleased. Everything about this hotel was great! I loved my room, especially the bed. All 3 nights, I slept great. Also, loved the breakfast bar. I highly recommend this hotel to all DC area travelers. You will not be disappointed."
1069502,94,TedC,5,5,5,5,5,,4,FALSE,FALSE,3,,3/2012,3/11/2012,TRUE,,,The Only Hotel To Stay In Columbus,"Stayed here numerous times and always happy with the staff and facilities. Check in always a breeze (Alex makes it so), and breakfast good and quick (I can't remember the names but they know by breakfast order by memory). Rooms always clean."
1069520,460,fp2012,1,1,1,1,1,4,3,FALSE,FALSE,1,"Madrid, Espa񡼯span>",3/2012,3/11/2012,FALSE,Es una mala elecci󮠳i pretendes aprovechar el tiempo para algo m᳠que para dormir.,2,Saben como hacer desagradable la estancia,1. Haci鮤ote esperar hasta 50 minutos para poder entrar a desayunar. Acab頤esayunando en un Starbucks para no perder el tiempo.
1069564,1113,Pedroboy,3,4,3,3,3,5,6,FALSE,FALSE,3,"Carrying Place, ON K0K, Canada",2/2012,3/11/2012,FALSE,Free parking is a treat! Few hotels offer that nowadays...,2,Mixed bag,"Impressive lobby area and atrium. Pleasant pool area. Rooms generally comfortable but bathroom is rather tiny given the size of the room, and stained upholstery in the sitting area was a bit of a put off. My one major complaint however was the inadequate air conditionning - we never managed to set a comfortable temperature even when we set the thermostat into the lhigh 60s! Front desk staff are generally welcoming but should not be tasked with providing pool towels along with everything else - standing in line at the front desk to get a pool towel is not in keeping with Belvoir standards."
1069766,315,Adam,3,3,3,3,3,4,4,FALSE,FALSE,4,"Nyack, NY, USA",3/2010,3/11/2012,FALSE,Basic Hotel....Economical,4,Good Location Near the North End,I've stayed at the Belvoir Fisherman's Wharf Hotel a couple of times. This is a small hotel in a very touristy area. It has a small lobby.
1069787,214,Adam,4,4,4,5,5,4,6,FALSE,FALSE,4,"Nyack, NY, USA",7/2008,3/11/2012,TRUE,Well laid out hotel....you will not be disappointed!,4,Nice Hotel...nice pool,"I've stayed at the hotel several times on business and with my family. If you want to stay in Palo Alto, it is very conveniently located."
1070089,341,Adam,2,2,3,3,2,4,4,FALSE,FALSE,4,"Nyack, NY, USA",7/2011,3/11/2012,FALSE,NO HOT WATER PRESSURE IN SHOWER,4,No water pressure,I've stayed at the Belvoir Houston Brookhollow several times.
1070192,1143,TravelinKen,4,4,4,5,4,3,2,FALSE,FALSE,4,"Chicago, IL",3/2012,3/11/2012,TRUE,Good option near the galleria. Traffic can get backed up on the road in front of the hotel during peak times making it difficult or a long wait to pull into the hotel entrance.,4,Good Hotel Near the Galleria,Not too much to say about this hotel. My stay was for 3 nights and I wanted to be near the Galleria. I was on the Grandbourne Preferred Floor (Floor 14) and my room was well maintained and very clean.
1070693,1506,havebusinesswilltravel,4,4,4,4,4,2,2,FALSE,FALSE,3,Utah/Cali/Wa,3/2012,3/11/2012,TRUE,Dont base your decision to stay on the outside of the hotel.,4,More then I expected,"If you have never stayed at this hotel dont knock it based on the outside. I have to say when I saw the hotel from the freeway I was a little nervous as to what my stay had in store. I was traveling for business with my wife and children and had booked on BPG without seeing the hotel in person before. I must say dont judge a book by its cover because the inside of this hotel is great. Its all a deep blue and wooden beam nautical theme. The rooms are the same with beautiful shots of the puget sound, boats, etc. The welcom staff was very friendly and upgraded us to the club floor. The club lounge was great, friendly staff, tasty little snacks. All in all a great place to stay and just outside of downtown Bellevue."
1071515,954,BOBO413,3,2,3,3,3,6,3,FALSE,FALSE,2,"Arcadia, CA",3/2012,3/12/2012,FALSE,Good for meetings,2,Hotel needs work,"Room needs improvement. Bathroom door did not close, air conditioner too loud. Shower old and did not drain well."
1071825,1236,Rob59,1,2,1,3,1,3,2,FALSE,FALSE,3,"Nashville, TN, USA",3/2012,3/12/2012,FALSE,management is unprofessional!!!!!,4,Very Unprofessional,"The hotel from the General manager, front desk, security were very Unprofessional. I travel about 323 days a year and i recently stayed at this property and there was a group of teenagers in the lobby that was so loud that i couldn't sleep. I was on the 8th floor and it was still so loud!!!!!! I called the MOD, Front desk, Security and ask them to do something about the noise and they said there was nothing they could do about it in till some group left. First what a security concern letting all these people into the lobby when not registered guest, there was a lot that got by security and was ridding the elevators and walking around on all floors knocking on doors looking for this group. Second I can't believe that this screaming and singing in the lobby went on for 4hrs!!!!! I will never stay at theis property again and go out of my way to tell everyone about the Unprofessional management and staff."
1071999,1162,billkathy88,4,5,3,5,4,5,6,FALSE,FALSE,3,Califonia,3/2012,3/12/2012,TRUE,,4,Belvoir Lake Buena Vista,Nice upgrades but still some bugs to work out.
1072087,1703,bbbb,3,4,4,5,3,3,3,FALSE,FALSE,1,"Weiser, I",3/2012,3/12/2012,FALSE,The Arizona Center next door is great!,2,An idea for you.,"House keeping did a great job keeping my room clean and the entire facility looked very nice. I was disappointed with the television package. You had very little to offer for movies, no hbo, no cinemax. If I wanted to rent a movie they were way overpriced. For the amount we payed for the room we should have had free internet and free movie channels to enjoy."
1072140,1552,Miri,4,4,4,4,3,4,3,FALSE,FALSE,2,,3/2012,3/12/2012,TRUE,Hotel is clean and comfortable.,2,Nice hotel,"I stayed at this hotel for 2 nights, on the BPG ""member"" level. The room was clean and comfortable (it had a real thermostat, not one of those silly under-the-window noisemakers). The bed was very comfortable. Towels, shampoo and conditioner were also nice. Everything was good except for a few minor details, which are easy to overlook. The biggest negative was the wireless internet. It was horrible. I logged in and got booted out many times, and when I was in it was horrendously slow. I tried to use the wired internet but the cable was too short to reach my computer. Not convenient at all."
1072228,468,mkgen,3,3,2,3,4,,3,FALSE,FALSE,2,,2/2012,3/12/2012,FALSE,Front desk is difficult to work with.,,Not kid friendly,I was there for work and for that it was fine. I would not however bring my family to stay here on vacation. Not a lot of kid friendly restaurants and was a hassle to check in.
1072232,3675,ChaCha,4,5,5,5,4,,7,FALSE,FALSE,1,,3/2012,3/12/2012,TRUE,Under construction,,So close to a five star rating,"If there wasn't still construction going on, it would be five stars. The occasional noise and construction crew was the only thing that didn't make this stay perfect."
1072261,468,jackie270150,1,1,1,1,1,3,6,FALSE,FALSE,1,colorado,3/2012,3/12/2012,FALSE,Hotel is more for convention purposes,2,This hotel is very expensive,"The hotel staff were rude, desk clerk wanted to charge 60.00 more per day, for a different room. Our room very dirty, food under bed and nightstand. bath tub was dirty. Sink was clogged. Too expensive for a run down Room. 170.00 for a steak dinner for 3 people."
1072266,760,UNRESOLVED,1,4,1,4,1,5,2,FALSE,FALSE,3,"California, USA",2/2012,3/12/2012,FALSE,IF YOU LEAVE ITEMS IN YOUR ROOM THAT ARE NOT HIGH PRICED ITEMS ONE OF THE STAFF WILL TAKE THEM THINKING NO ONE WILL BOTHER ABOUT THE LITTLE STUFF.,2,UNTRUSTWORTHY EMPLOYEE,"WE HAD LEFT SOME ITEMS IN ONE OF THE CABINETS WHEN WE LEFT THE HOTEL. WE CALLED TO TELL THEM WERE WE LEFT THE ITEMS. AND NOBODY IN HOUSEKEEPING CLAIMED THEY SAW THEM. I THEN SAID WELL I GUESS THE NEXT GUEST GOT SOME FREE STUFF, I WAS THEN TOLD THAT COULD NOT HAVE HAPPENED BECAUSE BEFORE ANY NEW GUEST GET ACCESS TO THE ROOM ALL CABINETS & DRAWERS ARE OPENED BY THE HOUSEKEEPING. I CONTACTED THE MANAGER AND HE WAS NO HELP AND WOULD NOT ACKNOWLEDGE ANY WRONG DOING ON HIS STAFFS PART & DID NO COMPENSATION TO US FOR WHAT HIS STAFF DID. I WOULD NOT RECOMEND THIS HOTEL TO ANYBODY"
