reviewID,hotelid,userName,overall,roomComfort,staffMetNeeds,cleanRoom,facilitiesMetExpectations,ageRangeID,tripPurposeID,travelAgent,meetingPlanner,BPGStatusID,guestFrom,arrivalMonth,datePosted,recommend,everyoneShouldKnow,frequencyID,title,comment
11507240,468,Lynn48,5,5,5,5,5,5,8,FALSE,FALSE,2,"Tampa, FL, USA",10/2012,10/10/2012,TRUE,Large comfortable room.,2,Comfortable room. Great amenities.,We really enjoyed our stay. Great views from balcony. Comfortable bed. Wonderful breakfast buffet. Nice shower.
11507565,468,ssloss,2,1,3,1,3,3,6,TRUE,FALSE,2,"Tampa, FL",10/2012,10/10/2012,FALSE,Rooms are filthy.,2,Room was worn out and filthy,"The room was very worn out, and very dirty. There were chunks of something on the bathroom floor and door (I'd be willing to bet it was some sort of body excretion). The tile around the bathroom and in the bathroom was filthy, it looked like it had build up of staining from years of improper cleaning. The grout was filthy. There was hair in my bed. The a/c was inconsistent, it either didn't work at all, or made the room freezing. This was my first, and likely last stay at this property."
11508010,951,Shwrmssg,5,5,5,5,5,4,6,FALSE,FALSE,1,"Washington, DC, USA",10/2012,10/10/2012,TRUE,Polite Staff,2,Great Stay,We very much enjoyed our stay. The room was very clean and had a pleasant smell. The reception desk folks were very nice and answered all our questions. I would definitely stay here again when we are up that way. I hope next time to have time to check out the spa and pool.
11508460,468,critterhouse2,2,2,1,2,2,3,6,FALSE,FALSE,3,"Orlando, FL, USA",10/2012,10/10/2012,FALSE,They don't say what they are going to do,2,Tried it one more Time,"This time when we checked in there was no water in the room. I called down and requested our two waters that came with the resort package. The lady on the phone said they would send some up, they never came."
11508465,315,1/1/1937,4,5,5,5,4,6,6,FALSE,FALSE,4,"Castro Valley, CA",10/2012,10/10/2012,TRUE,Pricey parking,2,wonderful staff,Hotel was Clean and comfortable.
11508497,1428,Frustrated11,2,4,1,4,1,,5,FALSE,FALSE,2,,10/2012,10/10/2012,FALSE,There is no food in the evening and no outside food is allowed. Take the stairs.,3,Service/Elevators Lacking,"People were stuck in the elevator for 20 minutes (multiple times throughout our stay), there was a huge line to get into the elevator and then a staff member cut the line with a large cart that took up the whole elevator to deliver room service. We had to find stairs to go up to our room, but no one showed us where they were and when we found them they were outside."
11508531,2019,gleec123,5,5,5,5,5,6,5,FALSE,FALSE,1,"Sewell, Mantua Township, NJ 08080, USA",10/2012,10/10/2012,TRUE,,1,Effortless,"Had not one issue or problem. Everything went very smoothly, with no effort on my part. That's the hallmark of a good stay for me."
11508535,232,Linda1019,5,5,5,5,5,5,6,FALSE,FALSE,4,,10/2012,10/10/2012,TRUE,,3,Nice hotel,"Comfortable, pleasant, nice staff, good location"
11508548,3676,Gary22,5,5,5,5,5,4,6,FALSE,FALSE,3,"New Hyde Park, NY, USA",10/2012,10/10/2012,TRUE,,2,Great Hotel if you are visiting UD,"This hotel is close to the University of Delaware. It is well maintained, the gym and pool are are fine for a small hotel. The club area on the 5th floor is outstanding."
11508553,94,BuckeyeBob,5,5,5,5,,6,5,FALSE,FALSE,3,"Chicago, IL, USA",10/2012,10/10/2012,TRUE,Rooms smelled fresh!,1,First Timer,"This was our first stay at a Suite hotel, and we liked it. Much more room than I envisioned. Microwave and refrigerator were great to have."
11508582,468,Cathy52,3,5,3,1,4,4,3,FALSE,FALSE,1,Ohio,10/2012,10/10/2012,FALSE,Location is walking distance to Epcot,1,Housekeeping items,"To be honest, this stay was a bit below average . My bathroom (commode) was not cleaned properly when I arrived to the suite (someone else's business was left behind). There was a razor left in the shower (not mine). I asked for housekeeping to replace or repair the alarm clock (the time was never correct the entire time I stayed). The printers in the business area did not function to print boarding passes and had to ask the conciere to do this task. The surroundings seemed a bit dated and carpets worn / dirty in some of the common areas. The room (ceiling) had dark stain. My bedding bolster had tear . I had always heard that Disney resorts went beyond your expectations. My expectations are higher! I will say the bed, pillows were comfortable. The meals were adequate but not superb."
11508620,3205,Tdot,3,3,2,3,3,,3,FALSE,FALSE,2,,10/2012,10/10/2012,TRUE,,,Decent,Nothing over the top but a decent hotel in a good location.
11508623,421,phillytraveler,4,3,4,5,4,4,3,FALSE,FALSE,2,philadelphia pa,10/2012,10/10/2012,TRUE,,3,Great Hotel in Times Square,"The Belvoir NY is a well run professional hotel in a great location exploring midtown and Times Square. Hotel has recently been renovated so everything feels new and fresh. It is a large hotel with 1000 rooms but the staff does a great job managing the massive amounts of people coming through the hotel. Check in and out is great. Room was fresh and clean with a comfortable bed and nice big flat screen TV with alot of channels.However, the room is small and not really a place where one would relax and hang out. Best for tourists and businesspeople. Great security."
11508626,95,NotaFutureGuest,1,1,1,2,1,2,3,TRUE,FALSE,2,"Richmond, VA",10/2012,10/10/2012,FALSE,,2,Unhappy Experience,"I had concerns about this hotel before my stay began. I was coming into town for a conference and a work meeting. My plans changed at the last minute and I was not going to be staying the full lenght of time. I called the hotel to change dates and was told they would bill the entire amount then reimburse. They billed the entire amount and gave 2 different invoices. When I called to inquire about the refund/credit I was told it would post after midnight due to a bank holiday. I was also told a manager would contact me. It's a day later. No credit has been issued and no manager has called. I am not happy. Will not be staying here again. Also during the course of the stay we had a fire alarm go off for no apparent reason (staff did not apologize for the inconvenience of trotting dow 28 flights at 9pm in 29 degree weather) and in a separate instance a colleague got stuck in the elevator. Rooms were ok, but the hassle of getting payment corrected means I will stay elsewhere in the future."
11508686,1703,Mrsnak,5,5,5,5,5,4,2,TRUE,FALSE,2,"Scottsdale, AZ, USA",10/2012,10/10/2012,TRUE,"If you are holding a meeting, Chelly does a wonderful job meeting all your needs.",2,Always a nice stay at the downtown Phoenix Belvoir,As usual our stay at your hotel was perfect. Chelly met our every need for our scrapbooking weekend. The catering department did a bang-up job on the food. The rooms were very comfortable. Can't wait to come back in May.
11508793,1784,Clarabel,5,4,5,5,5,5,8,FALSE,FALSE,1,"Texas, USA",10/2012,10/10/2012,TRUE,It is close to everything you need to enjoy Ft. Worth.,3,This hotel is close to everything,"This hotel was close to shopping, dining,and anything you would want to do and see in Ft. Worth. Excellent location. The room was very nice and comfortable. Only one draw back... the A/C was very loud and distracting trying to watch TV or sleep."
11508804,674,Bronx60,5,5,5,5,5,4,5,FALSE,FALSE,1,"Baltimore, MD, USA",10/2012,10/10/2012,TRUE,you can bring pets and the staff provide very nice service,1,this hotel lets dogs stay there,the site was conveniently located near 95 and other amenites.
11508848,829,LE1012,5,5,5,5,5,5,1,FALSE,FALSE,2,"Denver, CO, USA",10/2012,10/10/2012,TRUE,Friendly staff,1,This hotel's staff was outstanding,"The hotel's staff was very helpful and friendly, everyone I encountered was extremly friendly from the front desk staff to the security staff."
11508853,1021,Rick21,5,5,5,5,5,4,6,FALSE,FALSE,3,"Fleming Island, FL 32003, USA",10/2012,10/10/2012,TRUE,,2,Great Stay,"This property has a great location, all suites and is pet friendly. I have stayed here before and will return again and again. The front desk check in staff was great."
11508867,606,Kay202,4,4,4,4,2,4,7,TRUE,TRUE,2,"Upper Marlboro, MD 20774, USA",10/2012,10/10/2012,TRUE,,2,Partly Satisfied Customer,"I thought the room rate was very pricey for the accommodations. The Club level upgrade was a rip off, since they overbooked and I was still charged that club fee and was not on that level. Then they charged me $15.00 for two glasses of wine in the club lounge that was not very inviting. However, the pool and hotel resturant was very nice."
11508876,468,Dizknee,5,5,5,4,4,4,3,FALSE,FALSE,2,"West Virginia, USA",9/2012,10/10/2012,TRUE,,2,Had a fireworks view,I found my 4 night stay at the Dolphin to be very comfortable. Check-in was a breeze and I was in the room before noon! The only problem I had was the in-room safe was locked upon arrival but maintenance arrived to open it less than ten minutes after I called.
11508884,430,travjenkins80,5,5,5,5,4,2,3,FALSE,TRUE,2,"Augusta, GA, USA",10/2012,10/10/2012,TRUE,,3,Great Hotel minus the in room bathroom,"The bathroom in the room was outdated and the paint was peeling from the tub, but everything else was great."
11508887,1784,DavisFamily7,3,3,1,4,4,2,5,FALSE,FALSE,1,"Fort Worth, TX",10/2012,10/10/2012,TRUE,,3,Expectations,"We were very aggravated. When we booked the reservation online, we booked a room with a king size bed. When we arrived at 4pm (which is an hour later than the time you can check in) we were told that there were no rooms with King Size beds clean and we would need to be put in a room with 2 queen beds. You shouldn't be allowed to book something that isn't going to be available! It's ridiculous. If you cannot have them ready, then don't promise them. Then, there was a disturbance on our floor about 1:30am and the hotel security staff, I guess, is walking the floor looking for the disturbance with their walkie talkies beeping LOUDLY and continuously while we tried to sleep...beautiful hotel, crappy service! I was disappointed!"
11508979,392,dakota1,4,5,4,4,3,6,4,FALSE,FALSE,2,"St Augustine, Fl",10/2012,10/10/2012,TRUE,Generally very clean and the staff is very professional,2,Parking can be a problem,I stay at this hotel quiet often. Every once in a while there will be no parking available because the hotel does not protect its parking when other activities are going on at the convention center
11509005,662,dgcooper,2,2,1,5,2,3,2,FALSE,FALSE,2,Atlanta,10/2012,10/10/2012,TRUE,BYOB,3,Not What I Expected,"We stayed at the Fairplex because of an event at the Fair Grounds. Thought it would be convenient considering there was a res truant and bar on site. However the service was horrible. You would think that the hotel and staff would be accustom to taking care of large groups. this was not the case. Took over an hour to get drinks at the bar, Dinner was an hour and a half to get a burger and fries for 2."
11509064,171,crazyteapot,5,5,5,5,5,4,8,FALSE,FALSE,3,"Virginia, USA",10/2012,10/10/2012,TRUE,Easy access to interstate and good location for most any activity in the Tidewater area. Nice property.,2,Great River views,We used points for our stay. Hotel was very busy with reunions and weddings but noise level was fine and we were in a room right at the elevator. Did not eat. Valet $22 or self park for $13. They will validate ticket for $5 off self park. In case of bad weather you may want to valet as it is a little bit of a walk to garage.
11509108,3576,StormyIsaac,5,4,5,5,5,2,5,FALSE,FALSE,2,"Fort Lauderdale, FL",10/2012,10/10/2012,TRUE,,1,Very Accomodating,"Very friendly staff, room was perfect and clean. Had a great time and will stay again next time in Orlando area."
11509137,341,Pitch,5,4,5,5,5,,2,FALSE,FALSE,3,"Albuquerque, NM",10/2012,10/10/2012,TRUE,Staff and Service is better than other hotels,2,Best Hotel Staff in Houston,"I got a great rate, which was the real reason I originally chose this hotel. The 290/610 location was perfect. From the moment I checked in Amanda and the other front desk staff made me feel at home. Needed to have a business meeting at the hotel on a Saturday and the equipment and Wi-Fi worked great. Forgot my iPhone charger but the front desk took care of it. The service and friendliness of the staff was truly outstanding."
11509139,606,NJtribe,3,2,4,2,2,4,6,FALSE,FALSE,2,Jersey,10/2012,10/10/2012,TRUE,great location for UVM. Nice bar inside hotel for drink,3,Capacity crowd causes less than great stay,"We checked in about 10PM expecting our king size bed. After 7 hours of driving and 3 hours of walking around town we needed a good nights sleep. Our king room was given to someone else. Temp is room kept switching from hot to cold. Some mold in the shower tile grout. On the brightside, right next to UVM and the bar was good"
11509186,421,John26,3,4,3,4,3,,1,FALSE,FALSE,1,,10/2012,10/10/2012,TRUE,,2,wifi inadequate,"In the meeting area (Convertion Center"" I could never get on wifi, always ""too many people already on."" This is below standard for 2012 facilities."
11509224,270,djv1954,4,5,5,5,4,5,8,FALSE,FALSE,3,NJ,10/2012,10/10/2012,TRUE,Modern decor and friendly staff,2,Very nice hotel,"I'd recommend this hotel , despite it not being on the boardwalk. Very nice room, friendly staff. My only complaint would be the breakfast we had. Other than that, the place is great."
11509236,1726,DayByDay,4,5,5,5,3,2,8,FALSE,FALSE,2,"Charleston, SC",10/2012,10/10/2012,TRUE,The beds are ridiculously comfortable.,3,Made for relaxation,I love the sleeper beds they are wonderful. As soon as you lay on them you sink right in...like sleeping on a cloud. I must admit I was a little shocked at the pool. I loved that it was indoor and well maintained but it only goes up to 3 feet which was very disappointing. The room had a Nintendo 64 which is outdated. Besides that and the trouble we had with the arm to the entrance of the parking garage everything was excellent and very well-maintained.
11509247,127,Harley69,5,5,5,5,5,4,6,FALSE,FALSE,2,CA,10/2012,10/10/2012,TRUE,Perfect location!,3,Loved this hotel!,"Great pool, great service, great food, great views, great walking trails.....we will for sure be back!"
11509259,196,Danny41,5,5,5,4,5,2,7,FALSE,FALSE,3,"Coral Gables, FL, USA",10/2012,10/10/2012,TRUE,Location,2,Great Chicago Weekend Hotel,"Hotel is in a prime location. Nice Lobby. Club Lounge on top floor with Amazing Views of the City, River, and Lake. Easy access to Navy Pier, Magnificent Mile, Millieum Park etc. Would definitely stay again."
11509316,434,CaliK8,3,4,3,4,3,3,3,FALSE,TRUE,4,Southern California,10/2012,10/10/2012,FALSE,The convention center is right outside - very convenient.,4,"Good sleep, below average food","When I was in my room, I was quite happy with this hotel. But when I was hungry - not so much. The restaurant had very limited choices for each meal. And when I ordered something simple for breakfast that wasn't on the menu (4 fried eggs with a croissant), it was not prepared properly. Four days in a row, I ordered a simple breakfast and when it came it wasn't right."
11509330,3205,AlatIIT,4,5,4,5,4,4,3,FALSE,FALSE,1,"Chicago, IL, USA",10/2012,10/10/2012,TRUE,Guests will be charged for any delivery of packages.,3,Great rooms and great service.,"I enjoyed my recent stay at the Belvoir Denver Downtown hotel. This is a great location on the mall and relatively close to the conference center. The rooms were spacious and well equipped. One major complaint was the charge for the handling of packages sent to the hotel. The hotel outsourced the receiving of packages and there was a extreme fee to collect the packages. My attempts to remove these fees only had the hotel push the blame on Pennington. Pennington blamed the hotel. My colleagu, was forced to pay the fee. We work for a university and ship to hotels across the country and have never been charged."
11509361,468,mak1,3,2,2,4,4,,3,FALSE,FALSE,2,,10/2012,10/10/2012,TRUE,Beautiful outside facilities and great food.,,Pool in beautiful,"Pool area is very beautiful, but thought there could be a little better service"
11509374,468,Melcamp,5,5,5,5,5,,3,FALSE,FALSE,2,,9/2012,10/10/2012,TRUE,,2,Dolphin Is The BEST,"The hotel staff was wonderful and very courteous. The room was a good size with great amenities, balcony, and wonderful view. The restaurants were pricey."
11509378,814,Anonymous,5,5,5,5,5,6,6,FALSE,FALSE,2,"Great Mills, 8, Bay, MD 20653, USA",10/2012,10/10/2012,TRUE,Best Service of any Group,2,Great Mini Vacation,Excellent service and rates-Pet friendly!
11509396,3068,Jolietbob,4,5,5,5,3,,5,FALSE,FALSE,3,"Chicago, IL, USA",10/2012,10/10/2012,TRUE,,,October weekend,"Room was well appointed and comfortable. There were a few issues which could have been improved upon, such as a very noisy air condtioning system in the room, poor elevator service to this area, and a non-functioning, untstaffed club room. The restaurant lunch was very good, and the staff extremely helpful."
11509469,1144,Traveler8888888,4,4,5,3,3,,2,FALSE,FALSE,1,,10/2012,10/10/2012,TRUE,The Staff is amazing,,Best Staff Ever,"I have to tell you, the staff was the best I have ever worked with in all my business travel."
11509604,3205,TW34,3,5,5,5,2,,4,FALSE,FALSE,1,New England,9/2012,10/10/2012,FALSE,You charge for WIFI.,,got to work on the WIFI,"I had a comfortable room and the staff could not have been more helpful. I dined in the restaurant and the quality of the food was average and the service was poor. Most of all, though, it's absurd in this day and age to charge for WIFI. The front desk clerk said all the Denver hotels charged, but I know that is not true because a friend who stayed at another hotel did not get charged; so there you go. For this reason, I am not able to recommend you to anyone else nor will I plan to stay with you in the future. The accommodations are first rate and comfortable, but it's ridiculous to charge for WIFI. You need to work on that."
11509775,881,LBeachly,5,4,5,5,5,4,6,FALSE,FALSE,4,"Laguna Beach, CA, USA",10/2012,10/10/2012,TRUE,24 Hour Platinum Lounge Access,4,Nice & Close to PDX!,"....not a lot to say as we were only on site about 5 hours in the wee hours before an early flight! Love, love, love the 24 hours lounge access as a Platinum Member. Rooms adequate, staff friendly, location proximity to PDX, perfect!!! Usually stay at the Aloft, however, it was full and I may have enjoyed this more because of the 24 hour lounge access!!!!"
11509916,3748,Craftyanne,4,5,5,5,4,6,3,FALSE,FALSE,1,"Brooksville, FL, USA",10/2012,10/10/2012,TRUE,,1,A pleasant stay with minor exceptions,"My only complaint was the electric outlet for the TV and coffee pot didn't work, so no TV. Also the tub didn't drain well and kept me awake as the water gurgled out. Other than that, the room was beautiful and very comfortable. Loved the pillows! Would have like a towel rack in the bathroom, still it was nice and roomy."
11510071,3077,lan54,5,5,5,5,5,,5,FALSE,FALSE,3,,10/2012,10/10/2012,TRUE,,,woodbury experience,"ecellent hotel, staff and food..."
11510124,166,jubes,5,5,5,5,4,5,6,FALSE,FALSE,3,pa,10/2012,10/10/2012,TRUE,,2,great weekend stay,"great location, every staff person helpful and friendly, great club level lounge. thank you"
11510208,1113,Smitty242,2,3,3,2,2,,7,FALSE,FALSE,2,,10/2012,10/10/2012,FALSE,The night staff has hardly any Idea what is going on,,Hotel Staff Needs WORK!,"The hotel its self was not to bad, but when we got into the rooms the madness began. The living room floor was SOAKED and we didnt find out until after we unloaded ALL of our stuff. We got moved into another room with NO assistance only to have no sheets on the pull out bed and only one person on staff so no one could bring it up to us. The next day house keeping came in and literally only fixed one bed. The REMOVED THE TOWELS and DID NOT REPLACE THEM! So, as you can imagine we were towel-less and no trash was taken out. Even though things were not going great I still went and asked to extend my stay one night, the ""night manager"" said she cannot see my rate so I would have to pay the rate which is going for that night, I'm fine with that except she LIED because when I checked out my rate was printed on the receipt! Not to mention the hotel has leaking problems in the lobby and Flooding problems in the parking lot, UP TO YOUR KNEES! We could actually see the water bubbling up which means there was a drainage problem. I would NEVER go back, these conditions were way to unsanitary for me."
11510297,868,JSR1220,5,5,5,5,5,,7,FALSE,FALSE,3,,10/2012,10/10/2012,TRUE,,,Great Stay!,The room was clean and the bed comfortable.
11510442,1727,CRBY,1,1,1,1,1,5,3,FALSE,FALSE,1,"Santa Clarita, CA, USA",10/2012,10/10/2012,FALSE,"Horrible,the attitude of some at the front desk and the cleaning staff.",3,this hotel has zero,"our stay was one of the worst one's we have ever had at a Sherton. We got up to no hot water on Sat 10 6 2012, the responce that was given was unacceptable."
11510554,83,Concertgoers,5,5,5,5,5,4,6,FALSE,FALSE,2,"San Diego, CA, USA",10/2012,10/10/2012,TRUE,"Location, Location, Location",4,Great Place to Stay,We were attending a concert at the Hollywood Bowl and this is the perfect location to stay. We jumped on the shuttle and didn't have to worry about parking or traffic it was great! We will stay there again for any upcoming concerts we attend!
11510567,270,Giacomo,2,2,2,2,1,6,3,FALSE,FALSE,2,,10/2012,10/10/2012,FALSE,,2,Gone downhill,"I have stayed at this hotel every two years for a trade show held across the street, was always satisfied, but this time I was not , the hotel is in need of a cleaning, the place looks tired, also very noisy, almost impossible to get to sleep. Will not stay there again if I can help it. To bad as it is right next door to the convention center."
11510727,95,pjm1,5,5,5,5,5,4,7,FALSE,FALSE,2,"Des Moines, IA",10/2012,10/10/2012,TRUE,"Comfy and clean rooms, great bartender",1,Love this place,Rooms are always clean and comfortable. We love the bartender!!!!
11510764,468,Angel12,4,4,5,4,3,2,3,FALSE,FALSE,1,"Chapel Hill, NC, USA",10/2012,10/10/2012,TRUE,Fantastic Staff,1,Fantastic Staff,The staff at The Dolphin Resort are top notch. They went above and beyond for me during my stay there. Absolutely the best hotel/resort staff I've ever met.
11510808,270,Bonzi,4,4,4,3,3,4,3,TRUE,FALSE,3,"AC, NJ",10/2012,10/10/2012,TRUE,Convenient,4,"Nice Hotel, but...","Nice hotel, nice lobby, convenient to convention center, train and AC sights. Awesome water pressure in the shower."
11510821,3676,Mary99999,5,5,5,5,5,4,6,FALSE,FALSE,2,"Red Bank, NJ, USA",10/2012,10/10/2012,FALSE,Deluxe Suite great value for the money.,1,Very satisfied,We were exremely satisfied with our stay & the hotel. We used the pool and the gym while there and were very happy with those facilities as well. We will be staying there again next year!
11510980,1162,Path,5,4,5,4,5,3,6,TRUE,FALSE,2,"Mooresville, NC, USA",9/2012,10/10/2012,TRUE,"Location, comfort, ambiance",2,Comfortable Stay near to Disney,We stayed for three nights at Belvoir Buena Vista on our daughters birthday treat in Disney. The hotel is very close to Disney and lots of restaurant option nearby. The hotel seems to be newly renovated and it looks great. We really enjoyed the pool and the ambiance inside the hotel. They have hot breakfast with lots of options. The room was spacious with comfortable bed. Internet wifi was free and $10 parking per night was among the lowest I have seen as compare to some of the other hotels.
11511122,434,Rufe,3,2,5,3,3,,6,FALSE,FALSE,2,"Hickory, NC",10/2012,10/10/2012,FALSE,Great Location and Staff,2,Room Problems,"The staff was excellent however, I would not recommend this hotel because the bed was average(very saggy), the sink was stopped up and fixed after I called (when I first called the person said ""hasn't it been fixed"") and the shower had mildew/mold in the corner."
11511138,1162,Gwen2012,5,5,5,4,4,4,3,TRUE,FALSE,3,"Kansas City, MO, USA",10/2012,10/10/2012,TRUE,The staff work very hard to accommodate their guest.,4,This hotel has is in a great location,The staff go out of their way to meet the needs of their guest.
11511217,693,hector86,2,3,2,1,3,2,8,TRUE,FALSE,1,"Sandusky, OH, USA",9/2012,10/10/2012,FALSE,,3,Bad experience,"Hi,"
11511242,1130,LCW3881,5,5,4,4,4,2,3,FALSE,FALSE,2,"Sacramento, CA, USA",10/2012,10/10/2012,TRUE,Try the french toast from the resturant. Very very excellent.,1,This hotel was very nice,I stayed at the Belvoir Columbia Town Center for four days last week. This is a very nice hotel. I was able to connect to the internet in my room and get some work done and the facilities for the conference I was attending were very nice and close to my room. Housekeeping did a very good job before noon. The lobby staff was very professional and allowed me to hang out in the lobby for two hours while waiting for my shuttle to the airport.
11511248,1556,Suzie73,5,5,5,5,5,6,6,FALSE,FALSE,1,"Orange County, CA",10/2012,10/10/2012,TRUE,Close to Qualcom stadium,2,This hotel met my needs.,"This hotel is clean, great service, near to shopping centers and Qualcom stadium."
11511254,321,TechTraveler,4,5,5,5,5,3,6,FALSE,FALSE,4,"Bay Area, CA",10/2012,10/10/2012,TRUE,Don't miss the rooftop pool!,2,"Great property, great value","I've stayed at this property a number of times now, and always been please with the facilities and the service. It's a great location adjacent to shopping and amenities, with spotless, comfortable rooms, a lovely rooftop pool and workout facility. They were in the middle of a major program to renovate windows when I was there, so I was glad to see them continuing to invest in the property!"
