reviewID,hotelid,userName,overall,roomComfort,staffMetNeeds,cleanRoom,facilitiesMetExpectations,ageRangeID,tripPurposeID,travelAgent,meetingPlanner,BPGStatusID,guestFrom,arrivalMonth,datePosted,recommend,everyoneShouldKnow,frequencyID,title,comment
11634470,430,mrslj,5,5,5,5,5,,6,TRUE,TRUE,4,oklahoma,10/2012,10/17/2012,TRUE,"location, location, location",4,this hotel is perfect,"this was just perfect - everything from the room with a river view to the side bar dining, to the lobby - just perfect"
11634646,802,Docpeter,5,5,5,5,5,4,6,FALSE,FALSE,4,"Los Angeles, CA, USA",10/2012,10/17/2012,TRUE,,2,I enjoyed my stay,The rooms are comfortable. The restaurant is good and the creek and falls view were beautiful
11634835,3207,DDD3,5,5,5,5,5,2,2,TRUE,FALSE,1,"Dallas, TX, USA",10/2012,10/17/2012,TRUE,Clean and Friendly staff,3,DOC D,"it was great, room was very nice and clean."
11634923,713,Theory,5,5,5,5,5,6,7,FALSE,FALSE,2,"Fargo, ND, USA",10/2012,10/17/2012,TRUE,Made us feel at home.,2,Most comfortable beds!,My wife and I both thought that the Belvoir was one of the most comfortable hotels we've stayed in. The staff was accommodating and the extras like cookies upon return from the Fiesta made the stay much more memorable.
11635702,1282,LadyDi73,5,5,5,5,5,6,6,FALSE,FALSE,2,"Illinois, USA",10/2012,10/17/2012,TRUE,"We have also stayed at different times such as September, February, August, etc. We always stay on the 2nd floor by the pool because of the table and chairs and the patio that overlooks below.",3,Location to college.,This was about our 10th stay at your hotel in Iowa City due to grandchildren attending University of Iowa. We have never had a bad experience only great ones. We would definitely recommend your hotel.
11636436,421,Gaut,5,5,5,5,5,2,2,FALSE,FALSE,4,"New Jersey, USA",10/2012,10/17/2012,TRUE,,2,The location is excellent,Great hotel right in the heart of the city. Close to just about everything and my office.
11639114,33,Lpalm44,3,5,3,4,3,6,5,FALSE,FALSE,3,"Baltimore, MD, USA",10/2012,10/17/2012,TRUE,It has a good location,1,Service & Cleanliness,Brian front desk supervisor did an excellant job. Resturant was poorly staffed and slow needs a good manager. Room was very clean except for carpeting. Bar area fountain was discusting but service there was excellent. All and all a good experience that could be made better by management.
11641469,1798,kelhalmom,5,5,4,5,5,2,6,FALSE,FALSE,2,"Daphne, AL, USA",10/2012,10/17/2012,TRUE,Great Stay!,2,Wonderful stay,"We booked the park and cruise package so we could leave our car here while we were on a 7 day cruise. It was WELL worth the money. We had a club level room and enjoyed the free drinks and snacks. The room was very nice and the staff were friendly. The only negative that I can say is we asked the night before we left about a shuttle and the girl at the front desk called for us. She then called me and told me for my family of 4 it would be $40 each way. I told her to cancel and I would get a taxi. They were $35 each way. The next morning the taxi AND the shuttle was there. She had not called to cancel, and worse... it was $40 round trip. My return taxi was $30 so this could have saved me money. That was frustrating but we still enjoyed our stay and would not hesitate to stay again."
11641492,13,Barbee,5,5,5,5,5,,3,FALSE,FALSE,1,,10/2012,10/17/2012,TRUE,,,International mason,Every thing was very good.
11641582,2017,su50,4,4,4,5,4,5,6,FALSE,FALSE,3,"Suffolk, NY",10/2012,10/17/2012,TRUE,"Clean, polite employees.",2,Room conditions,"We stayed at the hotel from Fri. 10/12/12 to Sun. 10/14/12. The bath drain was slow our first night and I notified the desk the next day. No one responded, and bythe time we left on Sun.the water was left standing in the tub."
11641698,468,MYD73,2,4,2,4,3,3,7,FALSE,FALSE,1,"Florida, USA",10/2012,10/17/2012,FALSE,Double check your bill before checking out.,4,No AAA discount,I booked a AAA discounted rate which included breakfast and later was told that they didn't offer that special there. The reservation rep i spoke to told me they did but they never agreed on it and I was stuck paying for the 45. dollar breakfast bill.
11641772,814,Stephanie39,5,,,,,3,6,TRUE,FALSE,4,"North Carolina, USA",10/2012,10/17/2012,TRUE,"They are pet friendly and upscale. It's not a dump that allow you to bring your pet and then charge a fee. I think signing a waiver is sufficient. I'm sure bad experiences caused other hotels to charge a fee. But, you do have pet owners that are clean, and clean up after their pet.",4,Love the fact that its pet friendly,"Our stay was fantastic! I never seen so many pets in a hotel. The hotel was very clean, and upscale. The customer service was outstanding. Plus they didn't charge an extra fee for your family (pet). I can't wait to go back."
11641814,992,Spencer23,5,4,5,5,5,4,6,FALSE,FALSE,2,"Central, New Jersey",10/2012,10/17/2012,TRUE,,2,This hotel great locatation,Hotel is a great location for visiting Penn and Drexel.
11641826,196,an76,5,5,5,5,5,3,3,FALSE,FALSE,2,"New York, NY, USA",10/2012,10/17/2012,TRUE,Location,3,Conference Center,"Came here for a conference. Great location. Close to all the restaurants, navy pier, in Downtown. Courteous staff."
11642013,1774,rwaynew,5,5,5,5,5,4,7,FALSE,FALSE,2,"Minneapolis, MN, USA",10/2012,10/17/2012,TRUE,great retro/modern bathroom,4,Best in town,"My third stay here... terrific tiled retro-modern bath and comfiest bed. Very consistent service. Great location close to things, and away from the riff-raff. Veiws of the harbor and a short walk to Canal Park. Nicely-equipped Club lounge."
11642075,196,Safi,5,5,5,5,5,5,3,FALSE,FALSE,3,"Sylvania, OH, USA",10/2012,10/17/2012,TRUE,"Great location, excellent services and courteous staff",4,Excellent hotel,"The front desk staff are prompt, courteous and helpful. They offered me options of upgrades, and anytime I have a request they accomplished it in a timely manner. This is my 2nd stay in that hotel within a 40 days period, and I am going back"
11642085,196,MNcentral,5,5,5,5,4,5,3,FALSE,FALSE,1,"Minnesota, USA",10/2012,10/17/2012,TRUE,"Excellent location, clean and comfortable rooms, quality service",1,Fitness Center limitations,"The Fitness Center is great and popular for vigorous physical exercise, but is a single room and very noisy. I was not aware of any accommodation or optimal location for yoga or meditative, relaxing exercise."
11642452,460,DrMags,3,3,1,5,5,2,3,FALSE,FALSE,2,"Seattle, WA, USA",10/2012,10/17/2012,FALSE,Unaccommodating with reasonable requests,4,Unaccomodating,"I went for a conference as a funded guest. I had a video chat meeting requirement for one hour in the morning (9-10) and I couldn't be in the lobby of the hotel, and the rest of the entire day (until midnight that night) I would be at the convention center. I have over 27,000 BPG points and am 10 stays away from gold membership (of 25). I feel like an hour of complementary internet is not a huge request. However, that is not what I am venting about, it was that the manager said it was not possible to apply complementary service in the room. As a computer scientist, as a guest in other Belvoirs, I know that it IS possible. The inaccurate information given by the manager was frustrating. I did change hotel rooms the next day. And I would advise you to look around just a little bit more to find a more suitable hotel."
11642548,379,Princessgrace,3,3,3,2,3,3,8,FALSE,FALSE,2,"California, USA",9/2012,10/17/2012,FALSE,Don't stay in the back side of this hotel!,3,Disappointed,First time in Kauai. Stayed at the Belvoir for the first time. The front part of the hotel is nice and remodeled but....the back part of the hotel was a different story!
11642637,760,Joeker4,4,1,4,4,3,4,6,FALSE,FALSE,3,"Bay Area, CA, USA",10/2012,10/17/2012,FALSE,,3,Furniture,The hotel grounds were nice. Staff very friendly. The furniture in the room was uncomfortable. The cushions on the sofa were ripped and zippers were broken
11642638,139,Gravedigger,5,4,5,5,5,4,7,FALSE,FALSE,4,"Billings, Mt, USA",10/2012,10/17/2012,TRUE,Its comfortable!,3,Great Stay!,We had a great stay at the Tech Center Belvoir! They have a brand new Starbucks! Easy access to Tran Tech Center.
11642673,3079,Austonian,5,5,5,5,5,3,6,FALSE,FALSE,4,"Austin, TX, USA",1/2012,10/17/2012,TRUE,,4,Good Value in Downtown Austin,"This is a great hotel located right in the middle of all the action in downtown Austin. The property is updated and has a great lobby with a cool, popular bar that gives a good vibe to this hotel right when you walk through the front doors. Youre within walking distance to nightlife (6th Street is about 5 blocks away), and youre also close enough to walk to the University if youre in town for a game or to visit friends and family that are going to UT."
11642693,430,Eileen44,5,5,5,5,5,3,2,FALSE,FALSE,2,"New York, NY, USA",10/2012,10/17/2012,TRUE,Great Staff,1,So Friendly,What a great Hotel. The staff was the best I've seen right from the beginning. From the valet to the front desk to the service man who came to fix my TV. This was my first time visiting Boston and won't stay anyplace else when visiting again.
11642694,111,vrj7,3,3,3,3,4,,6,FALSE,FALSE,2,ga,10/2012,10/17/2012,TRUE,great pool,,great pool,"the pool temperature was perfect, each morning at pool we were greeted by a nice gentleman from enginneering in charge of pool. always made it perfect for us."
11642724,760,NeverDissatisfiedBefore,2,4,1,3,2,4,6,TRUE,FALSE,3,"Phoenix, AZ, USA",10/2012,10/17/2012,FALSE,"The staff, from top to bottom, not seeming to care or take pride in property and guests.",4,Needs Good Leadership,"There seems to be an systemic issue starting at the top in this location. The attitiude, attentiveness, and overall pride is lacking."
11642778,3205,cori,4,4,5,4,4,3,3,TRUE,TRUE,4,"Dallas, TX, USA",10/2012,10/17/2012,TRUE,Great location!,2,Fun in Denver,"Whether sunny summer or frigid winter, the staff at the Belvoir denver downtown will warm your heart with excellent service and a great drink in Mix by Kim. My first gustroom had a broken heater, so I was promptly moved to another room, which was wonderful! The staff was very helpful and the hotel is in a great location for the 16th street mall and green space."
11642789,1552,RHON58,1,3,1,2,1,5,6,TRUE,TRUE,3,"California, USA",10/2012,10/17/2012,FALSE,DON'T EXPECT SATISFACTION IF YOU HAVE A PROBLEM,2,IT WAS BAD ALL AROUND,ROOMS GIVEN AWAY EVEN AFTER CREDIT CARD GIVEN AND CHECKED IN BY LOUIS. MOVED TO NEW ROOM 12:30 AT NIGHT. BREAKFAST OFFERED BUT NOT ENOUGH FOR EVERYONE. SHOWER DRAIN DID NOT WORK SHOWERED IN WATER TO ANKLES. GIVEN 3000 POINTS TO MAKE UP FOR ALL PROBLEMS WHEN A FREE ROOM IS 7000 POINTS
11642898,1137,Rubinkv,5,5,5,5,5,2,5,FALSE,FALSE,1,"Edison, NJ, USA",10/2012,10/17/2012,TRUE,,1,the little things,We loved how the room provided complimentary bottles of water.
11642999,606,KathyM,4,5,5,5,5,5,6,FALSE,FALSE,2,"Boston, MA, USA",10/2012,10/17/2012,TRUE,Huge but very comfortable - like being outside but you are indoors!,2,Fantastic Stay!,"I reserved 2 rooms on the Club Level, we were celebrating my 40th high school reunion, my daughter's 32nd birthday and my 2 grandaughters 1st trip to Vermont. The rooms were outstanding - connecting rooms (king bed for me, 2 double beds for the girls). Most comfortable beds and bedding. The maids kept us supplied with towels galore!"
11643255,468,Tricia71,3,3,4,2,4,3,6,FALSE,FALSE,1,"Melbourne, FL",10/2013,10/17/2012,FALSE,Rooms need an update.,2,Mixed review,My husband and I stayed at the hotel so we would not have to drive home after the food and wine festival. The hotel had a very nice pool area and lobby. I thought the rooms were a little dirty and very outdated. The staff was very nice and helpful. I would only stay here again if they renovated the rooms and improved on house keeping.
11643287,196,Deide30,4,4,4,4,4,3,5,FALSE,FALSE,2,"Chicago, IL, USA",9/2012,10/17/2012,TRUE,,1,"Accommodated well, but no follow thru with security","Our stay for my stepson's wedding was quite an experience. The hotel was beautiful and the accommodations were finally met after sometime for waiting for a room after requesting early check-in. I wouldn't have cared so much about this if we didn't have the wedding to worry about. Not having a room until after 2:00 with the wedding at 4:30 was a huge issue for my husband and my family. But our stay ended up being very comfortable and wonderful in the end... until I called security the next day to ask about my 12 yr. old's missing ring that was acidentally left in the room, and they were very nice about it and said they would look into it immediately...never heard back from them!!! That part makes me mad. I was hoping for someone to follow through with that and I received no call back even."
11643299,468,LearningFun,4,4,5,5,4,3,3,FALSE,FALSE,2,"Seattle, WA",10/2012,10/17/2012,TRUE,,4,Nice stay,"This hotel was nice, met my needs and was clean."
11643371,713,Janice88,5,,,,,,6,TRUE,FALSE,4,Virginia,10/2012,10/17/2012,FALSE,"Rooms were spacious, clean and modern. Staff was wonderful",,Wonderful hotel!,We had to make last minute reservations as this hotel due to a family illness and the rooms and the hotel was surprisingly warm and welcome despite a hot air ballon fiesta and the hotel seemed full. Will definitely stay at this hotel again--all areas were flawless in their service!
11643438,380,Melissa622,4,4,5,4,4,3,7,FALSE,TRUE,2,"St. Louis, MO",10/2012,10/17/2012,TRUE,Very convenient to beach and shopping.,3,Hawaii trip,"The air conditioning in the room needs major improvement. Low setting hardly works; and high setting is more like low. Bathroom fixtures could use some updating. All in all, it wad adequate as all we really needed to do was sleep & shower. The property in general, could use some updating. James in Security was a huge help to me when I had my ID and debit card stolen from the beach. He was great to work with and you should be proud to have someone on staff who genuinely cares unlike the police department. I only ate one meal at the hotel - continental breakfast and it was ok. My biggest complaint with that experience was the language barrier with the waitress. English needs to improve drastically."
11643488,468,kabc143,5,5,4,4,4,4,1,TRUE,TRUE,2,"Manhattan, New York, NY, USA",10/2012,10/17/2012,TRUE,Food and beverage is superior,3,Hotel has great location and amenities,Superior food and beverage product
11643881,1506,Amity,5,5,5,5,5,6,6,FALSE,FALSE,3,"Whidbey Island, WA",10/2012,10/17/2012,TRUE,Outstanding staff and friendly service,3,Repeat visitor,"Several times a year I find it necessary to spend a night or more, often with family, when visiting from my Whidbey Island home. Staff is always friendly and professional and I feel like an honored guest. Parking, restaurat, and a shuttle to nearby shopping are all just outside the door!"
11643923,942,RRDH,5,4,4,5,5,2,5,FALSE,FALSE,2,"Elon, NC, USA",10/2012,10/17/2012,TRUE,,3,Beautiful Lobby,"We traveled during a big race weekend to Charlotte. We always have trouble finding decent rooms with low rates, but were pleasantly surprised with this hotel. Will definitely use again."
11643944,1162,KE45,4,5,5,4,4,2,8,FALSE,FALSE,2,"Warner Robins, GA, USA",10/2012,10/17/2012,TRUE,"Very comfortable hotel, but inconvenient shuttle service to parks",4,"Wonderful room, unsatisfactory Disney shuttle","Everything about this hotel was wonderful except for the shuttle service to the Disney parks. The shuttle had inconvenient, erratic pick-up and drop-off times and sometimes the last pick-up at the parks was well before they even closed. The buses were dirty and extremely overcrowded (many times there was standing room only). If Belvoir could get the official Disney shuttle service or another service that is more frequent and better quality, I would have no reservations recommending this hotel."
11643991,3125,Just5Boys,5,5,5,4,5,,5,FALSE,FALSE,3,,10/2012,10/17/2012,TRUE,Great Service!,,Great Customer Service!,"We love staying at the Belvoir Albuquerque Airport Hotel! During this stay, we were upgraded to receive access to the club floor even though there were no more rooms available on that floor. This means we were able to enjoy the evening tapas as well as the hot specialty breakfast. We are always taken care of by Nancy in the club floor lounge. She does a super job keeping the food well stocked and everything looking clean and tidy! Thanks John L. for the upgrade!"
11644522,3068,Hokiehal,5,5,5,5,5,5,6,FALSE,TRUE,2,"Richmond, VA, USA",10/2012,10/17/2012,TRUE,Awesome location!,2,"The ""Other"" Star in the Roanoke Valley!","My wife and I have stayed at the Belvoir Roanoke several times now, and each time we were delighted with the accommodations, the service and the beauty of the hotel's surrounding campus. As BPG members, we always look forward to coming back to spend a special night in Roanoke's ""other"" Star!"
11644549,196,DennisJ,5,5,5,5,5,3,8,FALSE,FALSE,1,"Iowa, USA",10/2012,10/17/2012,TRUE,The service is fantastic.,3,Great weekend,My wife and I stayed for the weekend. The room was excellent and had a great view of the river and lake. The staff and general manager gave us great service and made us feel very welcome. I will stay here again because of the fantastic service.
11644722,1291,Austonian,5,5,5,5,5,3,7,FALSE,FALSE,4,"Austin, TX, USA",9/2012,10/17/2012,TRUE,,4,Outstanding Historic Hotel Near Alamo,"This is currently my favorite hotel in Texas for a number of reasonsbut primarily because of the superb job the Belvoir has done in honoring the history of this century-old building and retaining the old world charm. I was upgraded to the Governors Suite, which Ill admit was very kind of the hotel, but the other rooms are equally as nice. The Governors Suite was large and spacious. I especially liked the heavy wooden shutters that you could open in the mornings and close in the evenings. While sitting in the lobby, it felt like you were in the early 1900swith all the hard wood, marble floors and antique chandeliers. The Alamo is only about a 5 minute walk from the hotel, and the River Walk is equally as close."
11644851,1784,DCL123,5,5,5,5,5,3,2,TRUE,FALSE,3,,10/2012,10/17/2012,TRUE,Helpful staff,3,Great hotel! Helpful staff.,Staff was helpful and friendly. Rooms were spacious and clean.
11644863,421,sea2012,2,2,2,2,2,3,3,FALSE,TRUE,3,"Arlington, VA",10/2012,10/17/2012,FALSE,,,am i the only one,"I must be the only person that would never stay here again if I could help it. If it weren't for the mandatory stay at the property because of business, I would not have come back after the last stay in 2009. I don't think the food is good, you can hear every sound through the walls and windows, the staff aren't particularly friendly. When I tried to check in hours after the posted check-in time and no room was ready, the response was lackluster. But at 11:20am on check-out day, I'm darn near being escorted out of my room. I hope that means someone was able to check-in to the room I was staying in on time."
11644936,1725,Lamar,5,5,5,5,5,6,4,FALSE,TRUE,4,"Orlando, FL, USA",10/2012,10/17/2012,TRUE,"Very, very professional staff.",3,Perfect Place To Stay,This hotel is the perfect place to stay. Convenient location and very professional staff. You won't go wrong staying at this hotel.
11644970,421,Bobby7,5,5,5,5,5,6,6,FALSE,FALSE,3,NY,10/2012,10/17/2012,TRUE,Location,2,Nice weekend,Great location for shows and restaurants
11645035,127,TiaTravels,5,5,5,5,5,3,6,FALSE,FALSE,2,"California, USA",10/2012,10/17/2012,TRUE,It is truly right at the marina!,4,Great Views,"I love, love, love this hotel. I was a bit anxious before arriving as I had read a couple of reviews that were not very nice. I did take on person's advice and book a room in the marina tower. From the parking lot to lobby to the lounge to the views when exiting the elevator--BEAUTIFUL!!!! I was inspired!"
11645339,1506,kaquino,3,5,4,5,4,3,7,TRUE,TRUE,2,"Ocean Shores, WA, USA",10/2012,10/17/2012,FALSE,"The beds are comfy and if you have any issues, contact Ginger at the front desk.",3,Cozy room and the bed was comfy..,"I would first like to say that the Ginger at the front desk was awesome! I had to call several times before I got to town and Ginger accommodated all our needs and was extra helpful and courteous. She went above and beyond to assist us with our needs. However, the morning of our check-out, housekeeping came knocking at our door at 9:45am, before we could answer the door, the male housekeeper had the door open and was standing there looking at us. Just out of the shower and not fully dressed. Check out time is at 12:00 noon and I dont think housekeeping should be knocking on doors and intruding on guests before then. Prior to this we could hear them knocking on other guests doors and talking loudly in the hall, as we were trying to sleep. We finally decided that sleeping in was not an option. We were on the 6th floor, club level and you think they would have been more courteous. We felt like the whole floor was being kicked out as they were knocking on all the doors and opening them, hours before check out. Other than that, our stay was great and the room was very cozy. The front desk staff was great!"
11645404,3205,steveryan1000,4,4,3,5,5,2,2,FALSE,FALSE,2,Virginia,10/2012,10/17/2012,TRUE,Location Location Location,3,Weekend in downtown Denver,"Could not be a more perfect location for a visit to downtown Denver. Hotel rooms are extremely clean and comfortable for such a massive hotel. Staff are pleasant, and the facilities are very good. Minor disappointment was the broken tv in my room and the failure to deliver on bonus Grandbourne points. Overall excellent choice if you are visiting Denver."
11645450,115,NewBPGmemberdisappointed,2,2,2,2,2,,4,FALSE,FALSE,2,SC,10/212,10/17/2012,FALSE,,4,Very disappointed,"I have to say I was disappointed at my first stay with one of the BPG properties, Belvoir Birmingham AL (10/15)."
11645464,914,hsirt,5,5,5,5,5,5,7,FALSE,FALSE,1,"Tampa, FL, USA",10/2012,10/17/2012,TRUE,"expensive but resort style, clean and very accommodating staff",2,Friendly Staff,"I found the staff very friendly and the accommodations very clean, neat nice and well appointed. If anything was not perfect I would have to say the value of the food /price. I had a grouper sandwich that I did not enjoy at all and it was $17."
11645711,1236,Satisfied01,5,5,5,5,5,,2,FALSE,FALSE,2,,10/2012,10/17/2012,TRUE,,,Excellent check-in hospitality,"Was approached while waiting for check-in and provided information as to dinner establishments, direction to the stadium and all done in a very friendly and professional manner. MG is to be commended for her efforts."
11645815,3576,cathy549,5,5,5,5,5,5,3,FALSE,FALSE,2,"Orlando, Florida",10/2012,10/17/2012,TRUE,Excellent Staff,4,Excellent Hotel,"The accomodations were great, the staff was one of the nicest, most helpful staff we've ever come across. Everyone was exceptional."
11646491,1727,Mondo40,1,2,1,4,1,,6,FALSE,FALSE,3,"Boston, MA, USA",10/2012,10/17/2012,FALSE,Its disarray.Manager nice but........,4,Needs better organization,"1)Registration man (Bellman) disorganized,confused and lacked information. It took half hour to register"
11646605,664,TheHoneymooners,5,4,5,5,5,4,8,FALSE,FALSE,2,"Jupiter, FL, USA",10/2012,10/17/2012,TRUE,Steps to pool and beach.,2,Great Value,"If you compare this hotel to many others in this area or Miami, you could not get nearly the value of such a clean and friendly staffed place. It may not be the ""fanciest"" appearance in comparison to some others, but the food, drink and rooms are stellar and the staff are some of the most dedicated and friendliest we've met!"
11646980,741,Traveler102012,2,3,2,1,2,3,2,FALSE,FALSE,2,"Salt Lake City, UT, USA",10/2012,10/17/2012,FALSE,Old facility and bad service.,4,Not recommended.,"The room rate is for 3 or 4 stars hotel, but the facility is old, and service was bad."
11647023,3054,Kels1519,4,4,3,4,4,2,5,FALSE,FALSE,1,"Fishers, Indiana",10/2012,10/17/2012,TRUE,Parking is not included and rather pricey.,2,Good Stay,"Overall my stay was great. Staff was friendly. Room was very nice. Great location. The only small issue was that the staff was a bit unclear about payment and checkout. Most hotels I have stayed in have room checkout whether on the TV, phone or internet. I had no clue what to do about checkout. Then at checkout at the front desk the girl was still unclear on what was happening-whether they were charging my card on file or I could give a different one. Then she didnt even offer a receipt."
11647134,2019,diana592,3,3,2,5,3,4,5,FALSE,FALSE,2,"Novi, MI, USA",10/2012,10/17/2012,TRUE,"we ate the second shift, every time we went for a meal, the food was gone, we had to tell the waitresses to fill the food. The food / beverage was terrible this time.",2,hotel review,"I booked 2 king size rooms, i received 2 queen rooms. I checked in at 3:00. I asked the clerk to give me someone else's king that haven't checked in yet and he said there were no more kings available in the hotel.The clerk said he couldn't do anything to compensate me. I know of at least 2 people that booked their reservation and checked in after me that received king beds, so the clerk lied to me. Our scrapbook leader said I should go back and complain and I should be compensated, so I did go back and complain to a woman clerk, and she compensated me with wine and cheese and crackers and strawberries. But before she compensated me she went to my scrapbook leader and asked her if she should compensate me.I was not happy to hear that from my scrapbook leader."
