reviewID,hotelid,userName,overall,roomComfort,staffMetNeeds,cleanRoom,facilitiesMetExpectations,ageRangeID,tripPurposeID,travelAgent,meetingPlanner,BPGStatusID,guestFrom,arrivalMonth,datePosted,recommend,everyoneShouldKnow,frequencyID,title,comment
11931779,1364,Barb56,4,5,4,5,3,5,5,FALSE,FALSE,1,"St Louis, MO, USA",10/2012,10/24/2012,TRUE,You charge an additional fee for WiFi when motels hotels offer it free.,2,Internet,I was disappointed that you charged an additional fee to use your wifi internet service. Wanted to sit in the comfort of my room and search for nearby restaurants.
11931849,1047,Jimmy1250,5,5,5,5,5,3,6,FALSE,FALSE,1,Upstate New York,10/2012,10/24/2012,TRUE,,3,Awesome hotel,The hotel was really nice. the lobby and dining/ lounge area were very elegant. The suite was more than adequate in comfort and size. The staff was excellent. This was a great option to stay the night and fly out the next mornibg early. They provide a shuttle and the option to let you park your car there while you're gone.
11932083,1236,Hsk12,1,3,3,2,3,,7,FALSE,FALSE,1,,10/2012,10/24/2012,FALSE,,,Overall unimpressed,"I did not enjoy my stay at the Belvoir and continue to find some of your services/staff extremely unhelpful. Specifically, it was very inconvenient that we could not get an update on when our room would be ready over the phone. Instead, I was told I had to inquire in-person. As someone traveling from another state, this was very inconvenient. Our room had a large wet spot on the floor and a distinct odor. When we reported it, we were helped by an extremely nice maintenance man and I give him high remarks. The other major disappointment with this stay was that my debit card was charged for the incidentals fee after I was told only my credit card would be charged. At this point, I have left two messages for someone at the hotel and have yet to have my call returned. This is an issue with my bank account and I find it extremely rude that my call has not been returned nor has the charge been reversed on my card. This is enough to deter me from staying at any Belvoir in the future."
11932203,832,Sharon831,5,5,5,5,5,4,6,FALSE,FALSE,1,"Bristol, VA",10/2012,10/24/2012,TRUE,"Very nice hotel, very friendly and helpful staff. When our room was serviced in the late afternoon it was obvious that ""someone"" had rifled through my cosmetic bags in the bathroom. I reported this to the front desk and it was relayed to the housekeeping supervisor, however, I have not been contacted by anyone from the Belvoir. I felt very violated and disappointed that I have not been contacted by a supervisor with an apology at the very least.",2,Very nice hotel,"Nice hotel, but follow through with a complaint to the front desk was not to my satisfaction."
11932211,1266,Jane23,5,5,3,5,5,5,7,FALSE,FALSE,2,"Annapolis, MD",10/2012,10/24/2012,TRUE,Great Location to Restaurants and Shopping,4,This hotel is conveniently located,Surrounded by multiple restaurants as well as shopping mall
11932216,83,OctUSC,5,5,5,5,5,4,6,FALSE,FALSE,2,"New York, NY, USA",10/2012,10/24/2012,TRUE,The hotel is on the gounds of Universal Studios.,2,This is a GREAT Hotel,My family and I had a great stay in this Hotel. Everything was A #1. I would recommend it to anyone staying in the LA Area.
11932267,2003,bskinkle,1,1,1,3,1,,5,FALSE,FALSE,2,,10/2012,10/24/2012,FALSE,,,stay elsewhere,Lousy experience - room next to the elevator. Unhelpful staff. Double charges for services that were difficult to have removed. ZERO acknowledgement of BPG status.
11932308,3054,purplegirl345,2,3,2,2,3,2,5,FALSE,FALSE,2,"Lynchburg, VA, USA",10/2011,10/24/2012,FALSE,The parking is expensive,2,Disappointing Stay,"I had a 5 day stay at this hotel for my sister's wedding and was very disappointed. The room was not well cleaned, the furniture was worn, and the carpet in my room was stained. The service at the hotel was really sub-par, we had to ask repeatedly for a crib the evening we checked in so our toddler could go to bed. The staff was not very responsive to our request of additional crib sheet, and notifying us when our new room was ready. The checkout process was a mess, I had to spend additional time on the phone getting my bill corrected after we left the hotel. The location is great, being right on the circle, but the hotel need some improvements"
11932310,468,Phine,5,5,5,5,5,5,3,FALSE,FALSE,2,"Charleston, WV",10/2012,10/24/2012,TRUE,It is very accesible to all the Disney parks,2,This hotel has great amenities,I enjoyed my stay at the Dolphin hotel. The service was great and the food in the restaurants was excellent.I would recommend this facility to any -one coming to Disney.
11932311,421,Ryna,5,5,5,5,5,2,5,FALSE,FALSE,2,,10/2012,10/24/2012,TRUE,,3,"Wonderful hotel, great staff","Just an awesome experience! I was in New York for an event and the location was great. The lady at the FD that checked me in was absolutelly great and very welcoming, sorry dont remember her name but if it is possible please tell her that me and my friend both appreciate her great attitude and a pleasant customer service. The room was clean, good size and with a nice NY view. I will definitelly recommend this hotel. Unfortunatelly we did not have time to try the restaurant, but will do the next time I stay there."
11932348,33,Nichole41,5,5,5,5,4,3,5,FALSE,TRUE,2,"Baltimore, MD, USA",10/2012,10/24/2012,TRUE,,2,This hotel is beautiful,I stayed at this hotel for a wedding and the staff was very friendly and helpful. Will definitely stay here again.
11932365,3052,MaryEllen,5,,,,,5,6,FALSE,FALSE,1,"New York, NY, USA",10/2012,10/24/2012,TRUE,Staff is great & hotel is clean.,1,Great Hotel,The staff was always pleasant - greeted you with a smile & extremely helpful. It was very clean & secure. Wish price was a bit lower but I guess that's NYC. The price was lower than others for what we wanted. Plus very near our son.
11932383,468,Whatever20121234,2,4,1,4,4,4,3,FALSE,FALSE,4,ATL,10/2012,10/24/2012,TRUE,,4,Review,I have a major issue with Shulas and how my wife and I were treated. I have disputed the charge and may not stay in your hotel again due to that issue and no follow-up with us from the hotel manager. Overall this was very poorly managed.
11932433,1236,Designdiva1,5,,,,,5,8,FALSE,FALSE,2,"Atlanta, GA, USA",10/2012,10/24/2012,FALSE,Its a great place to stay within walking distance of everything.,,Great stay in Nashville,"I really enjoyed my overnight stay in Nashville and the Belvoir had a lot to do with it. I so enjoyed the room decor, the lobby and the view of Nashville at night from my window.. Most importantly the mattress and pillow allowed me to have a good nights rest. The location was perfect, once we parked our cars we were able to enjoy the city attractions on foot."
11932582,865,tmc210,4,4,4,4,4,3,5,FALSE,FALSE,2,"Parsippany, Parsippany-Troy Hills, NJ 07054, USA",10/2012,10/24/2012,TRUE,Great outdoor walking/running path through picturesque setting.,1,Pet Fees,"Although pet friendly and I was staying there during a dog competition, I was at no time during the reservation process or my stay notified of pet fees. I had no problem with the nominal cleaning fee ($25) that was charged but thought it odd that no one advised me."
11932622,1324,strider,5,5,5,5,5,6,6,FALSE,FALSE,1,"Orleans, Barton, VT 05860, USA",10/2012,10/24/2012,TRUE,Great Staff and management.,1,Convenience and location,"I generally do not review my stay, however, this establishment had everything I needed and wanted for my stay. The staff was exceptional. I have stayed at Belvoirs before and they did not come close to this level of hospitality and service. Will stay with you again in the future."
11932782,96,Shon247365,5,5,5,5,5,3,6,FALSE,FALSE,1,"Edinburg, TX, USA",10/2012,10/24/2012,TRUE,"Comfortable, cean rooms with frendly staff in a great location.",2,Excellent Hotel!,"This is a great hotel whether your there on business or with the family. Friendly staff, clean rooms and an excellent location."
11932936,1400,Okie12,4,4,5,4,4,4,5,FALSE,FALSE,1,"Oklahoma, USA",10/2012,10/24/2012,TRUE,Great service and facilities.,2,The Staff is exceptional!,We had 30 rooms book for people attending my daughters wedding. The staff went above and beyond in taking care of not only us but all of our guest that stayed at the hotel.
11933277,3205,Akr1sh,3,4,4,2,4,,7,FALSE,FALSE,2,"New York, NY",10/2012,10/24/2012,FALSE,Expect to do a lot of walking to get around wtihin the hotel.,,Fine Stay,Had a decent stay. Rooms are nice w/good beds & TV's. Location is good. Issues:
11933346,196,JeffP,4,3,4,4,4,5,8,FALSE,FALSE,3,"St Louis, MO, USA",10/2012,10/24/2012,TRUE,Great location near the Navy Pier and Michigan Ave.,4,Nice visit,"Great hotel in a great location! The HVAC didn't work in ou room, it took 2 techs to fix it until 1:00am but we eventually were able to cool it down. Our room was small and a bit dated, but the Concierge made up for other shortcomings, they were great!"
11933437,430,WillieP,5,5,5,5,5,6,3,FALSE,FALSE,2,"Atlanta, GA",10/2012,10/24/2012,TRUE,Great location,4,FeaturesGreat!!,"Great location, staff and facilities were all very nice. Great stay!!"
11933438,214,Bat1,4,4,4,3,3,,6,FALSE,FALSE,1,,10/2012,10/24/2012,TRUE,,,Palo Alto,"It seems strange that you still charge for WiFi, parking and breakfast."
11933639,127,kj2235,5,5,4,5,4,,1,FALSE,FALSE,2,,10/2012,10/24/2012,TRUE,,,no free WiFi,Overall hotel is great. Disappointed about no free WiFi in the rooms. Had to pay $12 a day for basic WiFi in room.
11933744,468,SedonaAlan,5,5,4,5,5,4,8,FALSE,FALSE,2,"South Florida, Florida",10/2012,10/24/2012,TRUE,An excellent choice when staying in Disney World,3,BILLING ISSUES,"The staff, the facility, the room, and everything was perfect until I reviewed my bill before checkout. I was billed substantially more than my confirmed reservation rate, which I do not understand. Even though I was able to show my confirmed rate in an email, I still felt like I had to fight with both the girl at the desk AND the resevation person that the girl at the desk was on the phone with (she would not let me speak to them directly) for over 20 minutes before the went ahead and did the credit. I do not know how it happened in the first place..."
11933752,196,ChadVstl,5,5,4,5,5,3,6,FALSE,FALSE,2,"St Louis, MO, USA",10/2012,10/24/2012,TRUE,GREAT LOCATION,3,Family Weekend Getaway,Came in town for a family weekened getaway. Great hotel in the heart of Chicago where you want to be! We were able to check in early (10:45am) on Friday with a great view of Navy Pier and the lake.
11933764,1124,Henry19,5,,,,,,7,FALSE,FALSE,1,,10/2012,10/24/2012,FALSE,Friendly Staff everywhere in the hotel,,Awesome Hotel & Service,This hotel experience was great from beginning to end. Front Desk is very friendly and informative about the area. I had many questions and they were very patient and helpful with all my needs. They had 2 shuttles and they were both very busy but Derrick was extremely polite and took us exactly where we wanted to go. The entire weekend was fabulous! Thank you for being such a great hotel.
11933771,1428,Eddie4,2,2,3,3,1,4,7,TRUE,FALSE,1,Maryland,10/2012,10/24/2012,FALSE,"Food & beverage highly overpriced, even for the NY location.",2,Needs Improvement,"Room locking mechanisms don't work properly, takes several attempts to get into the rooms. Shower doors don't work and no place for your shampoo, etc. Lighting bad in the room. Food & beverage prices unusually high and poor quality. Waited 1 hour after seating to be served breakfast, only 2 other tables were occupied."
11933833,3207,Kegger74,5,5,5,5,5,5,4,FALSE,FALSE,2,"Sulphur Springs, TX 75482, USA",10/2012,10/24/2012,TRUE,Front Desk Staff is amazing.,2,This hotel goes above and beyond,"I have been staying at this hotel 3 to 4 nights a month for the last several months while in Dallas on business. They have never let me down. If there is an issue of any kind, it was taken care of immediately. The associates at the front desk are always friendly. The rooms are very nice, very clean, and the ammenities are substantial. This is a great hotel and always my first choice when I come to Dallas for business."
11933987,3052,RM51,4,4,4,5,5,5,6,FALSE,FALSE,2,"Las Vegas, NV, USA",10/2012,10/24/2012,TRUE,,4,Tribecca Treasure,"There are several choices in the SoHo/Tribecca areas of New York. For the location, the amenities, and the value, you can't find a better place than the Belvoir Tribecca. The rooms are nicely sized. The restaurant is great. The coffee shop provides excellent, rather low-cost options. The staff is very helpful. The only drawback is the busyness of Canal Street and the proximity to the entrance to the Holland Tunnel. Broadway, a short walk from the hotel, provides great shopping options compared to the ""bargains"" on at Canal Street Shops. We look forward to our next visit."
11934001,468,mujd96,2,3,3,3,2,3,7,FALSE,FALSE,2,"Jacksonville, FL, USA",10/2012,10/24/2012,FALSE,,2,This hotel desperately needs a makeover,"The hotel is extremely dated--looks like nothing has been done since 1985. The rooms don't have a luxurious feel at all. The bathrooms are very small and the finishes are not good. Given the number of different properties in the same area, I would never choose to stay at the Dolphin again."
11934402,171,rock01,5,5,5,5,5,6,5,FALSE,FALSE,2,"Indianapolis, IN",10/2012,10/24/2012,TRUE,Location,1,EXCELLENT LOCATION,A great experience. Hotel was easy to find and conveniently located. Left my car in the parking garage for four days because I didn't need it to go anywhere because of the location of the hotel. Rooms were clean and well equipped. Staff were friendly and readily available. Far exceeded my expectations.
11934431,1135,Laura84,5,5,5,5,5,2,5,FALSE,TRUE,2,"Los Angeles, CA, USA",10/2012,10/24/2012,TRUE,great atmosphere,4,wonderful hotel,"i had the pleasure of staying at the delfina for my best friend's wedding. while we were getting ready for the ""big day"" the staff could not have been more accommodating and helpful with any requests we had (from ipod speakers to scissors, etc). the hotel decor was stunning - perfectly modern and stylish yet confortable. the rooms and the view were gorgeous as well. i would definitely reccommend this hotel and can't wait to stay there again some day."
11934537,421,Debra9,3,3,3,4,4,5,8,FALSE,FALSE,2,PA,10/2012,10/24/2012,TRUE,"Check-in is very slow. I always have to wait for at least 15 minutes. There seem to be only 2 agents on duty most afternoons, which is insufficient for this busy hotel.",1,Close to things I enjoy,"The location can't be beat. It's within walking distance to theaters, Broadway, Central Park, Radio City, Lincoln Center, Rockefeller Center, Fifth Avenue. There are many good restaurants also within walking distance."
11934609,713,Bob331,5,4,5,5,5,6,3,FALSE,FALSE,2,"Henryville, IN, USA",10/2012,10/24/2012,TRUE,The management and staff are exceptional.,3,"The location, facilities, and staff at the Belvoir Uptown are outstanding.","This is the second time in four years that our organization has held its meeting at the Belvoir Uptown. We returned this year because of the experience we had in 2009. The location, the facilities, but most of all the management and staff, from booking, banquet, registration, bar and restaurant, to housekeeping, everyone was courteous and professional. Our group of fifty was treated as if we were a group of five hundred."
11934776,1144,Dee447,5,5,4,5,5,4,5,FALSE,FALSE,1,"Berlin Charter Township, MI, USA",10/2012,10/24/2012,TRUE,Great location,,Comfort,One of the most comfortable beds I have ever slept on. Facility was impecably clean. Would recommend this hotel!
11934898,350,LocalAlaskans,5,5,4,5,5,4,8,FALSE,FALSE,1,"Eagle River, Anchorage, AK 99577, USA",10/2012,10/24/2012,TRUE,The junior suite was well worth the cost.,2,Beautiful suite!,"We stayed in the junior suite and it was fabulous! Very clean, spacious and luxurious. We visited the lounge and it was cozy and we received great service. The only negative I could say is that we didn't get our coffee or orange juice that we ordered from room service but everything else exceeded our expectations. We will definitely stay there again."
11934926,1469,Morty,5,5,5,5,5,6,6,FALSE,FALSE,3,California,10/2012,10/24/2012,TRUE,A delightful place to stay in a great location.,4,Great place to stay in every way!,"The Belvoir Kona Resort & Spa at Keauhou Bay offered just what we were looking for in a great location, beauitful views, great service and a clean/spacious room. Ray's on the Bay was a relaxing place to have coctails and dinners and to meet fellow guests to share Hawaii experiences."
11934999,421,cook123,5,5,4,5,5,3,5,FALSE,FALSE,2,"New York, NY, USA",10/2012,10/24/2012,TRUE,Great location! Great rooms.,2,Great Night's stay,"I booked this hotel for only night. Wish it had been two. It was wonderful. From the reservation's department which helped me find the best rate, to the check in to check out."
11935158,713,JasonW88,5,5,5,4,5,,4,FALSE,FALSE,2,"Tucson, AZ, USA",10/2012,10/24/2012,TRUE,"Great location, clean and friendly staff.",,Great Location,The Belvoir is well located with easy access to shops and businesses. The hotel is well maintained with clean rooms and very comfortable beds and pillows. I highly recommend staying at this comfortable Belvoir
11935297,3068,Veet12,5,5,5,5,5,6,5,FALSE,FALSE,1,,10/2012,10/24/2012,TRUE,,2,This hotel is very nice,We enjoyed our stay at the Belvoir. Everything was beautiful.
11935310,867,Eagle61,5,5,5,5,5,6,6,FALSE,FALSE,3,,10/2012,10/24/2012,TRUE,Outstanding!,2,Outstanding!,Outstanding hotel! Outstanding staff!
11935598,196,dlw59,5,4,5,5,5,4,8,FALSE,FALSE,3,"Albuquerque, NM, USA",10/2012,10/24/2012,TRUE,Fantastic location and very warm atmosphere.,2,Fantastic stay,Check in by Olga was extremely welcoming. Felt truly appreciated as a Grandbourne member & customer. Room was lovely and location of the hotel is perfect for walking around the city. Hotel feels very warm and comfortable and all staff we encountered were so hospitable and nice.
11935695,380,Kimbosky,2,3,2,2,1,3,3,FALSE,FALSE,3,"Dallas, TX, USA",10/2012,10/24/2012,FALSE,bring air freshener,4,Watch your luggage!,"This is by far the worst Grandbourne property I've ever stayed at. I am a BPG but recieved no recognition. We dropped our luggage at the curb as instructed by the bellman with the promise it would be delivered to our room. That was at 9:30am...came back at 4pm to no luggage. Searched the store rooms and no luggage. WE did find it...on the curb...where we had left it 6 1/2 hours earlier. The first room they put me in was supposed to be ""partial ocean view"", yet had a view of a mountainside...oppisite view of ocean. The TV was positioned around a corner from the bed whereas you could not see it laying in bed. There weren't even chairs in the vicinity of the TV. I convinced them to change my room to the one I reserved...the partial view."
11935752,392,rodpearson,4,4,5,5,4,,5,FALSE,FALSE,2,,10/2012,10/24/2012,TRUE,Great location for sporting events/convention center events,,SF NDSU Game stay,"Hotel location, staff and food/bar were excellent. Room was very clean BUT we had a Hospitality suite that had only a bed, tv stand, desk with chair and one wooden chair."
11935754,865,brekke,4,4,5,3,4,5,5,FALSE,FALSE,1,"Parsippany, Parsippany-Troy Hills, NJ 07054, USA",10/2012,10/24/2012,TRUE,don't pay for the breakfast buffet! not worth the price.,2,Cavalier show,"Your hotel was lovely, and met or exceeded my expectations for my room, and our club's use of the ballroom, etc. I would say that my only dissappointment was the food. My one time at the breakfast buffet was a real dissapointment - $21 just for me, and the food was well below average even that you would get for a free breakfast in some other hotels. I attended our club's gala event, and since i had waited in line for 20 minutes at the cash bar, I ended up at the end of the food line. imagine my surprise when most of the food was GONE! Unacceptable. the taste was average, selection not up to par."
11935922,468,Kate4130,4,4,5,4,4,3,8,FALSE,FALSE,2,"Skippack, PA, USA",10/2012,10/24/2012,TRUE,Location! Walk to Epcot and Hollywood Studios or take the boat.,3,Location,"Stayed there over a long weekend to enjoy the Food and Wine Festival. We walked to the boardwalk and Epcot, boat to Hollywood Studios. The grounds and public spaces very clean and inviting. The staff from the housekeepers to the front desk to the restaurant bartenders all very friendly."
11935985,1774,madtown99,3,4,4,3,4,,6,FALSE,FALSE,1,"St Paul, MN, USA",10/2012,10/24/2012,TRUE,Great location,,Overall good stay,"Paid for a lake view and were very disappointed/confused as to how our 2nd floor room was classified as a lake view. Looking straight at the window was the 2nd story of a building directly across the street. The small sliver view of the lake was only visible when sitting on the far side of the window and looking out at a 45 degree angle. Not major, but were also shorted clean towels and didn't have garbages emptied on last day before checkout, which has rarely happened in previous hotel stays. Rest of room and hotel was very nice as expected for the price we paid. Front desk staff were very helpful and location was very good."
11936245,1569,Pontellier,4,5,5,5,5,,6,FALSE,FALSE,2,,10/2012,10/24/2012,TRUE,,,"inexpensive, well loctaed",Good tip is to stay on the upper floors with view of fireworks; request it. Nearby restaraunts on Katella like PF Changs and Cheesecake and CPK. City sponsored bus that takes you to Disney is supposed to pick up every 20 minutes but I found it to be very unreliable. Service in the adjoinging restaraunt is friendly and efficient food is ok-good but nothing special.
11936307,270,janicet,3,3,3,4,3,3,8,FALSE,FALSE,2,"New York, NY, USA",10/2012,10/24/2012,TRUE,,3,BOULEVARDS REVIEW,"My husband and I stay at the Belvoir at least once a year and has always been a wonderful experience. This past weekend was a pleasant one, but not like the past. The sheets and pillow cases were like plastic and the bed not as cozy. What really took me by surprise was the breakfast at the Boulevards Cafe. The restaurant was so dirty and each time the waiter tried giving me a new cup of coffee there was always something floating in the cup. I was quite surprised at this since your hotel is a class operation. I hope in the future something will be done to resolve the cleaniness and better quality of the food. This should be addressed ASAP !"
11936312,434,PattyCake99,4,3,3,5,4,5,5,FALSE,FALSE,1,"Alexandria, VA, USA",10/2012,10/24/2012,TRUE,"It does not have cable TV, on Digital and Analog.",1,First Impression,"The negatives: The parking space in front of the hotel entrance to check in an unload was extremely tight for vehicles; I got stuck in the elevator on the thirteenth floor; and no cable TV in the room, only Digital and Analog."
11936323,691,BackDoc5219,5,5,,5,5,5,3,FALSE,FALSE,2,Chicago,10/2012,10/24/2012,TRUE,Beautiful and clean - way above normal,3,Exhibitor review,Great facility!
11936558,760,Dodge76,5,5,5,5,5,5,8,FALSE,FALSE,2,"Tampa Bay, FL, USA",10/2012,10/24/2012,TRUE,Location,2,Great Trip,"Drove to Key West from Tampa Bay. This place is away from all the noise and traffic of downtown Key West. Shuttle bus takes care of all the driving. Took us to and from every 30 minutes. The rooms are large, clean and up to date. The pool and staff are great. Will return again. Thanks Mr. ED for not leaving us !!!!"
11936679,3052,Chaim,4,4,4,4,5,5,5,FALSE,FALSE,2,"Munster, IN, USA",10/2012,10/24/2012,TRUE,,3,This hotel is in the heart of China town. Inside is nice and very functional. The staff was responsive. Although I did not get the privilege of usi,Although I did not get the privilege of using the Lounge as expected (BPG Preferred Member) I was given a complimentary breakfast on the day of departure. Thank you.
11936703,196,cabo99,2,4,3,3,2,4,2,FALSE,FALSE,4,"Chicago, IL, USA",10/2012,10/24/2012,FALSE,They stop serving food from 2-5 ? I do not understand this... Long wait to check in,4,needs improvement,2:00 PM on Saturday afternoon I was unable to get any food to eat. i was told all facilites stopped serving food EVEN ROOM SERVICE?? I have traveled the world over and have never been to a hotel where I could not get something to eat; especially at 2 in the afternoon! Our bill was wrong and at checkout we had to wait in line for 20 minutes just to get it corrected!
11936812,468,Jennie10,5,5,5,5,5,4,6,FALSE,FALSE,2,"Cape Coral, FL, USA",10/2012,10/24/2012,TRUE,,4,Never Disappointed,We have stayed so many times and will continue staying here when ever possible
11936887,691,Doc13,3,5,2,5,3,5,3,TRUE,FALSE,2,AZ,10/2012,10/24/2012,TRUE,,2,Beautiful facility.,The restaurant staff either needs more help or needs to be trained properly. The food was cold when delivered and I asked for water three times and never got it!
11936910,90,KTTMedia,5,5,5,5,5,3,6,FALSE,FALSE,2,"Chicago, IL",10/2012,10/24/2012,TRUE,Rooms are spacious and beautiful,4,Loved your Location,It was easy to get in and out of DC and Northern Virginia via Metro. Your shuttle service from Reagan Airport was excellent.
11936984,1135,Patty50,4,4,4,4,4,5,6,FALSE,FALSE,2,Illinois,10/2012,10/24/2012,TRUE,Very Nice.,2,Hotel is an excellent location,Staff is very welcoming and accomodating.
11937274,1474,dogmom510,5,5,5,5,5,3,8,FALSE,FALSE,1,"Chattanooga, TN, USA",10/2012,10/24/2012,TRUE,,1,The hotel was very clean and comfrontable.,"The staff was very nice and helpful. The room was small, but clean and comfrontable for two people."
