reviewID,hotelid,userName,overall,roomComfort,staffMetNeeds,cleanRoom,facilitiesMetExpectations,ageRangeID,tripPurposeID,travelAgent,meetingPlanner,BPGStatusID,guestFrom,arrivalMonth,datePosted,recommend,everyoneShouldKnow,frequencyID,title,comment
11388338,881,Sonics96,5,5,5,4,5,4,4,FALSE,FALSE,4,"Issaquah, WA, USA",9/2012,10/1/2012,TRUE,Near the airport,3,"Great service, comfortable stay.","Great service, comfortable stay."
11388378,430,Locust,3,4,5,3,3,4,2,FALSE,FALSE,3,IL,9/2012,10/1/2012,TRUE,Usually good hotel.,4,Good facility,"Usually great rooms and service. This time however the room had a odd smell, plaster over dry wall was peeling and area's of missin plaster. Mold on some area of old pink tiles in the shower"
11388523,1959,TamTam4,4,5,5,5,5,3,5,FALSE,FALSE,3,"San Diego, CA, USA",9/2012,10/1/2012,TRUE,Super location and great staff!,3,Booked for my bridal suite,"The junior suites are an excellent size. Plenty of room for my bridal party and it was close to my venue. The beds rock and the kitchen is a nice size as the living room. Staff was accommodating and friendly. Great location to shopping. Parking is a ripoff for the price you pay for a room.. Park on street if possible, as we did and its free."
11388582,1162,OnTheGoInTheKnow,5,5,5,5,5,3,8,FALSE,FALSE,3,"Tampa, FL, USA",9/2012,10/1/2012,TRUE,Great customer service.,4,It's All Good,I can't say enough good things about this resort. Thanks to the entire staff!
11388601,421,Jukebox,5,5,5,4,5,5,6,FALSE,FALSE,3,"Milton Keynes, UK",9/2012,10/1/2012,TRUE,Proximity to Times Square,1,Great location and well appointed,"We were checked into the hotel very quickly, and soon began exploring the city. The proximity to Times Square, Broadway and Central Park were all excellent. It was also quite exciting having ex President Clinton, Hilary Clinton and Mitt Romney in the hotel during our stay. We would definately stay at this hotel again!"
11388701,434,dsmini1229,4,2,5,3,5,5,8,TRUE,FALSE,3,"Ridgeway, VA 24148, USA",9/2012,10/1/2012,TRUE,The staff is very friendly,2,dsmini1229,"Let me start off saying that I really like Belvoir. The room at Downtown Raleigh, NC was not the standard. The carpet had soild spots and the room need to be dusted.I had two of every thing but bottle water and yes it is the little thing that count."
11388741,377,myfab50,5,5,5,5,5,4,6,FALSE,FALSE,2,"Sydney NSW, Australia",9/2012,10/1/2012,TRUE,"This hotel has something that should appeal to all. It's great for couples, families, singles, small groups, large groups",1,This hotel has an amazing atmosphere,We stayed at the Belvoir Waikiki in September and were instantly thrilled with what we saw. From Elaine who checked us in with her friendly yet professional manner to the sheer size and buzz of the hotel. All the staff we encountered were always happy and very helpful and made us feel at home. We will definitely be returning to the Belvoir Waikiki on our next vist...and hopefully that won't be too far away as we miss it already!
11388761,814,rick1745,3,4,2,4,2,5,1,TRUE,FALSE,1,"Mobile, AL, USA",9/2012,10/1/2012,FALSE,,2,rooms nice but,"Breakfast at the Aqua VI resturant was cold, Service was below average. Had unreasonalby long wait for food delivery."
11388965,1113,kaz1958,1,2,1,1,1,4,4,TRUE,FALSE,1,,9/2012,10/1/2012,FALSE,"It is not an ""A"" rated Belvoir Hotel",4,Dissappointed,"Upon arrival I had to wait 10 Minute for the front desk staff. (I was the only one there). Room had a stained dirty carpet, but it was vacuumed. There was glass ring stains on the countertops, bathroom counter was stained. Bed sheets were down halfway on the sides of the mattress. It took 3 tries to get someone from the front desk on the phone. There was a $10.00 fee to use the internet. Cup of yogurt and a muffin for breakfast cost me $15.00. Disappointed"
11388978,992,Wharton101,4,4,4,3,3,,3,FALSE,FALSE,1,,9/2012,10/1/2012,TRUE,,,This hotel is in a great location,This hotel is conveniently located on the Penn campus; close to restaurants and the school locations I was interested in.
11389283,94,Keith77,5,5,5,5,5,3,3,FALSE,FALSE,1,,9/2012,10/1/2012,TRUE,Beautiful rooms,1,Rooms are amazing,"Staff was great, Room was a pleasure to come back to every night. Staff was help full. Hotel was always clean."
11389441,468,kdkdkd,4,4,5,5,5,,3,FALSE,FALSE,1,,9/2012,10/1/2012,FALSE,,,Temperature,The service was wonderful. The temperature throughout the hotel was freezing. More than one person in our group came back sick.
11389679,606,Hle42,3,2,4,3,3,3,3,FALSE,TRUE,1,"Eliot, ME, USA",9/2012,10/1/2012,FALSE,,2,"good facility, marginal rooms","While the location of this facility made it a good choice, and the friendliness of the staff was commendable, the rooms were cramped and musty smelling. We were given basement rooms and the bathrooms had no fans, which, I am sure, accounts for the damp, musty atmosphere in our rooms. Not up to Belvoir caliber!"
11389722,1726,Chuck56,5,5,5,5,5,5,3,FALSE,FALSE,1,"Greenville, SC, USA",9/2012,10/1/2012,TRUE,The Belvoir really wants your business and does a lot to make you feel comfortable.,3,This hotel has great service.,"Friendly, courteous, helpful staff. They bent over backwards to make us feel welcome. It seemed like there wasn't anything that they wouldn't do to make our stay more enjoyable!"
11389938,353,massemail,4,5,4,3,5,4,3,FALSE,FALSE,1,"Houston, TX",9/2012,10/1/2012,TRUE,Most everyone was very friendly,2,Very nice,"The room was very updated and modern; comfy. The lights went out in the bathroom early one morning, and they were repaired within 20 minutes of calling. Housekeeping neglected to leave towels one morning and when we asked one of the cleaning ladies in the hall for two towels, she was rude and basically accused us of stealing the towels out of the room. One of the cleaning people also left a snickers wrapper and crumbs on the night stand, and it wasn't our snickers bar."
11390223,743,jhay32,5,5,5,5,5,4,3,TRUE,FALSE,2,"Kansas City, MO, USA",9/2012,10/1/2012,TRUE,Great Food at your restaurant and bar,3,Belvoir DFW,Everything that was asked for was provided for the conference. Had problems with my TV and it was taken care of within minutes of arrival. Great hotel.
11390278,1995,TCHiggins,2,2,3,3,2,5,4,FALSE,FALSE,4,"Dallas, TX, USA",9/2012,10/1/2012,FALSE,It is old and needs renovation.,4,This Hotel needs work,"I stayed on the 10 th for three different stays and 2 different rooms. Both rooms smelled old and like a locker room after the first day of each stay. The linens were clean but the room clean up was bad. One day they left all the breakfast stuff that I had clearly finished...empty yogurt container, empty cereal bowl, banana peel, and emplty coffee. Also, once I used the cleaning bag once it was never replaced. The gym had machines that didn't work and TV's on the machines that didn't work."
11390344,33,Scott101,2,1,4,4,1,3,4,FALSE,FALSE,1,"Baltimore, MD, USA",9/2012,10/1/2012,FALSE,,1,loud and cold,"I had to move to another room due to the noise of people talking in the next room. I do not recommend a room with an adjoining door. Also the heat did not come on all night, very cold."
11390359,1751,Fiona12,5,4,4,4,4,,3,FALSE,FALSE,2,,9/2012,10/1/2012,TRUE,,,Nice stay,I was in town for a conference. The hotel is in a great location. The staff is friendly and the room was clean.
11390368,353,LD05891,4,5,3,5,5,4,1,FALSE,FALSE,1,"Tupelo, MS, USA",9/2012,10/1/2012,TRUE,It is a beautiful hotel,,The elevator system is great,The room was great. The only thing that I didn't like was checking in. I requested a certain type of room when I made my reservations. W hen I checked in my request had not been taken care of. They finally got it fixed but I shouldn't of had that issue. They also held a certain amount on your card which was not told to me in advance.
11390371,48,11111,2,2,5,4,3,3,3,FALSE,FALSE,2,,9/2012,10/1/2012,FALSE,"Hotel needs to be updated,",3,service manager,"If you are to walk around the Hotel and take note, 1. wall peeling in many areas, 2. lots of water damage to ceiling and walls, 3. Windows are very dirty. And one big thing is the sheets do not fit the beds as you sleep the sheets bunch up under you? Very uncomfortable, this was the case with several of other people I had spoken to in my meeting. I hope this helps"
11390402,83,babe60,5,5,5,5,5,5,5,FALSE,FALSE,2,"Los Angeles, CA, USA",9/2012,10/1/2012,TRUE,the staff was very friendly room was clean,4,Our Great Experience,My Husband and I had a great experience. The staff was very helpful. We plan to be back in November.We are sure that we will have the same treatment.
11390430,1995,ACWalker70,4,3,3,5,5,2,2,FALSE,FALSE,2,"Cleveland, OH, USA",9/2012,10/1/2012,TRUE,,2,Shower's Disappointing,"Most of the room was great. However, for me one of the most important things is being able to take a nice shower after a day on the road. The shower heads were unsatisfactory and not up to the level of the rest of the hotel and room. There was also some issues in the Dog & Pony on Sunday night. A number of people came down to get dinner/drinks and watch football. There was only one member on staff and he was clearly overwhelmed. I also ordered the Skirt Steak Chimichurri off of the menu. I have been a chef and know cuts of meat and what I received was not skirt steak. The meal was disappointing from that aspect."
11390477,341,fitclawj,5,5,5,5,5,5,4,FALSE,FALSE,2,la,9/2012,10/1/2012,TRUE,vehicles are safe when left overnight,2,Just a great place to stay!,"Breakfeast in Great, rooms are well kept, clean, vehicles are safe when left overnight"
11390497,196,nofx911,5,5,5,5,5,2,4,FALSE,FALSE,3,"Milwaukee, WI, USA",9/2012,10/1/2012,TRUE,,2,Great Hotel,Stayed here for night after a meeting. Great hotel and friendly staff!
11390514,1124,sue0528,5,5,5,5,4,4,3,FALSE,FALSE,1,"Chapel Hill, NC, USA",9/2012,10/1/2012,TRUE,Staff was very pleasant and helpful!,2,Very Pleased,The first night of my stay there were some problems. Management responded quickly and provided me with another room. Staff and facilities were great!
11390516,1144,Atlantavisitor,4,4,5,4,3,5,3,FALSE,FALSE,2,Alabama,9/2012,10/1/2012,TRUE,Nice location during day; not as safe after dark,2,Conference Visit with Spouse,"Wife was staying here for a conference. I tagged alone to get some writing done. Stayed in room on Club Level. Room was average. Club lounge was staffed by some very attentive employees (the highlight of the stay) but did not have the level of amenities I expected. Also, It seemed that many people not staying at club level were accessing the lounge and carting away food. The hotel is a very good mid-level choice. The only caveat is that at night the location is quite unsafe. But, during the day, it is in an area near very fine restaurants and attractions, e.g., the Atlanta Aquarium."
11390589,1469,Lucy59,5,5,5,4,5,5,7,FALSE,FALSE,1,"Kailua-Kona, HI, USA",9/2012,10/1/2012,TRUE,"Wonderful staff, wonderful views.",2,Hotel made our vacation!!,"The staff, the scenery, the whole experience was above expectations."
11390626,855,suysd1144,4,2,5,3,3,5,5,TRUE,FALSE,3,"Bloomfield Hills, MI, USA",9/2012,10/1/2012,TRUE,Staff is very professional,4,Hotel has great staff,"This hotel is in need of updating. However, the staff far exceeded expectations in every department. This made the difference."
11390716,40,2012chicago,4,4,4,4,4,4,6,TRUE,FALSE,2,"Mesa, AZ, USA",9/2012,10/1/2012,TRUE,"Good location, nice facility",1,My Review,The only comment I would make is regarding parking. I find it difficult to look and see an empty parking lot around the hotel that costs $12.00 per day to park in and parking a block away for free in another parking garage. Seems not quite right in my opinion.
11390831,392,Restless,4,4,5,5,4,4,3,FALSE,FALSE,1,"Sioux Falls, SD, USA",9/2012,10/1/2012,TRUE,,2,Top sheets,"The top sheets were so noisy!! ( to much starch). Roommate and i were afraid to move in our beds, afraid we would wake each other up."
11390997,1725,leandro13,5,5,5,5,5,6,6,FALSE,FALSE,2,"Miami, FL, USA",9/2012,10/1/2012,TRUE,,3,excelente,"this hotel is verry good location, the personal is excenten and all is good"
11391252,914,Bill9720,5,5,5,5,4,5,6,FALSE,FALSE,3,"North Carolina, USA",9/2012,10/1/2012,TRUE,Great location,2,bill9720,Location on Sand Key is great. Pool a little small but this time of year plenty of room and the beach was great. Staff could not have been more accommodating and friendly. Almost everyone of them actually had conversations with us when approached and not simply answered questions. Food at Rusty's outstanding as was service
11391269,1995,PF2012,5,4,5,4,4,5,3,FALSE,FALSE,2,PA,9/2012,10/1/2012,TRUE,,2,September 2012 Stay,"I stayed at this hotel for 2 nights and i would highly recommend it to anyone. The staff were great and friendly and very helpful. The rooms, including conference rooms were great. The food was also good. This hotel was also in a very good location right off the PA turnpike and near local shopping. It was very easy to get to."
11391480,1124,Legs,5,5,5,5,5,4,1,TRUE,FALSE,2,"Chapel Hill, NC",9/2012,10/1/2012,TRUE,Comfort,4,Ms. KH,The Belvoir Hotel is an awesome place to stay. I would recommend this hotel to any of my family * friends.
11391821,96,Grant47,5,5,5,5,5,6,3,FALSE,FALSE,3,"Charlotte, NC, USA",9/2012,10/1/2012,TRUE,Clean and well maintained exercise room,3,Pleasant Surprise,Friendly staff and excellent location provided us with a most pleasant surprise during our business trip to downtown Dallas.
11392130,1236,ProjectDirector2,5,5,5,5,5,5,3,FALSE,FALSE,1,Ohio,9/3012,10/1/2012,TRUE,,3,conference,The hotel was very convenient for my needs.
11392199,430,shalala2002,2,4,2,1,1,4,3,FALSE,FALSE,2,"Sacramento, CA, USA",9/2012,10/1/2012,FALSE,,4,Cleaning needs to be improved,I stayed at this hotel for a trade show/conference.
11393222,460,Loni123,4,5,2,5,5,5,4,FALSE,FALSE,2,"New Orleans, LA, USA",9/2012,10/1/2012,TRUE,,4,Disappointed in Customer Service,"Hotel was nice, I did have a problem with the front desk. My luggage was lost by the airline. When the airline called me @ 11:30 PM and told me it was on the way, I called the front desk and asked them the PLEASE call my room when the luggage arrived. Of course they did not do that and I had a very restless night worrying about my luggage, all the time it was downstairs....not good customer service at all"
11393668,434,COB42,3,2,5,3,4,3,4,FALSE,FALSE,3,"Raleigh, NC, USA",9/2011,10/1/2012,TRUE,,4,"What happened to ""you belong?""","Over the past 10 years, I've really enjoyed staying at this property. However, because the turnover is excessive, it is rare to see a familiar face at check-in or during my stay. Therefore, if there are issues that need attention, you are generally not treated as a loyal patron unless a certain customer service/front desk manager is on duty. For the most part, the newly hired front desk staff are friendly and courteous; however, if customer service/front desk managers are rude and uncompromising, the front desk staff will think it's okay to treat patrons that way. I realize that customers are not always right, but loyalty should always be considered."
11393758,606,SuzyQ32732,3,3,2,3,3,5,4,FALSE,FALSE,4,"Orlando, FL",9/2012,10/1/2012,TRUE,Customer service,4,Employees are the Key,"With the exception of one employee, all your employees are exception and very customer oriented. Your staff, especially those who drive the shuttle, have been very kind to me and have gone out of their way to excel in customer service."
11393794,48,stiksnbricks,2,2,2,1,1,,4,FALSE,FALSE,3,"Chicago, IL, USA",9/2012,10/1/2012,FALSE,They charge you for parking but do not tell you beforehand!,2,Do not stay at this Belvoir,"This hotel charges you for parking but does not disclose the same behforehand. In addition, the hotel is VERY tired and clearly in need of ""refreshment."""
11394307,196,BEARS54,4,4,4,4,4,4,6,FALSE,FALSE,2,"Las Vegas, NV, USA",9/2012,10/1/2012,TRUE,"Services was great, location great. Cost was good",3,FAN,"Come to town every year for Bear's game, but never stayed here before. Now that we Have will make this our hotel of choice. Location is great, service also great"
11394411,1469,Ku6883,5,5,5,5,5,,8,FALSE,FALSE,2,,9/2012,10/1/2012,TRUE,,,Awesome Resort,Stayed at this resort for 2 nights.. It's a beautiful resort.. the staff is friendly.. the amenities are nice.. overall its a beautiful resort to spend time with family & friends :)
11394557,1726,giantoad,5,5,5,5,5,5,2,FALSE,FALSE,2,"Fleetwood, PA",9/2012,10/1/2012,TRUE,"Friendly people, great facilities, reasonable cost.",2,Good service. Nice hotel.,"This was my second stay at the hotel. It's nicely appointed, clean, and the service was great!"
11394623,460,havebusinesswilltravel,1,4,1,4,4,2,4,FALSE,FALSE,4,Utah/Cali/Wa,9/2012,10/1/2012,FALSE,"The service is terrible. If you like BPG properties dont stay here, it will sour you to the entire brand.",4,"Nice hotel, Nice location, Terrible service.","Shame on me but I thought we would give the Seattle Belvoir another try. It seems like every time we stay here its something. I generally have a good stay at Belvoirs, and I am a platinum Grandbourne member so obviously I stay at Grandbourne quite a bit. All that being said I will NEVER stay at this hotel again unless God forbid its the only option, then I will dread every moment leading to the stay. I booked a room at this hotel for 4 nights. At check in I was thanked for my platinum status but not offered a welcome gift, (points, etc.) and I was told we were in a room with a double bed. I was traveling with my wife, kids stayed home, so I asked for a king bed. The staff looked at the computer and said ""I am sorry sir, but our king rooms are totally sold out for the entire length of your stay I found this hard to believe so I asked, are you sure? ""Yes sir, totally booked so I pulled up my BPG mobile app and checked, there are all kinds of king rooms available. I show the gentleman what about all these king rooms, I can get online and book one right now that is available. Now I am pretty calm, but I was pretty irritated that I had been lied to. The desk person says ""let me check"" goes back behind the check in wall and comes back and says ""we can put you in a king room Honestly? After all that? Most hotels make me feel like staying exclusively at Grandbourne properties is a good idea and take care of us; The Belvoir downtown Seattle always, Always makes me regret it. Do yourself a favor and book a different BPG property."
11395073,3205,OkieGal,4,5,4,5,4,3,3,FALSE,TRUE,2,"Oklahoma, USA",9/2012,10/1/2012,TRUE,convenient location to downtown Denver,2,First timer =),"First visit to Denver at this hotel, I loved it and would surely return. The room was enormous and cozy. The staff are very helpful and polite, especially with the extra coffee I requested. About the only downside is, I chose the option to go GREEN, opt for the Grandbourne points, but have yet to receive them. The meeting rooms are spread out, had a time locating them."
11395221,353,Irene10,4,4,4,4,3,6,3,FALSE,FALSE,2,,9/2012,10/1/2012,TRUE,,3,Trip To New Orleans,"Toilet in our room did not flush properly. Also was remodeling, but otherwise everything was very nice."
11395565,1727,JTSLAS,4,5,5,5,5,5,4,FALSE,FALSE,2,"Las Vegas, NV, USA",9/2012,10/1/2012,TRUE,Hard to find due to 1 way streets,2,Hotel in brooklyn,"Great area, safe, all accommodations and locale were excellent."
11395598,392,HaroldNASA,5,5,5,5,5,6,3,FALSE,FALSE,4,"Washington, DC, USA",9/2012,10/1/2012,TRUE,Great Location,4,Always a great stay,"I was upgraded to theClub floor (rm 624); and though it was a very nice room, the desk space was limited and I had to use the bed as additional work space. On future visits, I will remember to ask specifically for a room with a large desk area."
11396538,1552,jackson8888,3,4,2,5,3,6,6,FALSE,FALSE,3,tucson az,9/2012,10/1/2012,FALSE,,3,pet policy,found no info on pet except that your hotel was pet friendly was informed upon arrival that i was to be charged $150.00 non refundable deposit.asked to see policy agents could not find it on websight manager was called and showed me whare it was buried in websight however now when i look back i still cant find it. i do look for these things prior to booking and think they should be more prominate.
11396613,3068,FiftyPhil,5,5,5,5,5,4,7,FALSE,FALSE,1,"Houston, TX",9/2012,10/1/2012,TRUE,,1,Great experience,Execellent bar staff and hostesses.
11396727,33,NAPM,4,5,3,5,3,3,5,FALSE,FALSE,2,"Maryland, USA",9/2012,10/1/2012,FALSE,Hotel nice/ Food and banquet facilities not so good,2,Room was nice but restaurant and banquet facility disappointing!,"The room was nice and comfortable, however I was at a wedding on Saturday and they ran out of food. They then brought food out that was cold. I know they spent allot on the wedding and this was very disappointing. On Sunday morning we went to the breakfast brunch. There was 10 of us. When we arrived they tried seating us at a dirty table. Then when we went to the buffet it was a mess, 1/2 the food was gone, no butter or syrup. We tried to eat the food and couldn't, it was cold and horrible. The manager did offer us to order off the menu at no charge. Just a disappointing stay...Personally I think the kitchen needs a lot of work!"
11396796,1177,buggsey,5,5,5,5,5,4,8,FALSE,FALSE,2,United Kingdom,9/2012,10/1/2012,TRUE,Great service and wonderful location,1,Wonderful and excellent,"This is a fantastic place to stay , the staff were most welcoming and helpful . A special thank you to the manager and staff for making our stay so wonderful .Keep up the lovely work wont hesitate to return or recommend this hotel for future visits."
11396939,1569,KkJj,5,5,4,5,5,,3,FALSE,FALSE,1,"Vancouver, BC, Canada",9/2012,10/1/2012,TRUE,"Welcoming, clean, wonderful hotel, and pet friendly too!",,Great place to stay while at Disneyland,"We very much enjoyed our stay at the Belvoir Park Hotel. The hotel was welcoming and friendly, as well as clean and accessible with so many amenities. Our dogs also stayed with us, and we all enjoyed the wonderful patio area that the Hotel keeps just for guests with pets. Never seen anything like it before. Our wonderful stay at the Belvoir Park made our conference / disneyland trip a real dream come true! Thanks so much."
11397096,127,jackson8888,5,5,5,5,5,6,6,FALSE,FALSE,3,tucson az,9/2012,10/1/2012,TRUE,THE PEOPLE MAKE IT!,3,perfect staff,upon arrival was greeted immediatly with a warm friendly smile and from there on everything was perfect. mark checked us in and mark took our bags to the room from that time on they all used our name whenever they saw us. we went to several Grandbourne properties on this trip but my wife and i decided next time to just stay at your hotel as it had everything especially the first rate service. thank you all
11397278,1978,ABBP,5,5,5,5,5,2,4,FALSE,FALSE,1,"Augusta, GA, USA",9/2012,10/1/2012,TRUE,It is very clean,3,Pleasant Experience,"I enjoyed my stay at the Belvoir Augusta Hotel. The room was clean, spacious and modern. The bed was very comfortable and there were no nasty cracks or mold in the bathroom. The business center was convenient and the computers were fast and well maintained. It was easy to get onto a computer and get what I needed and printed. (Many business centers are run down and pointless). Great staff, friendly and efficient. I just wish they had free breakfast. I will definitely stay there next time I'm in the area."
11397595,33,Germaine47,5,5,5,5,5,4,6,FALSE,FALSE,4,"Baltimore, MD, USA",9/2012,10/1/2012,TRUE,That it is very clean and has a great location.,2,Review of Stay,"I always enjoy staying at this Belvoir when visiting my daughter in college. This property is clean, has everything you need on property, the staff is friendly and welcoming. I enjoyed the Restaurant and breakfast, Carlin was very prompt, attentive and friendly. The guestrooms are very comfortable and clean. No Worries. Great location."
11397856,3205,Webdog44,2,3,3,3,2,3,2,TRUE,FALSE,2,,9/2012,10/1/2012,FALSE,Poor Food,1,Consistently poor conference food,"Four days of business meetings and numerous meal opportunities to rule out any anomalies. Consistently poor quality food across all breakfast, lunch, and sadly, even snack options. Hotel is OK. Location is very good. Food,...not so much. If you are looking for an average hotel in a good area and do not plan on staying here to eat, and the price is right for aforementioned criteria, then this is your hotel."
11398326,1995,JKMDE,4,4,5,4,4,3,6,FALSE,FALSE,2,,9/2012,10/1/2012,TRUE,Pleasant staff,3,On site food,"While staying in the hotel we decided to dine right on location. My fiance and I had been told the steaks were a good choice. Our medium and medium well steaks arrived at our table well over cooked with the side dishes cold. We would stay in the hotel again, but would definatly dine away from the hotel next time."
11398440,1469,Anonymous,5,5,5,5,5,4,6,FALSE,FALSE,2,"Vancouver, BC, Canada",9/2012,10/1/2012,TRUE,The most scenic Hotel property on the Island.,3,KeauHou Bay Area,"Friendliest place we've been. The pool, the views, the property, the staff & with local historic sites on property and nearby."
11398456,1391,Joe01,2,3,3,1,2,4,5,TRUE,FALSE,2,,9/2012,10/1/2012,FALSE,"parking is horrible, and the house keeping should ensure that the room is clean.",3,Wedding night,We arrived around 11:30pm and there was no one at the front desk. We had to wait several minutes for someone to come. and we were gioven a room that was not clean; the bathroom was very dirty.
11398597,377,Katnap,5,5,5,5,5,5,6,FALSE,FALSE,2,"Troy, Ohio",9/2012,10/1/2012,TRUE,,,Best in comfort,Most comfortable mattress and pillows we have EVER had!
